CREATE EXTENSION pg_weave VERSION '0.1.0';
-- wdoc: analysis, output shows terms with term frequencies
SELECT to_wdoc('The quick brown fox, the QUICK fox!');
                      to_wdoc                      
---------------------------------------------------
 'brown':1@3 'fox':2@4,7 'quick':2@2,6 'the':2@1,5
(1 row)

SELECT 'the quick brown fox'::wdoc;
                    wdoc                     
---------------------------------------------
 'brown':1@3 'fox':1@4 'quick':1@2 'the':1@1
(1 row)

SELECT to_wdoc('');                       -- empty doc
 to_wdoc 
---------
 
(1 row)

SELECT wdoc_length(to_wdoc('a b c a b a'));  -- doclen counts tokens
 wdoc_length 
-------------
           6
(1 row)

-- wquery: parsing and canonical output
SELECT 'quick & brown'::wquery;
       wquery        
---------------------
 ('quick' & 'brown')
(1 row)

SELECT 'quick | brown'::wquery;
       wquery        
---------------------
 ('quick' | 'brown')
(1 row)

SELECT '!slow'::wquery;
 wquery  
---------
 !'slow'
(1 row)

SELECT 'quick brown fox'::wquery;          -- implicit AND
            wquery             
-------------------------------
 (('quick' & 'brown') & 'fox')
(1 row)

SELECT to_wquery('(quick OR slow) AND fox');
          to_wquery           
------------------------------
 (('quick' | 'slow') & 'fox')
(1 row)

SELECT to_wquery('quick and not slow');    -- keyword operators
      to_wquery      
---------------------
 ('quick' & !'slow')
(1 row)

SELECT 'QUICK'::wquery;                     -- folding
 wquery  
---------
 'quick'
(1 row)

-- syntax errors
SELECT 'quick &'::wquery;                   -- dangling operator
ERROR:  syntax error in wquery: "quick &"
LINE 1: SELECT 'quick &'::wquery;
               ^
SELECT '(quick'::wquery;                     -- unbalanced paren
ERROR:  syntax error in wquery: "(quick"
LINE 1: SELECT '(quick'::wquery;
               ^
-- @@@ match operator
SELECT to_wdoc('the quick brown fox') @@@ 'quick'::wquery;         -- t
 ?column? 
----------
 t
(1 row)

SELECT to_wdoc('the quick brown fox') @@@ 'slow'::wquery;          -- f
 ?column? 
----------
 f
(1 row)

SELECT to_wdoc('the quick brown fox') @@@ 'quick & fox'::wquery;   -- t
 ?column? 
----------
 t
(1 row)

SELECT to_wdoc('the quick brown fox') @@@ 'quick & slow'::wquery;  -- f
 ?column? 
----------
 f
(1 row)

SELECT to_wdoc('the quick brown fox') @@@ 'quick | slow'::wquery;  -- t
 ?column? 
----------
 t
(1 row)

SELECT to_wdoc('the quick brown fox') @@@ '!slow'::wquery;         -- t
 ?column? 
----------
 t
(1 row)

SELECT to_wdoc('the quick brown fox') @@@ '!fox'::wquery;          -- f
 ?column? 
----------
 f
(1 row)

SELECT to_wdoc('the quick brown fox') @@@ 'quick & !slow'::wquery; -- t
 ?column? 
----------
 t
(1 row)

-- commutator form
SELECT 'quick'::wquery @@@ to_wdoc('the quick brown fox');         -- t
 ?column? 
----------
 t
(1 row)

-- empty query matches nothing
SELECT to_wdoc('anything') @@@ ''::wquery;                         -- f
 ?column? 
----------
 f
(1 row)

-- end-to-end: WHERE on a table, sequential scan
CREATE TABLE docs (id int, body text);
INSERT INTO docs VALUES
  (1, 'the quick brown fox'),
  (2, 'a slow green turtle'),
  (3, 'quick turtles are rare'),
  (4, 'brown bears and quick foxes');
SELECT id FROM docs
WHERE to_wdoc(body) @@@ 'quick & !turtle'::wquery
ORDER BY id;
 id 
----
  1
  3
  4
(3 rows)

SELECT id FROM docs
WHERE to_wdoc(body) @@@ '(quick | slow) & !fox'::wquery
ORDER BY id;
 id 
----
  2
  3
  4
(3 rows)

-- binary send/recv round-trip is exercised by COPY BINARY in the framework;
-- here just confirm send produces bytea without error.
SELECT octet_length(wdoc_send(to_wdoc('round trip test'))) > 0 AS wdoc_send_ok;
 wdoc_send_ok 
--------------
 t
(1 row)

SELECT octet_length(wquery_send('a & (b | !c)'::wquery)) > 0 AS wquery_send_ok;
 wquery_send_ok 
----------------
 t
(1 row)

-- adversarial / edge cases: must not crash; must parse or error cleanly
SELECT to_wquery(repeat('(', 100) || 'a' || repeat(')', 100)) IS NOT NULL AS deep_nesting_ok;
 deep_nesting_ok 
-----------------
 t
(1 row)

SELECT '!!!!a'::wquery;                -- stacked NOT
 wquery  
---------
 !!!!'a'
(1 row)

SELECT '(((a)))'::wquery;              -- redundant parens
 wquery 
--------
 'a'
(1 row)

SELECT to_wquery('   ')::text AS whitespace_only;   -- empty query
 whitespace_only 
-----------------
 
(1 row)

SELECT to_wquery('a & & b');           -- double operator -> error
ERROR:  syntax error in wquery: "a & & b"
SELECT to_wquery('a | b & c');         -- precedence: & binds tighter than |
      to_wquery      
---------------------
 ('a' | ('b' & 'c'))
(1 row)

SELECT wdoc_length(to_wdoc(repeat('word ', 1000))) AS many_repeats_len;
 many_repeats_len 
------------------
             1000
(1 row)

DROP TABLE docs;
-- analyzer reusing an installed text search configuration.
-- english config stems and drops stopwords: 'running the races' -> run, race
SELECT to_wdoc('english'::regconfig, 'running the races quickly');
             to_wdoc              
----------------------------------
 'quick':1@4 'race':1@3 'run':1@1
(1 row)

-- stopwords ('the','a','of') are removed by the english dictionary
SELECT to_wdoc('english'::regconfig, 'the cat and a dog');
       to_wdoc       
---------------------
 'cat':1@2 'dog':1@5
(1 row)

-- doclen counts positions produced by the parser (stopwords still counted)
SELECT wdoc_length(to_wdoc('english'::regconfig, 'the quick brown fox'));
 wdoc_length 
-------------
           4
(1 row)

-- stemming makes a query match across inflections
SELECT to_wdoc('english'::regconfig, 'the foxes were running')
       @@@ 'fox & run'::wquery AS stemmed_match;
 stemmed_match 
---------------
 t
(1 row)

-- to_wdoc(tsvector): build an wdoc from an existing tsvector, no re-analysis.
-- Must be equivalent to to_wdoc(cfg, text) over the same text for matching.
SELECT to_wdoc(to_tsvector('english', 'the foxes were running'))
       @@@ 'fox & run'::wquery AS tsvector_stemmed_match;              -- t
 tsvector_stemmed_match 
------------------------
 t
(1 row)

-- phrase from a tsvector's positions (adjacency preserved through the map)
SELECT to_wdoc(to_tsvector('simple', 'quick brown fox'))
       @@@ '"quick brown"'::wquery AS tsvector_phrase;                 -- t
 tsvector_phrase 
-----------------
 t
(1 row)

SELECT to_wdoc(to_tsvector('simple', 'quick red brown'))
       @@@ '"quick brown"'::wquery AS tsvector_not_phrase;             -- f
 tsvector_not_phrase 
---------------------
 f
(1 row)

-- a stripped (positionless) tsvector still matches on presence (positions off)
SELECT to_wdoc(strip(to_tsvector('simple', 'quick brown fox')))
       @@@ 'brown'::wquery AS tsvector_stripped_match;                 -- t
 tsvector_stripped_match 
-------------------------
 t
(1 row)

-- empty tsvector -> empty wdoc, matches nothing
SELECT to_wdoc(to_tsvector('english', 'the a of')) @@@ 'x'::wquery AS tsvector_empty; -- f
 tsvector_empty 
----------------
 f
(1 row)

-- wdoc(tsvector) matches the same terms as wdoc(cfg,text) for the same text
-- (doclen may differ: a tsvector has already dropped stopword positions, which
-- the text analyzer still counts toward doclen -- so compare matching, not len).
SELECT to_wdoc(to_tsvector('english', 'the quick brown fox foxes')) @@@ 'fox & quick'::wquery
     = (to_wdoc('english'::regconfig, 'the quick brown fox foxes') @@@ 'fox & quick'::wquery)
       AS tsvector_matches_text;                                        -- t
 tsvector_matches_text 
-----------------------
 t
(1 row)

-- Stopword symmetry: to_wdoc drops configuration stopwords, so to_wquery
-- MUST drop them too (like to_tsquery), or a stopword conjunct silently zeroes
-- an AND.  A stopword term is elided from the query tree; a query that is only
-- stopwords becomes empty (matches nothing, as to_tsquery('english','the')='').
SELECT to_wquery('english','the')::text AS q_the_empty;               -- (empty)
 q_the_empty 
-------------
 
(1 row)

SELECT to_wquery('english','the & postgres')::text AS q_the_and_pg;   -- 'postgr'
 q_the_and_pg 
--------------
 'postgr'
(1 row)

SELECT to_wquery('english','postgres & the')::text AS q_pg_and_the;   -- 'postgr'
 q_pg_and_the 
--------------
 'postgr'
(1 row)

SELECT to_wquery('english','the | postgres')::text AS q_the_or_pg;    -- 'postgr'
 q_the_or_pg 
-------------
 'postgr'
(1 row)

SELECT to_wquery('english','the & a & of & postgres')::text AS q_many_stop; -- 'postgr'
 q_many_stop 
-------------
 'postgr'
(1 row)

SELECT to_wquery('english','(the | a) & postgres')::text AS q_grouped;-- 'postgr'
 q_grouped 
-----------
 'postgr'
(1 row)

SELECT to_wquery('english','postgres & (the | vacuum)')::text AS q_grp2; -- ('postgr' & 'vacuum')
        q_grp2         
-----------------------
 ('postgr' & 'vacuum')
(1 row)

SELECT to_wquery('english','postgres & !the')::text AS q_pg_not_the;  -- 'postgr'
 q_pg_not_the 
--------------
 'postgr'
(1 row)

SELECT to_wquery('english','"postgres the database"')::text AS q_phrase_mid; -- ('postgr' <-> 'databas')
       q_phrase_mid       
--------------------------
 ('postgr' <-> 'databas')
(1 row)

-- wquery elision matches the standard to_tsquery reduction (both drop 'the')
SELECT to_wquery('english','the & postgres')::text
     = to_wquery('english','postgres')::text AS matches_tsquery_reduction; -- t
 matches_tsquery_reduction 
---------------------------
 t
(1 row)

-- prefix/fuzzy/regex terms are matched literally, never stopword-dropped
SELECT to_wquery('english','the*')::text AS q_prefix_kept;            -- 'the'*
 q_prefix_kept 
---------------
 'the'*
(1 row)

SELECT to_wquery('english','the~1')::text AS q_fuzzy_kept;            -- 'the'~1
 q_fuzzy_kept 
--------------
 'the'~1
(1 row)

-- the reported bug: a stopword-containing AND now matches the content
SELECT weave_match(to_wdoc('english','the postgres docs'),
                 to_wquery('english','the & postgres')) AS stopword_and_matches;  -- t
 stopword_and_matches 
----------------------
 t
(1 row)

SELECT weave_match(to_wdoc('english','the vacuum problem in postgres'),
                 to_wquery('english','the vacuum problem')) AS nl_query_matches;  -- t
 nl_query_matches 
------------------
 t
(1 row)

-- an all-stopword query matches nothing (consistent with to_tsquery)
SELECT weave_match(to_wdoc('english','the postgres docs'),
                 to_wquery('english','the')) AS allstopword_matches_nothing;      -- f
 allstopword_matches_nothing 
-----------------------------
 f
(1 row)

-- count parity through the index: 'the & postgres' == 'postgres'
CREATE TABLE sw (id serial, d wdoc);
INSERT INTO sw(d) SELECT to_wdoc('english', b) FROM (VALUES
  ('the postgres vacuum'), ('a checkpoint runs'), ('the the the'),
  ('postgres runs a vacuum'), ('nothing relevant here')) v(b);
CREATE INDEX sw_idx ON sw USING weave (d);
SET enable_seqscan = off;
SELECT count(*) AS the_cnt FROM sw WHERE d @@@ to_wquery('english','the');               -- 0
 the_cnt 
---------
       0
(1 row)

SELECT (SELECT count(*) FROM sw WHERE d @@@ to_wquery('english','the & postgres'))
     = (SELECT count(*) FROM sw WHERE d @@@ to_wquery('english','postgres'))
       AS stopword_and_count_parity;                                                       -- t
 stopword_and_count_parity 
---------------------------
 t
(1 row)

RESET enable_seqscan;
DROP TABLE sw;
-- BM25 scoring.
-- score is positive when a query term is present, zero when absent
SELECT round(weave_bm25(to_wdoc('quick brown fox'), 'fox'::wquery,
                      1000, 4.0)::numeric, 4) AS present_gt_0;
 present_gt_0 
--------------
       7.2442
(1 row)

SELECT weave_bm25(to_wdoc('quick brown fox'), 'turtle'::wquery,
                1000, 4.0) AS absent_is_0;
 absent_is_0 
-------------
           0
(1 row)

-- length normalization: same tf, longer doc scores lower
SELECT weave_bm25(to_wdoc('fox'), 'fox'::wquery, 1000, 10.0)
     > weave_bm25(to_wdoc('fox ' || repeat('pad ', 40)), 'fox'::wquery, 1000, 10.0)
       AS shorter_scores_higher;
 shorter_scores_higher 
-----------------------
 t
(1 row)

-- IDF: a rarer term (low df) contributes more than a common one (high df)
SELECT weave_bm25(to_wdoc('rare common'), 'rare'::wquery, 1000, 2.0, ARRAY[2.0])
     > weave_bm25(to_wdoc('rare common'), 'common'::wquery, 1000, 2.0, ARRAY[900.0])
       AS rare_scores_higher;
 rare_scores_higher 
--------------------
 t
(1 row)

-- higher term frequency scores higher (saturating)
SELECT weave_bm25(to_wdoc('fox fox fox'), 'fox'::wquery, 1000, 3.0)
     > weave_bm25(to_wdoc('fox pad pad'), 'fox'::wquery, 1000, 3.0)
       AS more_tf_scores_higher;
 more_tf_scores_higher 
-----------------------
 t
(1 row)

-- BM25 variants.
-- all variants score presence > absence
SELECT variant,
       weave_bm25_opts(to_wdoc('quick fox'), 'fox'::wquery,
                     1000, 3.0, 1.2, 0.75, variant, ARRAY[10.0]) > 0 AS positive
FROM unnest(ARRAY['lucene','robertson','atire','bm25+','bm25l']) AS variant
ORDER BY variant;
  variant  | positive 
-----------+----------
 atire     | t
 bm25+     | t
 bm25l     | t
 lucene    | t
 robertson | t
(5 rows)

-- bm25+ >= lucene for the same inputs (delta floor)
SELECT weave_bm25_opts(to_wdoc('fox'), 'fox'::wquery, 1000, 5.0, 1.2, 0.75, 'bm25+', ARRAY[3.0])
     > weave_bm25_opts(to_wdoc('fox'), 'fox'::wquery, 1000, 5.0, 1.2, 0.75, 'lucene', ARRAY[3.0])
       AS bm25plus_ge_lucene;
 bm25plus_ge_lucene 
--------------------
 t
(1 row)

-- bm25l (rank_bm25 compatible: delta shift on the length-normalized tf) scores
-- a present term positively and 'l' is an accepted alias for it
SELECT weave_bm25_opts(to_wdoc('fox fox fox'), 'fox'::wquery, 1000, 5.0, 1.5, 0.75, 'bm25l', ARRAY[3.0]) > 0 AS bm25l_positive,
       weave_bm25_opts(to_wdoc('fox fox fox'), 'fox'::wquery, 1000, 5.0, 1.5, 0.75, 'bm25l', ARRAY[3.0])
     = weave_bm25_opts(to_wdoc('fox fox fox'), 'fox'::wquery, 1000, 5.0, 1.5, 0.75, 'l', ARRAY[3.0]) AS l_alias;
 bm25l_positive | l_alias 
----------------+---------
 t              | t
(1 row)

-- unknown variant errors
SELECT weave_bm25_opts(to_wdoc('x'), 'x'::wquery, 10, 1.0, 1.2, 0.75, 'bogus');
ERROR:  unknown weave variant "bogus"
HINT:  Valid variants: lucene, robertson, atire, bm25+, bm25l.
-- highlight and snippet.
SELECT weave_highlight('The quick brown fox jumped', 'quick | fox'::wquery,
                     '[', ']');
        weave_highlight         
--------------------------------
 The [quick] brown [fox] jumped
(1 row)

SELECT weave_snippet(
  'lorem ipsum dolor the quick brown fox jumps over the lazy dog etcetera etc',
  'quick & fox'::wquery, '<', '>', '...', 6);
               weave_snippet               
-------------------------------------------
 ...ipsum dolor the <quick> brown <fox>...
(1 row)

-- no match: highlight returns the text unchanged
SELECT weave_highlight('nothing here matches', 'zebra'::wquery, '[', ']');
   weave_highlight    
----------------------
 nothing here matches
(1 row)

-- migration from tsquery.
-- boolean operators convert directly
SELECT tsquery_to_wquery('quick & brown'::tsquery);
  tsquery_to_wquery  
---------------------
 ('quick' & 'brown')
(1 row)

SELECT tsquery_to_wquery('quick | brown'::tsquery);
  tsquery_to_wquery  
---------------------
 ('quick' | 'brown')
(1 row)

SELECT tsquery_to_wquery('!slow & quick'::tsquery);
  tsquery_to_wquery  
---------------------
 (!'slow' & 'quick')
(1 row)

SELECT tsquery_to_wquery('(a | b) & !c'::tsquery);
  tsquery_to_wquery   
----------------------
 (('a' | 'b') & !'c')
(1 row)

-- phrase operator <-> converts faithfully to an wquery phrase
SELECT tsquery_to_wquery('quick <-> brown'::tsquery);
   tsquery_to_wquery   
-----------------------
 ('quick' <-> 'brown')
(1 row)

-- the tsquery -> wquery cast makes existing queries usable with @@@
SELECT to_wdoc('the quick brown fox') @@@ ('quick & fox'::tsquery)::wquery
       AS migrated_match;
 migrated_match 
----------------
 t
(1 row)

-- prefix queries (term*).
SELECT 'quick*'::wquery;                        -- renders with the star
  wquery  
----------
 'quick'*
(1 row)

SELECT to_wdoc('the quicksand shifts') @@@ 'quick*'::wquery AS prefix_hit;
 prefix_hit 
------------
 t
(1 row)

SELECT to_wdoc('slow and steady') @@@ 'quick*'::wquery AS prefix_miss;
 prefix_miss 
-------------
 f
(1 row)

SELECT to_wdoc('quick brown fox') @@@ 'qu* & fo*'::wquery AS prefix_and;
 prefix_and 
------------
 t
(1 row)

-- prefix works through the weave index too
CREATE TABLE pfx (id serial, d wdoc);
INSERT INTO pfx (d) VALUES (to_wdoc('quicksand')), (to_wdoc('quiche')),
                          (to_wdoc('slow'));
CREATE INDEX pfx_bm25 ON pfx USING weave (d);
SET enable_seqscan = off;
SELECT id FROM pfx WHERE d @@@ 'qui*'::wquery ORDER BY id;
 id 
----
  1
  2
(2 rows)

RESET enable_seqscan;
DROP TABLE pfx;
-- index-maintained corpus statistics for BM25.
CREATE TABLE corpus (id serial, d wdoc);
INSERT INTO corpus (d)
SELECT to_wdoc('common ' || CASE WHEN g % 10 = 0 THEN 'rare' ELSE 'filler' END)
FROM generate_series(1, 100) g;
CREATE INDEX corpus_bm25 ON corpus USING weave (d);
-- stats reflect the corpus: 100 docs
SELECT ndocs, nterms FROM weave_index_stats('corpus_bm25');
 ndocs | nterms 
-------+--------
   100 |      3
(1 row)

-- 'rare' (df=10) scores higher than 'common' (df=100) using index df
SELECT weave_index_df('corpus_bm25', 'rare'::wquery) AS df_rare,
       weave_index_df('corpus_bm25', 'common'::wquery) AS df_common;
 df_rare | df_common 
---------+-----------
 {10}    | {100}
(1 row)

SELECT (SELECT weave_bm25(to_wdoc('common rare'), 'rare'::wquery,
                        s.ndocs, s.avgdl, weave_index_df('corpus_bm25', 'rare'::wquery)))
     > (SELECT weave_bm25(to_wdoc('common rare'), 'common'::wquery,
                        s.ndocs, s.avgdl, weave_index_df('corpus_bm25', 'common'::wquery)))
       AS rare_outranks_common
FROM weave_index_stats('corpus_bm25') s;
 rare_outranks_common 
----------------------
 t
(1 row)

DROP TABLE corpus;
-- incremental index maintenance (pending list).
CREATE TABLE inc (id serial, d wdoc);
INSERT INTO inc (d) VALUES (to_wdoc('alpha beta')), (to_wdoc('gamma delta'));
CREATE INDEX inc_bm25 ON inc USING weave (d);
SET enable_seqscan = off;
-- rows present at build time are found via the main structure
SELECT id FROM inc WHERE d @@@ 'alpha'::wquery ORDER BY id;
 id 
----
  1
(1 row)

-- INSERT after build must be immediately visible (no REINDEX) via pending list
INSERT INTO inc (d) VALUES (to_wdoc('alpha epsilon')), (to_wdoc('zeta'));
SELECT id FROM inc WHERE d @@@ 'alpha'::wquery ORDER BY id;   -- 1 and 3
 id 
----
  1
  3
(2 rows)

SELECT id FROM inc WHERE d @@@ 'zeta'::wquery ORDER BY id;     -- 4 (pending only)
 id 
----
  4
(1 row)

SELECT id FROM inc WHERE d @@@ 'alpha & !beta'::wquery ORDER BY id;  -- 3
 id 
----
  3
(1 row)

-- ndocs reflects built + pending
SELECT ndocs FROM weave_index_stats('inc_bm25');
 ndocs 
-------
     4
(1 row)

-- REINDEX merges pending into the main structure; results unchanged
REINDEX INDEX inc_bm25;
SELECT id FROM inc WHERE d @@@ 'alpha'::wquery ORDER BY id;
 id 
----
  1
  3
(2 rows)

RESET enable_seqscan;
DROP TABLE inc;
-- quoted phrase queries via per-term positions.
-- phrase renders with <-> and round-trips
SELECT '"quick brown fox"'::wquery;
              wquery               
-----------------------------------
 (('quick' <-> 'brown') <-> 'fox')
(1 row)

-- adjacency is enforced: "quick brown" matches, "quick fox" does not
SELECT to_wdoc('the quick brown fox') @@@ '"quick brown"'::wquery AS adj_hit;
 adj_hit 
---------
 t
(1 row)

SELECT to_wdoc('the quick brown fox') @@@ '"quick fox"'::wquery AS adj_miss;
 adj_miss 
----------
 f
(1 row)

SELECT to_wdoc('the quick brown fox') @@@ '"brown fox"'::wquery AS adj_hit2;
 adj_hit2 
----------
 t
(1 row)

-- word order matters: "fox brown" does not match "...brown fox"
SELECT to_wdoc('the quick brown fox') @@@ '"fox brown"'::wquery AS order_miss;
 order_miss 
------------
 f
(1 row)

-- three-word phrase
SELECT to_wdoc('the quick brown fox jumps') @@@ '"quick brown fox"'::wquery AS three_hit;
 three_hit 
-----------
 t
(1 row)

SELECT to_wdoc('quick red brown fox') @@@ '"quick brown fox"'::wquery AS three_miss;
 three_miss 
------------
 f
(1 row)

-- reserved keywords (and/or/not/near) are literal WORDS inside a phrase or NEAR
-- operand, not operators (ROADMAP #12b).  Use the 'simple' config so they are
-- not dropped as stopwords.  A bare keyword phrase must parse and match.
SELECT to_wquery('simple','"the and clause"')::text AS kw_phrase_parses;   -- (('the' <-> 'and') <-> 'clause')
         kw_phrase_parses         
----------------------------------
 (('the' <-> 'and') <-> 'clause')
(1 row)

SELECT to_wdoc('simple','read the and clause here') @@@ to_wquery('simple','"the and clause"') AS kw_phrase_hit;   -- t
 kw_phrase_hit 
---------------
 t
(1 row)

SELECT to_wdoc('simple','the clause and read') @@@ to_wquery('simple','"the and clause"') AS kw_phrase_miss;      -- f (order/adjacency)
 kw_phrase_miss 
----------------
 f
(1 row)

SELECT to_wdoc('simple','alpha or beta') @@@ to_wquery('simple','"alpha or beta"') AS kw_or_hit;                  -- t
 kw_or_hit 
-----------
 t
(1 row)

SELECT to_wdoc('simple','x near y z') @@@ to_wquery('simple','NEAR(near y, 2)') AS kw_in_near_hit;                -- t (literal 'near' inside NEAR)
 kw_in_near_hit 
----------------
 t
(1 row)

-- phrase combined with boolean operators
SELECT to_wdoc('the quick brown fox') @@@ '"quick brown" & fox'::wquery AS combo;
 combo 
-------
 t
(1 row)

-- phrase works through the weave index (recheck enforces adjacency)
CREATE TABLE ph (id serial, d wdoc);
INSERT INTO ph (d) VALUES (to_wdoc('quick brown fox')),
                          (to_wdoc('brown quick fox')),
                          (to_wdoc('quick brown bear'));
CREATE INDEX ph_bm25 ON ph USING weave (d);
SET enable_seqscan = off;
SELECT id FROM ph WHERE d @@@ '"quick brown"'::wquery ORDER BY id;   -- 1 and 3
 id 
----
  1
  3
(2 rows)

RESET enable_seqscan;
DROP TABLE ph;
-- regconfig analyzer must also carry positions so phrase/NEAR enforce
-- adjacency (v0.2.1 bug: to_wdoc(regconfig,text) stored no positions, so
-- phrases silently degraded to AND).  'simple' config: no stemming/stopwords,
-- positions map 1:1 to input words.
-- adjacent phrase matches
SELECT to_wdoc('simple'::regconfig, 'quick brown fox')
       @@@ to_wquery('simple'::regconfig, '"quick brown"') AS cfg_adj_hit;   -- t
 cfg_adj_hit 
-------------
 t
(1 row)

-- non-adjacent must NOT match (was t before the fix -- the bug -- now f)
SELECT to_wdoc('simple'::regconfig, 'quick red slow brown')
       @@@ to_wquery('simple'::regconfig, '"quick brown"') AS cfg_nonadj_miss; -- f
 cfg_nonadj_miss 
-----------------
 f
(1 row)

-- three-word phrase: only consecutive matches
SELECT to_wdoc('simple'::regconfig, 'a b c')
       @@@ to_wquery('simple'::regconfig, '"a b c"') AS cfg_three_hit;   -- t
 cfg_three_hit 
---------------
 t
(1 row)

SELECT to_wdoc('simple'::regconfig, 'a x b c')
       @@@ to_wquery('simple'::regconfig, '"a b c"') AS cfg_three_miss;  -- f
 cfg_three_miss 
----------------
 f
(1 row)

-- repeated term at non-sequential positions: "quick" at pos 1 and 3; the
-- per-term position list must be ascending [1,3] for phrase_step to work
SELECT to_wdoc('simple'::regconfig, 'quick brown quick fox')
       @@@ to_wquery('simple'::regconfig, '"quick brown"') AS cfg_rep_hit;   -- t
 cfg_rep_hit 
-------------
 t
(1 row)

SELECT to_wdoc('simple'::regconfig, 'quick brown quick fox')
       @@@ to_wquery('simple'::regconfig, '"quick fox"') AS cfg_rep_hit2;    -- t
 cfg_rep_hit2 
--------------
 t
(1 row)

-- NEAR on the regconfig analyzer: within k true, beyond k false
SELECT to_wdoc('simple'::regconfig, 'quick brown red fox')
       @@@ to_wquery('simple'::regconfig, 'NEAR(quick fox, 3)') AS cfg_near_hit;  -- t
 cfg_near_hit 
--------------
 t
(1 row)

SELECT to_wdoc('simple'::regconfig, 'quick brown red fox')
       @@@ to_wquery('simple'::regconfig, 'NEAR(quick fox, 2)') AS cfg_near_miss; -- f
 cfg_near_miss 
---------------
 f
(1 row)

-- index-backed phrase on a regconfig-analyzed column: recheck must exclude
-- non-adjacent docs
CREATE TABLE phc (id serial, d wdoc);
INSERT INTO phc (d) VALUES
  (to_wdoc('simple'::regconfig, 'quick brown fox')),      -- 1: adjacent
  (to_wdoc('simple'::regconfig, 'quick red slow brown')), -- 2: not adjacent
  (to_wdoc('simple'::regconfig, 'quick brown bear'));     -- 3: adjacent
CREATE INDEX phc_bm25 ON phc USING weave (d);
SET enable_seqscan = off;
SELECT id FROM phc WHERE d @@@ to_wquery('simple'::regconfig, '"quick brown"')
  ORDER BY id;   -- 1 and 3 only
 id 
----
  1
  3
(2 rows)

RESET enable_seqscan;
DROP TABLE phc;
-- phrase adjacency must hold on a STORED (column-resident) wdoc that is long
-- enough for its positions[] region to land at a non-MAXALIGN'd byte offset.
-- Regression for the WEAVE_DOC_POSITIONS alignment bug: the accessor used
-- MAXALIGN() of an absolute pointer, which mismatched the analyzer's
-- offset-based layout once a detoasted/heap-read doc sat at a non-MAXALIGN'd
-- address -- positions[] then pointed at garbage and phrase/NEAR silently
-- degraded to AND on every stored wdoc (the short-doc tests above happened to
-- land aligned and did not catch it).  Each doc below has repeated filler terms
-- (so tf>1, several positions) plus the phrase at the end; the count must be
-- exactly the adjacent docs, not the larger AND-set.
CREATE TABLE phlong (id int, body text, d wdoc);
INSERT INTO phlong(id, body)
SELECT g,
       (SELECT string_agg('flr' || (s % 5), ' ') FROM generate_series(1, 17 + g) s)
       || CASE WHEN g % 2 = 0 THEN ' united states'          -- adjacent
               ELSE ' united middle states' END              -- not adjacent
FROM generate_series(1, 8) g;
UPDATE phlong SET d = to_wdoc('simple'::regconfig, body);
-- stored-column adjacency: exactly the even ids (the adjacent phrase)
SELECT id FROM phlong
WHERE d @@@ to_wquery('simple'::regconfig, '"united states"') ORDER BY id;   -- 2,4,6,8
 id 
----
  2
  4
  6
  8
(4 rows)

-- and the stored value must agree with a fresh re-analysis of the same body
SELECT bool_and(
         (d @@@ to_wquery('simple'::regconfig, '"united states"'))
         = (to_wdoc('simple'::regconfig, body) @@@ to_wquery('simple'::regconfig, '"united states"'))
       ) AS stored_matches_fresh FROM phlong;   -- t
 stored_matches_fresh 
----------------------
 t
(1 row)

DROP TABLE phlong;
-- external-content indexing via an expression index.
-- The weave index stores only postings (no document text), so indexing
-- to_wdoc(body) over a plain text column is the external-content model:
-- the text lives in the table, the index derives wdoc from it.
CREATE TABLE articles (id serial, body text);
INSERT INTO articles (body) VALUES
  ('the quick brown fox'),
  ('lazy dogs sleep'),
  ('quick foxes are clever');
CREATE INDEX articles_bm25 ON articles USING weave (to_wdoc(body));
SET enable_seqscan = off;
-- query against the expression index; text is fetched from the table only
-- for returned rows
SELECT id, body FROM articles
WHERE to_wdoc(body) @@@ 'quick'::wquery ORDER BY id;
 id |          body          
----+------------------------
  1 | the quick brown fox
  3 | quick foxes are clever
(2 rows)

SELECT id FROM articles
WHERE to_wdoc(body) @@@ '"quick brown"'::wquery ORDER BY id;
 id 
----
  1
(1 row)

RESET enable_seqscan;
DROP TABLE articles;
-- fuzzy (term~k) and regex (/re/) queries.
-- fuzzy: 'quick'~1 matches 'quikc'? no (2 edits); matches 'quic' (1 delete)
SELECT to_wdoc('the quic brown fox') @@@ 'quick~1'::wquery AS fuzzy_hit;
 fuzzy_hit 
-----------
 t
(1 row)

SELECT to_wdoc('the slow green turtle') @@@ 'quick~1'::wquery AS fuzzy_miss;
 fuzzy_miss 
------------
 f
(1 row)

-- default k is 2: 'kwik' is 3 edits from 'quick', so 'quick~' (k=2) misses
SELECT to_wdoc('kwik search') @@@ 'quick~'::wquery AS fuzzy_default_k;
 fuzzy_default_k 
-----------------
 f
(1 row)

-- fuzzy renders with ~k
SELECT 'color~2'::wquery;
  wquery   
-----------
 'color'~2
(1 row)

-- regex: /^qu/ matches a term starting with qu
SELECT to_wdoc('the quick brown fox') @@@ '/^qu/'::wquery AS regex_hit;
 regex_hit 
-----------
 t
(1 row)

SELECT to_wdoc('lazy dog') @@@ '/^qu/'::wquery AS regex_miss;
 regex_miss 
------------
 f
(1 row)

-- regex renders with slashes
SELECT '/ab.*cd/'::wquery;
  wquery  
----------
 /ab.*cd/
(1 row)

-- fuzzy combined with boolean
SELECT to_wdoc('the quic brown fox') @@@ 'quick~1 & fox'::wquery AS combo;
 combo 
-------
 t
(1 row)

-- fuzzy/regex work through the weave index (recheck applies the exact test)
CREATE TABLE fz (id serial, d wdoc);
INSERT INTO fz (d) VALUES (to_wdoc('quick')), (to_wdoc('quic')),
                          (to_wdoc('slow'));
CREATE INDEX fz_bm25 ON fz USING weave (d);
SET enable_seqscan = off;
SELECT id FROM fz WHERE d @@@ 'quick~1'::wquery ORDER BY id;   -- 1 and 2
 id 
----
  1
  2
(2 rows)

SELECT id FROM fz WHERE d @@@ '/^qu/'::wquery ORDER BY id;      -- 1 and 2
 id 
----
  1
  2
(2 rows)

RESET enable_seqscan;
DROP TABLE fz;
-- trigrams reloption: default OFF must give the SAME regex/fuzzy results as
-- WITH (trigrams=on).  The trigram tier only accelerates regex/long-fuzzy; the
-- query side falls back to a full dictionary scan when it is absent, so results
-- are identical either way, and the default-off index is no larger.
CREATE TABLE trg_a (id serial, d wdoc);
CREATE TABLE trg_b (id serial, d wdoc);
INSERT INTO trg_a (d)
  SELECT to_wdoc('english', 'development environment number ' || g ||
                   ' running programmer developer settlement government')
  FROM generate_series(1, 400) g;
INSERT INTO trg_b (d) SELECT d FROM trg_a ORDER BY id;
CREATE INDEX trg_off ON trg_a USING weave (d);                  -- default: trigrams off
CREATE INDEX trg_on  ON trg_b USING weave (d) WITH (trigrams = on);
SET enable_seqscan = off;
-- long fuzzy (>k trigrams) and regex return the identical id set on both indexes
SELECT (SELECT array_agg(id ORDER BY id) FROM trg_a WHERE d @@@ 'developer~3'::wquery)
     = (SELECT array_agg(id ORDER BY id) FROM trg_b WHERE d @@@ 'developer~3'::wquery)
       AS fuzzy_off_eq_on;                                     -- t
 fuzzy_off_eq_on 
-----------------
 t
(1 row)

SELECT (SELECT array_agg(id ORDER BY id) FROM trg_a WHERE d @@@ '/^develop/'::wquery)
     = (SELECT array_agg(id ORDER BY id) FROM trg_b WHERE d @@@ '/^develop/'::wquery)
       AS regex_off_eq_on;                                     -- t
 regex_off_eq_on 
-----------------
 t
(1 row)

RESET enable_seqscan;
-- default-off index is no larger than the trigrams-on index (trigram tier omitted)
SELECT pg_relation_size('trg_off') <= pg_relation_size('trg_on') AS off_not_larger;  -- t
 off_not_larger 
----------------
 t
(1 row)

DROP TABLE trg_a, trg_b;
-- Bounded universe: NOT and trigrams-off regex/fuzzy fall back to a whole-segment
-- candidate scan.  When the vocabulary is small but every document repeats the
-- same terms, the sum of df across the dictionary (the raw postings) far exceeds
-- the document count; the fallback must fold duplicates as it collects so its
-- scratch stays O(ndocs) rather than growing to O(sum df) (which reached a
-- multi-gigabyte alloc on a real high-vocabulary corpus).  Correctness is
-- unchanged -- these queries must return the exact id set.
CREATE TABLE univ (id serial, d wdoc);
INSERT INTO univ (d)
  SELECT to_wdoc('english', 'alpha beta gamma delta alpha beta gamma delta ' ||
                   CASE WHEN g % 5 = 0 THEN 'omega' ELSE 'sigma' END)
  FROM generate_series(1, 500) g;
CREATE INDEX univ_weave ON univ USING weave (d);   -- trigrams off (default)
SET enable_seqscan = off;
-- NOT drives weave_universe_bounded: every doc has alpha; only g%5=0 have omega.
SELECT count(*) FROM univ WHERE d @@@ 'alpha & !omega'::wquery;   -- 400
 count 
-------
   400
(1 row)

-- trigrams-off regex also drives the fallback and must still be exact.
SELECT count(*) FROM univ WHERE d @@@ '/^omeg/'::wquery;          -- 100
 count 
-------
   100
(1 row)

-- the fallback answer equals the seqscan ground truth.
RESET enable_seqscan;
SELECT (SELECT count(*) FROM univ WHERE d @@@ 'alpha & !omega'::wquery)
     = (SELECT count(*) FROM univ WHERE to_wdoc('english',
           'alpha beta gamma delta alpha beta gamma delta ' ||
           CASE WHEN id % 5 = 0 THEN 'omega' ELSE 'sigma' END) @@@ 'alpha & !omega'::wquery)
       AS universe_matches_truth;                                   -- t
 universe_matches_truth 
------------------------
 t
(1 row)

DROP TABLE univ;
-- Multi-segment v4 doclen sidecar: force several segments (low maintenance_work_mem
-- flushes many small segments), then confirm a ranked scan reads each segment's
-- sidecar via the FORWARD CURSOR and returns the exact top-k -- i.e. doclen is
-- looked up correctly ACROSS segment boundaries, not from a mis-scoped preload.
-- (Regression for the 1.5.0 v4 ranked-scan report: the per-segment sidecar was
-- bulk-loaded per query; the cursor reads only the scored docid range, and must
-- still find every scored doc's length.)
CREATE TABLE segsc (id serial, d wdoc);
SET maintenance_work_mem = '1MB';   -- tiny -> many segment flushes
INSERT INTO segsc (d)
  SELECT to_wdoc('english', repeat('alpha ', 1 + (g % 7)) || 'w' || (g % 500) || ' tail ' || g)
  FROM generate_series(1, 4000) g;
CREATE INDEX segsc_weave ON segsc USING weave (d);
RESET maintenance_work_mem;
SET enable_seqscan = off;
-- Every doc the ranked scan returns must (a) genuinely match @@@ and (b) score
-- within the top band -- i.e. the sidecar cursor supplied a valid doclen for
-- every scored doc across all segments.  We assert the top-10 are all real
-- matches and the scan returns a full page, rather than exact tie-order equality
-- (v4 quantized doclen may reorder within a score tie -- the documented bound).
SELECT count(*) = 10 AS segsc_topk_full,
       bool_and(m) AS segsc_all_match
FROM (
  SELECT id, (d @@@ to_wquery('english','alpha')) AS m
  FROM segsc
  WHERE id IN (
    SELECT id FROM segsc WHERE d @@@ to_wquery('english','alpha')
    ORDER BY d <=> to_wquery('english','alpha') LIMIT 10)
) z;   -- t | t
 segsc_topk_full | segsc_all_match 
-----------------+-----------------
 t               | t
(1 row)

RESET enable_seqscan;
DROP TABLE segsc;
-- doclen_sidecar reloption (escape hatch): WITH (doclen_sidecar=off) stores
-- doclen inline in each posting (the pre-1.5 layout) instead of the v4 sidecar.
-- Both layouts must return identical results (the decoder is self-describing),
-- and a query on the inline index must not touch a sidecar.
CREATE TABLE dls_on  (id serial, d wdoc);
CREATE TABLE dls_off (id serial, d wdoc);
INSERT INTO dls_on (d)
  SELECT to_wdoc('english', repeat('alpha ', 1 + (g % 5)) || 'w' || (g % 300) || ' ' || g)
  FROM generate_series(1, 3000) g;
INSERT INTO dls_off (d) SELECT d FROM dls_on ORDER BY id;
CREATE INDEX dls_on_weave  ON dls_on  USING weave (d);                          -- sidecar (default)
CREATE INDEX dls_off_weave ON dls_off USING weave (d) WITH (doclen_sidecar = off); -- inline
SET enable_seqscan = off;
-- identical count on both layouts
SELECT (SELECT count(*) FROM dls_on  WHERE d @@@ to_wquery('english','alpha'))
     = (SELECT count(*) FROM dls_off WHERE d @@@ to_wquery('english','alpha'))
       AS dls_count_eq;   -- t
 dls_count_eq 
--------------
 t
(1 row)

-- identical ranked top-10 id set
SELECT (SELECT array_agg(id ORDER BY id) FROM (SELECT id FROM dls_on  WHERE d @@@ to_wquery('english','w7')
          ORDER BY d <=> to_wquery('english','w7') LIMIT 10) a)
     = (SELECT array_agg(id ORDER BY id) FROM (SELECT id FROM dls_off WHERE d @@@ to_wquery('english','w7')
          ORDER BY d <=> to_wquery('english','w7') LIMIT 10) b)
       AS dls_topk_eq;    -- t
 dls_topk_eq 
-------------
 t
(1 row)

-- the inline index is no larger having dropped the sidecar? (sanity: both build)
SELECT pg_relation_size('dls_off_weave') > 0 AND pg_relation_size('dls_on_weave') > 0 AS both_built;  -- t
 both_built 
------------
 t
(1 row)

RESET enable_seqscan;
DROP TABLE dls_on, dls_off;
-- Merge preserves the doclen sidecar (regression for 1.5.2: the merge path
-- wrote 2-column postings but an EMPTY sidecar collector, so the merged segment
-- got doclenstart=Invalid and its postings were then mis-read as inline ->
-- garbage doclen -> wrong ranked scores + defeated WAND pruning).  Build several
-- segments, force a merge, and confirm the ranked top-k is still correct AND
-- matches an inline-built twin over the same rows.
CREATE TABLE mrg (id serial, d wdoc);
CREATE TABLE mrg_inl (id serial, d wdoc);
INSERT INTO mrg (d)
  SELECT to_wdoc('english', repeat('alpha ', 1 + (g % 6)) || 'w' || (g % 400) || ' g' || g)
  FROM generate_series(1, 40000) g;
INSERT INTO mrg_inl (d) SELECT d FROM mrg ORDER BY id;
SET maintenance_work_mem = '1MB';   -- many small segments
CREATE INDEX mrg_weave ON mrg USING weave (d);                              -- sidecar (default)
RESET maintenance_work_mem;
SELECT weave_merge('mrg_weave') IS NOT NULL AS merge_ran;                   -- force the merge path
 merge_ran 
-----------
 t
(1 row)

CREATE INDEX mrg_inl_weave ON mrg_inl USING weave (d) WITH (doclen_sidecar = off); -- inline twin
SET enable_seqscan = off;
-- the merged sidecar index and the inline twin must return the SAME ranked top-10
SELECT (SELECT array_agg(id ORDER BY id) FROM (SELECT id FROM mrg WHERE d @@@ to_wquery('english','w3')
          ORDER BY d <=> to_wquery('english','w3') LIMIT 10) a)
     = (SELECT array_agg(id ORDER BY id) FROM (SELECT id FROM mrg_inl WHERE d @@@ to_wquery('english','w3')
          ORDER BY d <=> to_wquery('english','w3') LIMIT 10) b)
       AS merged_sidecar_matches_inline;   -- t
 merged_sidecar_matches_inline 
-------------------------------
 t
(1 row)

RESET enable_seqscan;
DROP TABLE mrg, mrg_inl;
-- Multi-term AND ranked exactness (block-max WAND soundness).  Regression for
-- the pre-existing conjunctive-recall gap: the block-max block-skip fast path
-- skipped a whole posting block whenever a single cursor sat at/before the
-- pivot -- but "other cursors past the PIVOT" does not mean "past the BLOCK",
-- so a document later in the skipped block that contained BOTH terms (scoring
-- the SUM of contributions, which the one-term block bound never covered) was
-- dropped from the top-k.  Compounded on the v4 sidecar by scoring against the
-- quantized (rounded-DOWN) doclen while the block bound used the exact min |D|.
-- The engine's ranked top-k must now equal the exact (weave_bm25) top-k for an
-- AND query, on BOTH the sidecar (default) and inline layouts.
CREATE TABLE andx (id serial, d wdoc);
-- alpha ~ many docs, beta ~ many docs, a controlled overlap forms the AND set;
-- widely varied doc lengths so doclen quantization spans buckets.
INSERT INTO andx (d)
  SELECT to_wdoc('english',
           repeat('w'||(g%2000)||' ', 5 + (g % 120))          -- varied length
           || CASE WHEN g % 13 = 0 THEN 'alpha alpha ' ELSE '' END
           || CASE WHEN g % 17 = 0 THEN 'beta beta '   ELSE '' END
           || CASE WHEN g % 221 = 0 THEN 'alpha beta ' ELSE '' END)  -- 13*17: dense AND docs
  FROM generate_series(1, 60000) g;
CREATE INDEX andx_weave     ON andx USING weave (d);                              -- sidecar (default)
SET enable_seqscan = off;
-- The index ranked top-10 (KNN) must equal the exact-by-score top-10, computed
-- as two SEPARATE queries (a single query holding both a KNN and an exact-sort
-- subquery lets the planner share/rewrite the scan and pick different rows --
-- a false miss).  N and avgdl feed weave_bm25 for the exact side.
SELECT (SELECT array_agg(id ORDER BY id) FROM (
          SELECT id FROM andx WHERE d @@@ to_wquery('english','alpha & beta')
          ORDER BY d <=> to_wquery('english','alpha & beta') LIMIT 10) k)
     = (SELECT array_agg(id ORDER BY id) FROM (
          SELECT t.id FROM andx t,
                 (SELECT count(*)::float8 n, avg(wdoc_length(d))::float8 a FROM andx) s
          WHERE t.d @@@ to_wquery('english','alpha & beta')
          ORDER BY weave_bm25(t.d, to_wquery('english','alpha & beta'), s.n, s.a,
                            weave_index_df('andx_weave', to_wquery('english','alpha & beta'))) DESC
          LIMIT 10) x)
       AS and_sidecar_topk_exact;   -- t
 and_sidecar_topk_exact 
------------------------
 t
(1 row)

RESET enable_seqscan;
DROP INDEX andx_weave;
CREATE INDEX andx_inl_weave ON andx USING weave (d) WITH (doclen_sidecar = off); -- inline layout
SET enable_seqscan = off;
-- same assertion against the inline layout (proves the fix is in the shared WAND
-- traversal, not sidecar-specific)
SELECT (SELECT array_agg(id ORDER BY id) FROM (
          SELECT id FROM andx WHERE d @@@ to_wquery('english','alpha & beta')
          ORDER BY d <=> to_wquery('english','alpha & beta') LIMIT 10) k)
     = (SELECT array_agg(id ORDER BY id) FROM (
          SELECT t.id FROM andx t,
                 (SELECT count(*)::float8 n, avg(wdoc_length(d))::float8 a FROM andx) s
          WHERE t.d @@@ to_wquery('english','alpha & beta')
          ORDER BY weave_bm25(t.d, to_wquery('english','alpha & beta'), s.n, s.a,
                            weave_index_df('andx_inl_weave', to_wquery('english','alpha & beta'))) DESC
          LIMIT 10) x)
       AS and_inline_topk_exact;   -- t
 and_inline_topk_exact 
-----------------------
 t
(1 row)

RESET enable_seqscan;
DROP TABLE andx;
-- BM25F: multi-field weighting.
-- a term in the (heavily weighted) title scores higher than the same term in
-- only the body
SELECT weave_bm25f(ARRAY[to_wdoc('postgres'), to_wdoc('other text here')],
                'postgres'::wquery, ARRAY[5.0, 1.0], 1000, ARRAY[2.0, 3.0], ARRAY[10.0])
     > weave_bm25f(ARRAY[to_wdoc('other title'), to_wdoc('postgres here')],
                'postgres'::wquery, ARRAY[5.0, 1.0], 1000, ARRAY[2.0, 3.0], ARRAY[10.0])
       AS title_weight_wins;
 title_weight_wins 
-------------------
 t
(1 row)

-- absent term scores 0
SELECT weave_bm25f(ARRAY[to_wdoc('a'), to_wdoc('b')],
                'zebra'::wquery, ARRAY[2.0, 1.0], 100, ARRAY[1.0, 1.0]) AS absent_zero;
 absent_zero 
-------------
           0
(1 row)

-- a match in either field contributes
SELECT weave_bm25f(ARRAY[to_wdoc('nothing'), to_wdoc('found fox')],
                'fox'::wquery, ARRAY[2.0, 1.0], 100, ARRAY[2.0, 2.0], ARRAY[5.0]) > 0
       AS body_match_scores;
 body_match_scores 
-------------------
 t
(1 row)

-- mismatched array lengths error
SELECT weave_bm25f(ARRAY[to_wdoc('a')], 'a'::wquery, ARRAY[1.0,2.0], 10, ARRAY[1.0]);
ERROR:  docs, weights and avgdls must have the same length
-- Background merge of the pending list.
CREATE TABLE mrg (id serial, d wdoc);
INSERT INTO mrg (d) VALUES (to_wdoc('alpha beta'));
CREATE INDEX mrg_bm25 ON mrg USING weave (d);
INSERT INTO mrg (d) VALUES (to_wdoc('alpha gamma')), (to_wdoc('delta'));
-- before merge: 2 docs pending
SELECT ndocs FROM weave_index_stats('mrg_bm25');
 ndocs 
-------
     3
(1 row)

SET enable_seqscan = off;
SELECT id FROM mrg WHERE d @@@ 'alpha'::wquery ORDER BY id;   -- 1, 2
 id 
----
  1
  2
(2 rows)

-- explicit merge folds pending into the main structure
SELECT weave_merge('mrg_bm25') AS merged;
 merged 
--------
 t
(1 row)

-- after merge: same results, and a term from a formerly-pending doc now has df
SELECT id FROM mrg WHERE d @@@ 'alpha'::wquery ORDER BY id;   -- still 1, 2
 id 
----
  1
  2
(2 rows)

SELECT id FROM mrg WHERE d @@@ 'delta'::wquery ORDER BY id;   -- 3
 id 
----
  3
(1 row)

SELECT weave_index_df('mrg_bm25', 'alpha'::wquery) AS df_alpha_after_merge;
 df_alpha_after_merge 
----------------------
 {2}
(1 row)

-- merging again is a no-op (nothing pending)
SELECT weave_merge('mrg_bm25') AS merged_again;
 merged_again 
--------------
 f
(1 row)

RESET enable_seqscan;
DROP TABLE mrg;
-- Index-only BM25 top-k search (weave_search).
CREATE TABLE srch (id serial, body text, d wdoc);
INSERT INTO srch (body, d) VALUES
  ('quick quick quick fox', to_wdoc('quick quick quick fox')),
  ('quick brown fox', to_wdoc('quick brown fox')),
  ('a slow turtle', to_wdoc('a slow turtle')),
  ('quick', to_wdoc('quick'));
CREATE INDEX srch_bm25 ON srch USING weave (d);
-- top-k by index-only score: doc with tf(quick)=3 ranks first
SELECT s.id, round(r.score::numeric, 3) AS score
FROM weave_search('srch_bm25', 'quick'::wquery, 10) r
JOIN srch s ON s.ctid = r.ctid
ORDER BY r.score DESC, s.id;
 id | score 
----+-------
  1 | 0.511
  4 | 0.482
  2 | 0.344
(3 rows)

-- k limits the result set
SELECT count(*) AS topk_count
FROM weave_search('srch_bm25', 'quick'::wquery, 2) r;
 topk_count 
------------
          2
(1 row)

-- multi-term query accumulates per-term contributions
SELECT count(*) AS multiterm
FROM weave_search('srch_bm25', 'quick | brown'::wquery, 10) r;
 multiterm 
-----------
         3
(1 row)

DROP TABLE srch;
-- Trigram pre-filter for fuzzy matching: correctness must be unchanged.
-- longer terms (>k trigrams) use the trigram filter
SELECT to_wdoc('development environment') @@@ 'developer~3'::wquery AS trgm_fuzzy_hit;
 trgm_fuzzy_hit 
----------------
 t
(1 row)

SELECT to_wdoc('completely unrelated words') @@@ 'developer~3'::wquery AS trgm_fuzzy_miss;
 trgm_fuzzy_miss 
-----------------
 f
(1 row)

-- exact-distance edge: 'running' within 2 of 'runnick'? (n->c,g->k = 2 subst)
SELECT to_wdoc('the running man') @@@ 'runnink~2'::wquery AS edge_hit;
 edge_hit 
----------
 t
(1 row)

-- short terms (<=k trigrams) fall back to full scan, still correct
SELECT to_wdoc('cat hat bat') @@@ 'rat~1'::wquery AS short_hit;
 short_hit 
-----------
 t
(1 row)

SELECT to_wdoc('dog log fog') @@@ 'rat~1'::wquery AS short_miss;
 short_miss 
------------
 f
(1 row)

-- MVCC: weave_search must return only tuples visible to the snapshot.
CREATE TABLE viz (id serial, d wdoc);
INSERT INTO viz (d) VALUES (to_wdoc('apple')), (to_wdoc('apple')),
                          (to_wdoc('apple')), (to_wdoc('apple'));
CREATE INDEX viz_bm25 ON viz USING weave (d);
-- delete two rows; their postings remain in the index until merge/reindex
DELETE FROM viz WHERE id IN (2, 3);
-- weave_search must skip the dead tuples (returns 2 live rows, not 4)
SELECT count(*) AS live_only
FROM weave_search('viz_bm25', 'apple'::wquery, 100) r
JOIN viz v ON v.ctid = r.ctid;
 live_only 
-----------
         2
(1 row)

-- and the raw SRF itself returns only visible ctids
SELECT count(*) AS srf_live FROM weave_search('viz_bm25', 'apple'::wquery, 100);
 srf_live 
----------
        2
(1 row)

DROP TABLE viz;
-- Posting compression: correctness under many clustered docids + merge.
CREATE TABLE cmp (id serial, d wdoc);
INSERT INTO cmp (d) SELECT to_wdoc('common term here')
FROM generate_series(1, 500);
CREATE INDEX cmp_bm25 ON cmp USING weave (d);
-- all 500 rows match the compressed posting list
SELECT count(*) AS all_match
FROM weave_search('cmp_bm25', 'common'::wquery, 1000) r JOIN cmp c ON c.ctid = r.ctid;
 all_match 
-----------
       500
(1 row)

-- incremental inserts (pending) + merge preserve the full posting list
INSERT INTO cmp (d) SELECT to_wdoc('common term here') FROM generate_series(1, 100);
SELECT weave_merge('cmp_bm25');
 weave_merge 
-------------
 t
(1 row)

SELECT count(*) AS after_merge
FROM weave_search('cmp_bm25', 'common'::wquery, 2000) r JOIN cmp c ON c.ctid = r.ctid;
 after_merge 
-------------
         600
(1 row)

DROP TABLE cmp;
-- WAND top-k: multi-term query returns correct top-k in descending score.
CREATE TABLE wnd (id serial, d wdoc);
INSERT INTO wnd (d) VALUES
  (to_wdoc('alpha alpha alpha beta')),   -- high alpha tf
  (to_wdoc('alpha beta beta beta')),     -- high beta tf
  (to_wdoc('alpha beta')),               -- both, low tf
  (to_wdoc('gamma only')),               -- neither
  (to_wdoc('alpha')),                    -- alpha only
  (to_wdoc('beta'));                     -- beta only
CREATE INDEX wnd_bm25 ON wnd USING weave (d);
-- top-2 for 'alpha | beta': the two docs matching both terms should lead
SELECT w.id
FROM weave_search('wnd_bm25', 'alpha | beta'::wquery, 3) r
JOIN wnd w ON w.ctid = r.ctid
ORDER BY r.score DESC, w.id;
 id 
----
  1
  2
  3
(3 rows)

-- scores are monotonically non-increasing (WAND returns them sorted)
SELECT bool_and(s >= lead_s) AS descending
FROM (SELECT r.score AS s, lead(r.score) OVER (ORDER BY r.score DESC) AS lead_s
      FROM weave_search('wnd_bm25', 'alpha | beta'::wquery, 10) r) q
WHERE lead_s IS NOT NULL;
 descending 
------------
 t
(1 row)

DROP TABLE wnd;
-- Lazy block-max WAND: correct top-k over a multi-page posting list.
CREATE TABLE lazy (id serial, d wdoc);
-- 2000 docs of 'term': posting list spans many pages; one doc has high tf
INSERT INTO lazy (d) SELECT to_wdoc('term') FROM generate_series(1, 2000);
INSERT INTO lazy (d) VALUES (to_wdoc('term term term term term'));  -- id 2001
CREATE INDEX lazy_bm25 ON lazy USING weave (d);
-- top-1 must be the high-tf doc (id 2001), found via block-max skipping
SELECT l.id
FROM weave_search('lazy_bm25', 'term'::wquery, 1) r JOIN lazy l ON l.ctid = r.ctid;
  id  
------
 2001
(1 row)

-- top-3 all correct and the whole list is searchable
SELECT count(*) AS matched
FROM weave_search('lazy_bm25', 'term'::wquery, 5000) r JOIN lazy l ON l.ctid = r.ctid;
 matched 
---------
    2001
(1 row)

DROP TABLE lazy;
-- Lexical anomaly detection (weave_anomalous_docs): the rare-token (low-df) tail.
-- Corpus of 500 common-word docs, plus 3 docs each carrying a unique 'zqxjkN'
-- token.  The 3 injected docs are the only lexically-anomalous ones.
CREATE TABLE anom (id serial, d wdoc);
INSERT INTO anom (d) SELECT to_wdoc('the common ordinary boilerplate text')
FROM generate_series(1, 500);
INSERT INTO anom (d) VALUES
  (to_wdoc('the common text zqxjk1')),
  (to_wdoc('ordinary boilerplate zqxjk2')),
  (to_wdoc('common text zqxjk3'));
CREATE INDEX anom_bm25 ON anom USING weave (d);
-- top-3 anomalies are exactly the 3 injected docs, and rarest_term is the token
SELECT a.id, a.d::text AS doc, r.rarest_term, r.min_df
FROM weave_anomalous_docs('anom_bm25', 3) r
JOIN anom a ON a.ctid = r.ctid
ORDER BY r.score DESC, a.id;
 id  |                      doc                       | rarest_term | min_df 
-----+------------------------------------------------+-------------+--------
 501 | 'common':1@2 'text':1@3 'the':1@1 'zqxjk1':1@4 | zqxjk1      |      1
 502 | 'boilerplate':1@2 'ordinary':1@1 'zqxjk2':1@3  | zqxjk2      |      1
 503 | 'common':1@1 'text':1@2 'zqxjk3':1@3           | zqxjk3      |      1
(3 rows)

-- their scores are the highest in the corpus (a common-only doc scores lower):
-- the min anomaly score of the 3 injected docs exceeds any other doc's score
SELECT bool_and(inj.score > others.maxscore) AS injected_lead
FROM (SELECT min(r.score) AS score
      FROM weave_anomalous_docs('anom_bm25', 3) r) inj,
     (SELECT coalesce(max(r.score), 0) AS maxscore
      FROM weave_anomalous_docs('anom_bm25', 1000) r
      WHERE r.rarest_term NOT LIKE 'zqxjk%') others;
 injected_lead 
---------------
 t
(1 row)

-- every zqxjk token has df=1 (unique), so min_df is 1 for the injected docs
SELECT count(*) AS df1_hits
FROM weave_anomalous_docs('anom_bm25', 3) r
WHERE r.rarest_term LIKE 'zqxjk%' AND r.min_df = 1;
 df1_hits 
----------
        3
(1 row)

-- k limits the result set
SELECT count(*) AS topk_count
FROM weave_anomalous_docs('anom_bm25', 2) r;
 topk_count 
------------
          2
(1 row)

-- max_df filter: with max_df=0 no term qualifies as rare -> no rows
SELECT count(*) AS none_when_maxdf_0
FROM weave_anomalous_docs('anom_bm25', 100, 0) r;
 none_when_maxdf_0 
-------------------
                 0
(1 row)

-- max_df=1 admits only the unique tokens -> exactly the 3 injected docs
SELECT count(*) AS three_when_maxdf_1
FROM weave_anomalous_docs('anom_bm25', 100, 1) r;
 three_when_maxdf_1 
--------------------
                  3
(1 row)

-- a common-only doc is never flagged (all its terms are high-df)
SELECT count(*) AS common_flagged
FROM weave_anomalous_docs('anom_bm25', 100, 1) r
JOIN anom a ON a.ctid = r.ctid
WHERE a.d::text = 'the common ordinary boilerplate text';
 common_flagged 
----------------
              0
(1 row)

DROP TABLE anom;
-- empty index returns no rows
CREATE TABLE anom_empty (id serial, d wdoc);
CREATE INDEX anom_empty_bm25 ON anom_empty USING weave (d);
SELECT count(*) AS empty_rows FROM weave_anomalous_docs('anom_empty_bm25', 10);
 empty_rows 
------------
          0
(1 row)

DROP TABLE anom_empty;
-- NEAR(a b, k): proximity within k tokens.
-- 'quick ... fox' are 3 tokens apart in 'the quick brown red fox'
SELECT to_wdoc('the quick brown red fox') @@@ 'NEAR(quick fox, 3)'::wquery AS near_hit;
 near_hit 
----------
 t
(1 row)

SELECT to_wdoc('the quick brown red fox') @@@ 'NEAR(quick fox, 2)'::wquery AS near_miss;
 near_miss 
-----------
 f
(1 row)

-- adjacent terms satisfy any k>=1
SELECT to_wdoc('the quick brown fox') @@@ 'NEAR(quick brown, 1)'::wquery AS near_adj;
 near_adj 
----------
 t
(1 row)

-- three-term NEAR chains the proximity
SELECT to_wdoc('alpha beta gamma delta') @@@ 'NEAR(alpha beta gamma, 2)'::wquery AS near3;
 near3 
-------
 t
(1 row)

-- NEAR combines with boolean operators
SELECT to_wdoc('the quick brown red fox jumps') @@@ 'NEAR(quick fox, 3) & jumps'::wquery AS near_combo;
 near_combo 
------------
 t
(1 row)

-- malformed NEAR errors (single term); NEAR without k defaults to 10
SELECT 'NEAR(onlyone, 2)'::wquery;
ERROR:  syntax error in wquery: "NEAR(onlyone, 2)"
LINE 1: SELECT 'NEAR(onlyone, 2)'::wquery;
               ^
SELECT to_wdoc('a b c') @@@ 'NEAR(a c)'::wquery AS near_default_k;
 near_default_k 
----------------
 t
(1 row)

-- FSM page recycling: repeated merges reuse freed blocks (no unbounded growth).
CREATE TABLE recyc (id serial, d wdoc);
INSERT INTO recyc (d) SELECT to_wdoc('term' || (g % 50)) FROM generate_series(1, 500) g;
CREATE INDEX recyc_bm25 ON recyc USING weave (d);
-- churn: insert + merge several times; each merge frees the old blocks
DO $$
BEGIN
  FOR i IN 1..5 LOOP
    INSERT INTO recyc (d) SELECT to_wdoc('term' || (g % 50)) FROM generate_series(1, 200) g;
    PERFORM weave_merge('recyc_bm25');
  END LOOP;
END $$;
SELECT pg_relation_size('recyc_bm25') AS recyc_churned \gset
-- after churn the index is still correct
SELECT count(*) > 0 AS still_matches
FROM weave_search('recyc_bm25', 'term1'::wquery, 5000) r JOIN recyc x ON x.ctid = r.ctid;
 still_matches 
---------------
 t
(1 row)

-- weave_merge compacts the segment directory but deliberately does NOT shrink the
-- file (that is weave_vacuum's job); after weave_vacuum the space IS reclaimed, so
-- the vacuumed index is within a small multiple of a freshly-built twin over the
-- SAME rows -- the leak-free property, asserted against a from-scratch build
-- rather than a hardcoded byte size / block number (which is environment-
-- dependent, e.g. a pinned-horizon reader defers reclaim and inflates any fixed
-- bound).  A genuine per-merge leak would not come back down under weave_vacuum.
SELECT weave_vacuum('recyc_bm25');
 weave_vacuum 
--------------
 t
(1 row)

SELECT pg_relation_size('recyc_bm25') AS recyc_vacuumed \gset
CREATE TABLE recyc_fresh (id serial, d wdoc);
INSERT INTO recyc_fresh (d) SELECT d FROM recyc ORDER BY id;
CREATE INDEX recyc_fresh_bm25 ON recyc_fresh USING weave (d);
SELECT pg_relation_size('recyc_fresh_bm25') AS recyc_fresh \gset
SELECT :recyc_vacuumed <= :recyc_fresh * 3 AS size_bounded;
 size_bounded 
--------------
 t
(1 row)

DROP TABLE recyc, recyc_fresh;
-- amcanorderbyop: ORDER BY col <=> query LIMIT k uses an index ordering scan.
CREATE TABLE ord (id serial, d wdoc);
INSERT INTO ord (d) VALUES
  (to_wdoc('quick quick quick fox')),   -- highest tf(quick)
  (to_wdoc('quick brown fox')),
  (to_wdoc('a slow turtle')),
  (to_wdoc('quick'));                    -- short doc, high length-norm score
CREATE INDEX ord_bm25 ON ord USING weave (d);
SET enable_seqscan = off;
-- the plan should be an index scan ordered by the distance operator (no Sort)
EXPLAIN (COSTS OFF)
SELECT id FROM ord WHERE d @@@ 'quick'::wquery
ORDER BY d <=> 'quick'::wquery LIMIT 2;
                   QUERY PLAN                    
-------------------------------------------------
 Limit
   ->  Index Scan using ord_bm25 on ord
         Index Cond: (d @@@ '''quick'''::wquery)
         Order By: (d <=> '''quick'''::wquery)
(4 rows)

-- results ordered by relevance (ascending distance)
SELECT id FROM ord WHERE d @@@ 'quick'::wquery
ORDER BY d <=> 'quick'::wquery LIMIT 3;
 id 
----
  1
  4
  2
(3 rows)

RESET enable_seqscan;
DROP TABLE ord;
-- On-disk trigram index: fuzzy/regex through the index over many docs.
-- The trigram funnel narrows candidates (sparsemap postings); recheck refines.
CREATE TABLE trgm (id serial, d wdoc);
INSERT INTO trgm (d) SELECT to_wdoc('document' || g) FROM generate_series(1, 1000) g;
INSERT INTO trgm (d) VALUES (to_wdoc('documemt42'));   -- id 1001, 1 edit from document42
CREATE INDEX trgm_bm25 ON trgm USING weave (d);
SET enable_seqscan = off;
-- fuzzy: finds the exact 'document42' (id 43: 'document42') and the typo (1001)
SELECT count(*) AS fuzzy_via_trigram
FROM trgm t WHERE t.d @@@ 'document42~2'::wquery;
 fuzzy_via_trigram 
-------------------
               424
(1 row)

-- regex through the trigram index
SELECT count(*) AS regex_via_trigram
FROM trgm t WHERE t.d @@@ '/document4[0-9]$/'::wquery;
 regex_via_trigram 
-------------------
                10
(1 row)

-- regex with alternation/anchors: literal-run tiling extracts 'document'
SELECT count(*) AS regex_anchored
FROM trgm t WHERE t.d @@@ '/^document(4|5)2$/'::wquery;   -- document42, document52
 regex_anchored 
----------------
              2
(1 row)

RESET enable_seqscan;
DROP TABLE trgm;
-- Adaptive-k ordering scan: consuming more than the initial batch (64) must
-- grow k and return the full ordered set correctly across the boundary.
CREATE TABLE bigord (id serial, d wdoc);
INSERT INTO bigord (d) SELECT to_wdoc('term extra' || (g % 3)) FROM generate_series(1, 300) g;
CREATE INDEX bigord_bm25 ON bigord USING weave (d);
SET enable_seqscan = off;
-- all 300 match 'term'; requesting 200 crosses the initial k=64 batch
SELECT count(*) AS got, bool_and(s >= lead_s) AS ordered_ok
FROM (SELECT r.score AS s, lead(r.score) OVER (ORDER BY r.score DESC) AS lead_s
      FROM (SELECT id, d <=> 'term'::wquery AS score FROM bigord
            WHERE d @@@ 'term'::wquery
            ORDER BY d <=> 'term'::wquery LIMIT 200) r) q;
 got | ordered_ok 
-----+------------
 200 | t
(1 row)

RESET enable_seqscan;
DROP TABLE bigord;
-- Ordering-scan completeness past the adaptive-k growth ceiling.  An ORDER BY
-- <=> index scan is a KNN (amcanorderbyop) scan and must return EVERY matching
-- tuple in score order -- it must not impose its own row ceiling (a prior fixed
-- cap silently truncated a query matching more than the cap to that cap; the
-- executor's LIMIT is the only bound).  5000 docs all match 'wide'; a large
-- LIMIT over the index ordering scan must yield all 5000, matching @@@.
CREATE TABLE bigord2 (id serial, d wdoc);
INSERT INTO bigord2 (d) SELECT to_wdoc('wide filler' || (g % 40)) FROM generate_series(1, 5000) g;
CREATE INDEX bigord2_bm25 ON bigord2 USING weave (d);
SET enable_seqscan = off;
SELECT count(*) AS match_truth FROM bigord2 WHERE d @@@ 'wide'::wquery;   -- 5000
 match_truth 
-------------
        5000
(1 row)

-- ordered index scan (bitmap disabled so the KNN Index Scan path is used) with
-- a LIMIT well past the old 4096 ceiling must still return all 5000
SET enable_bitmapscan = off;
SELECT count(*) AS ordered_scan_rows FROM
  (SELECT id FROM bigord2 WHERE d @@@ 'wide'::wquery
   ORDER BY d <=> 'wide'::wquery LIMIT 1000000) s;   -- 5000 (was capped ~4096)
 ordered_scan_rows 
-------------------
              5000
(1 row)

RESET enable_bitmapscan;
RESET enable_seqscan;
DROP TABLE bigord2;
-- the weave index access method.
CREATE TABLE idxdocs (id serial, d wdoc);
INSERT INTO idxdocs (d) VALUES
  (to_wdoc('the quick brown fox')),
  (to_wdoc('a slow green turtle')),
  (to_wdoc('quick turtles are rare')),
  (to_wdoc('brown bears and quick foxes'));
CREATE INDEX idxdocs_bm25 ON idxdocs USING weave (d);
-- force index usage and confirm the plan uses a bitmap scan on our AM
SET enable_seqscan = off;
EXPLAIN (COSTS OFF) SELECT id FROM idxdocs WHERE d @@@ 'quick'::wquery ORDER BY id;
                   QUERY PLAN                    
-------------------------------------------------
 Sort
   Sort Key: id
   ->  Index Scan using idxdocs_bm25 on idxdocs
         Index Cond: (d @@@ '''quick'''::wquery)
(4 rows)

-- results must match a sequential @@@ evaluation
SELECT id FROM idxdocs WHERE d @@@ 'quick'::wquery ORDER BY id;
 id 
----
  1
  3
  4
(3 rows)

SELECT id FROM idxdocs WHERE d @@@ 'quick & fox'::wquery ORDER BY id;
 id 
----
  1
(1 row)

SELECT id FROM idxdocs WHERE d @@@ 'quick | slow'::wquery ORDER BY id;
 id 
----
  1
  2
  3
  4
(4 rows)

SELECT id FROM idxdocs WHERE d @@@ 'quick & !fox'::wquery ORDER BY id;
 id 
----
  3
  4
(2 rows)

SELECT id FROM idxdocs WHERE d @@@ '!turtle'::wquery ORDER BY id;
 id 
----
  1
  3
  4
(3 rows)

SELECT id FROM idxdocs WHERE d @@@ '(quick | slow) & !fox'::wquery ORDER BY id;
 id 
----
  2
  3
  4
(3 rows)

RESET enable_seqscan;
DROP TABLE idxdocs;
-- Config-normalized query: to_wquery(regconfig, text) must stem query terms
-- to match a doc indexed with the same config (the EC2 benchmark fault).
-- 'postgres' stems to 'postgr'; a raw wquery misses, a config query matches
SELECT to_wdoc('english'::regconfig, 'postgres databases') @@@ 'postgres'::wquery
       AS raw_query_misses;
 raw_query_misses 
------------------
 f
(1 row)

SELECT to_wdoc('english'::regconfig, 'postgres databases')
       @@@ to_wquery('english'::regconfig, 'postgres')
       AS config_query_matches;
 config_query_matches 
----------------------
 t
(1 row)

-- multi-term config query with operators
SELECT to_wdoc('english'::regconfig, 'running quickly through fields')
       @@@ to_wquery('english'::regconfig, 'run & quick')
       AS stemmed_and;
 stemmed_and 
-------------
 t
(1 row)

-- config query renders the stemmed terms
SELECT to_wquery('english'::regconfig, 'databases running')::text AS stemmed_render;
   stemmed_render    
---------------------
 ('databas' & 'run')
(1 row)

-- Segmented architecture: queries must span multiple segments correctly.
CREATE TABLE seg (id serial, d wdoc);
INSERT INTO seg(d) SELECT to_wdoc('alpha doc'||g) FROM generate_series(1,100) g;
CREATE INDEX seg_bm25 ON seg USING weave (d);          -- segment 0
INSERT INTO seg(d) SELECT to_wdoc('beta doc'||g) FROM generate_series(1,50) g;
SELECT weave_merge('seg_bm25');                          -- flush -> segment 1
 weave_merge 
-------------
 t
(1 row)

INSERT INTO seg(d) SELECT to_wdoc('alpha more'||g) FROM generate_series(1,30) g;
SELECT weave_merge('seg_bm25');                          -- flush -> segment 2
 weave_merge 
-------------
 t
(1 row)

SET enable_seqscan = off;
SELECT count(*) AS alpha_spans_segs FROM seg WHERE d @@@ 'alpha'::wquery;  -- 130
 alpha_spans_segs 
------------------
              130
(1 row)

SELECT count(*) AS beta_one_seg FROM seg WHERE d @@@ 'beta'::wquery;        -- 50
 beta_one_seg 
--------------
           50
(1 row)

SELECT ndocs AS total_docs FROM weave_index_stats('seg_bm25');                  -- 180
 total_docs 
------------
        180
(1 row)

SELECT count(*) AS ranked_across_segs
FROM (SELECT id FROM seg WHERE d @@@ 'alpha'::wquery
      ORDER BY d <=> 'alpha'::wquery LIMIT 5) x;                            -- 5
 ranked_across_segs 
--------------------
                  5
(1 row)

RESET enable_seqscan;
DROP TABLE seg;
-- Tiered merge: many flushes create many segments; merge compacts them so the
-- segment count stays bounded while results are preserved.
CREATE TABLE tier (id serial, d wdoc);
INSERT INTO tier(d) SELECT to_wdoc('common w'||(g%20)) FROM generate_series(1,100) g;
CREATE INDEX tier_bm25 ON tier USING weave (d);
DO $$ BEGIN FOR i IN 1..10 LOOP
  INSERT INTO tier(d) SELECT to_wdoc('common x'||(g%20)) FROM generate_series(1,20) g;
  PERFORM weave_merge('tier_bm25');
END LOOP; END $$;
SET enable_seqscan = off;
SELECT count(*) AS all_docs FROM tier WHERE d @@@ 'common'::wquery;   -- 300
 all_docs 
----------
      300
(1 row)

SELECT ndocs FROM weave_index_stats('tier_bm25');                          -- 300
 ndocs 
-------
   300
(1 row)

SELECT weave_index_nsegments('tier_bm25') <= 8 AS segments_bounded;        -- t (compacted)
 segments_bounded 
------------------
 t
(1 row)

RESET enable_seqscan;
DROP TABLE tier;
-- weave_vacuum() reclaim: weave_vacuum fully compacts (merge to one segment) AND
-- truncates the freed tail, so a churned index shrinks back toward its floor.
-- Exercises weave_compact_to_one (low-first pack) + weave_truncate_free_tail and
-- the recycle-gate bypass during single-writer compaction (a freed page must be
-- reusable immediately here, or the pack phase would extend instead of shrink).
CREATE TABLE vac (id serial, d wdoc);
INSERT INTO vac(d) SELECT to_wdoc('vacterm w'||(g%40)||' filler'||g) FROM generate_series(1,4000) g;
CREATE INDEX vac_bm25 ON vac USING weave (d);
-- churn: delete+reinsert several times to bloat the index with freed pages
DO $$ BEGIN FOR i IN 1..4 LOOP
  DELETE FROM vac WHERE id % 2 = 0;
  INSERT INTO vac(d) SELECT to_wdoc('vacterm w'||(g%40)||' r'||i||' filler'||g) FROM generate_series(1,2000) g;
  PERFORM weave_merge('vac_bm25');
END LOOP; END $$;
SELECT weave_vacuum('vac_bm25') IS NOT NULL AS vacuumed;          -- t (ran)
 vacuumed 
----------
 t
(1 row)

SELECT weave_vacuum('vac_bm25') IS NOT NULL AS vacuumed_again;     -- t (ran; idempotent, no error/growth)
 vacuumed_again 
----------------
 t
(1 row)

SELECT weave_index_nsegments('vac_bm25') AS nseg_after_vacuum;     -- 1 (compacted to one)
 nseg_after_vacuum 
-------------------
                 1
(1 row)

SET enable_seqscan = off;
SELECT count(*) > 0 AS still_matches FROM vac WHERE d @@@ 'vacterm'::wquery;  -- t (correct after compaction)
 still_matches 
---------------
 t
(1 row)

RESET enable_seqscan;
DROP TABLE vac;
-- Oversized-document inserts: a body whose analyzed wdoc exceeds one pending
-- page is indexed as its own segment; many of them exercise the write-path
-- auto-compaction (leveled merge after each flush) and the room-ensuring add
-- (merge-to-free-a-slot instead of erroring at the segment cap).  count(*) uses
-- the index-native pushdown.
CREATE TABLE big (id serial, d wdoc);
CREATE INDEX big_bm25 ON big USING weave (d);
-- each doc: a large distinct-token body (oversized) sharing one common term
INSERT INTO big(d)
  SELECT to_wdoc('bigterm ' || string_agg('t'||k||'d'||g, ' '))
  FROM generate_series(1,60) g, generate_series(1,4000) k
  GROUP BY g;
SET enable_seqscan = off;
SELECT count(*) AS big_matches FROM big WHERE d @@@ 'bigterm'::wquery;   -- 60 (index count pushdown)
 big_matches 
-------------
          60
(1 row)

SELECT weave_index_nsegments('big_bm25') <= 128 AS under_cap;               -- t (never hit the hard cap)
 under_cap 
-----------
 t
(1 row)

-- the count(*) pushdown fires for a PLAIN-COLUMN weave index (not just an
-- expression index): the recommended stored-wdoc-column form must get the
-- index-native count, not a bitmap-scan fallback.
DO $$
DECLARE ln text; hit bool := false;
BEGIN
  FOR ln IN EXPLAIN (COSTS off) SELECT count(*) FROM big WHERE d @@@ 'bigterm'::wquery
  LOOP
    IF ln LIKE '%WeaveCount%' THEN hit := true; END IF;
  END LOOP;
  IF NOT hit THEN RAISE EXCEPTION 'plain-column count(*) did not use the WeaveCount pushdown'; END IF;
  RAISE NOTICE 'plaincol_pushdown ok';
END $$;
NOTICE:  plaincol_pushdown ok
-- the dict-df fast path: after VACUUM (all-visible, no tombstones, no pending)
-- a single-term count(*) is answered from the dictionary df alone; the count
-- must still be exact (a wrong fast count would diff here).
VACUUM big;
SELECT count(*) AS big_fastpath FROM big WHERE d @@@ 'bigterm'::wquery;   -- 60
 big_fastpath 
--------------
           60
(1 row)

RESET enable_seqscan;
DROP TABLE big;
-- High-vocabulary build + trigram-through-merge: a corpus of many DISTINCT
-- low-frequency terms (like patches/quoted code) that flushes into several
-- segments then merges.  The trigram index for each merged segment is rebuilt
-- from the merged vocabulary; this exercises the bulk O(N) sparsemap build
-- (sm_add_many_grow) that replaced an O(N^2) per-member insert -- the fix for
-- the field-reported non-converging merge.  Assert exact prefix/fuzzy/regex
-- parity so the bulk build cannot silently drop trigram members.
SET maintenance_work_mem = '1MB';
CREATE TABLE hivocab (id serial, body text);
INSERT INTO hivocab(body)
  SELECT array_to_string(ARRAY(SELECT 'id'||g||'x'||s FROM generate_series(1,40) s),' ')
  FROM generate_series(1,3000) g;   -- ~120k distinct terms across several segments
CREATE INDEX hivocab_bm25 ON hivocab USING weave (to_wdoc('simple', body));
SELECT weave_merge('hivocab_bm25') IS NOT NULL AS hivocab_merged;
 hivocab_merged 
----------------
 t
(1 row)

SET enable_seqscan = off;
SELECT count(*) AS exact FROM hivocab WHERE to_wdoc('simple',body) @@@ 'id5x1'::wquery;      -- 1
 exact 
-------
     1
(1 row)

SELECT count(*) AS prefix FROM hivocab WHERE to_wdoc('simple',body) @@@ 'id5x1*'::wquery;    -- id5x1, id5x10..id5x19 in doc 5
 prefix 
--------
      1
(1 row)

SELECT count(*) >= 1 AS fuzzy_hit FROM hivocab WHERE to_wdoc('simple',body) @@@ 'id5x1~1'::wquery;
 fuzzy_hit 
-----------
 t
(1 row)

SELECT count(*) >= 1 AS regex_hit FROM hivocab WHERE to_wdoc('simple',body) @@@ '/id5x1./'::wquery;
 regex_hit 
-----------
 t
(1 row)

RESET enable_seqscan;
RESET maintenance_work_mem;
DROP TABLE hivocab;
-- Parallel weave_merge: with >2 live segments and parallel maintenance workers
-- available, weave_merge() compacts them via the parallel merge (workers each
-- merge a disjoint segment group; the leader installs the result atomically).
-- Build a segment, then two more via VACUUM-flushed batches of the same size
-- (a run of 3 is below the tiered auto-merge threshold, so all 3 persist), then
-- weave_merge to one.  Result parity is asserted; whether workers actually launch
-- is environment-dependent and not asserted (the merged output is identical
-- either way).
SET max_parallel_maintenance_workers = 2;
CREATE TABLE pmrg (id serial, d wdoc);
INSERT INTO pmrg(d) SELECT to_wdoc('t'||(g%30)||' w'||g) FROM generate_series(1,300) g;
CREATE INDEX pmrg_bm25 ON pmrg USING weave (d);
INSERT INTO pmrg(d) SELECT to_wdoc('t'||(g%30)||' a'||g) FROM generate_series(1,300) g;
VACUUM pmrg;
INSERT INTO pmrg(d) SELECT to_wdoc('t'||(g%30)||' b'||g) FROM generate_series(1,300) g;
VACUUM pmrg;
SELECT weave_index_nsegments('pmrg_bm25') AS segs_before;   -- 3 (run of 3 < tier-min 4)
 segs_before 
-------------
           3
(1 row)

SET enable_seqscan = off;
SELECT count(*) AS t1_before FROM pmrg WHERE d @@@ 't1'::wquery;
 t1_before 
-----------
        30
(1 row)

SELECT weave_merge('pmrg_bm25') AS merged;
 merged 
--------
 t
(1 row)

SELECT weave_index_nsegments('pmrg_bm25') AS segs_after;    -- 1
 segs_after 
------------
          1
(1 row)

SELECT count(*) AS t1_after FROM pmrg WHERE d @@@ 't1'::wquery;   -- == t1_before
 t1_after 
----------
       30
(1 row)

RESET enable_seqscan;
RESET max_parallel_maintenance_workers;
DROP TABLE pmrg;
-- Streaming merge (memory-bounded k-way merge): a low maintenance_work_mem
-- forces many segment flushes during build; a full merge then coalesces them
-- to one segment via the streaming path (one term's postings at a time, not
-- the whole index buffered).  Exercise it with positions=on (position carry),
-- deletes (tombstone drop), and a multi-term corpus that spans several dict
-- pages, then assert exact parity vs a seqscan ground truth after the merge.
SET maintenance_work_mem = '1MB';               -- floor is 32MB, but small anyway
CREATE TABLE strm (id serial, body text);
INSERT INTO strm(body) SELECT 'term'||(g%400)||' shared w'||(g%37)||' doc'||g
  FROM generate_series(1,8000) g;
CREATE INDEX strm_bm25 ON strm USING weave (to_wdoc('simple', body)) WITH (positions = on);
INSERT INTO strm(body) SELECT 'term'||(g%400)||' shared extra'||g
  FROM generate_series(8001,14000) g;
SELECT weave_merge('strm_bm25') IS NOT NULL AS strm_flushed;   -- create >1 segment
 strm_flushed 
--------------
 t
(1 row)

DELETE FROM strm WHERE id % 4 = 0;                            -- tombstones
VACUUM strm;                                                 -- write tombstones into the segment(s)
INSERT INTO strm(body) SELECT 'term'||(g%400)||' shared fresh'||g
  FROM generate_series(14001,18000) g;                       -- a fresh, un-tombstoned segment
SELECT weave_merge('strm_bm25') IS NOT NULL AS strm_merged;     -- streaming merge (tombstoned + fresh) to 1 seg
 strm_merged 
-------------
 t
(1 row)

SET enable_seqscan = off;
-- term-count parity: index scan vs a forced seqscan of the SAME @@@ predicate
-- (ground truth), for a common and a rarer term.
SELECT (SELECT count(*) FROM strm WHERE to_wdoc('simple',body) @@@ 'shared'::wquery) AS idx_shared \gset
SET enable_seqscan = on;
SET enable_indexscan = off; SET enable_bitmapscan = off;
SELECT :idx_shared = (SELECT count(*) FROM strm WHERE to_wdoc('simple',body) @@@ 'shared'::wquery)
       AS strm_shared_parity;
 strm_shared_parity 
--------------------
 t
(1 row)

RESET enable_indexscan; RESET enable_bitmapscan;
SET enable_seqscan = off;
SELECT (SELECT count(*) FROM strm WHERE to_wdoc('simple',body) @@@ 'term5'::wquery) AS idx_term5 \gset
SET enable_seqscan = on;
SET enable_indexscan = off; SET enable_bitmapscan = off;
SELECT :idx_term5 = (SELECT count(*) FROM strm WHERE to_wdoc('simple',body) @@@ 'term5'::wquery)
       AS strm_term5_parity;
 strm_term5_parity 
-------------------
 t
(1 row)

RESET enable_indexscan; RESET enable_bitmapscan;
SET enable_seqscan = off;
-- tombstones dropped: the merged segment's live ndocs equals the live heap
-- rows (14000 - 3500 deleted + 4000 fresh = 14500), not the pre-delete total.
-- If the streaming merge failed to drop tombstoned postings, ndocs would be
-- inflated by the ~3500 deleted docs.
SELECT ndocs = (SELECT count(*) FROM strm) AS strm_tombstones_dropped
  FROM weave_index_stats('strm_bm25');
 strm_tombstones_dropped 
-------------------------
 t
(1 row)

-- phrase (position carry through the streaming merge) still matches
SELECT count(*) > 0 AS strm_phrase_ok
  FROM strm WHERE to_wdoc('simple',body) @@@ to_wquery('simple','"term5 shared"');
 strm_phrase_ok 
----------------
 t
(1 row)

SELECT weave_index_nsegments('strm_bm25') = 1 AS strm_one_segment;   -- coalesced
 strm_one_segment 
------------------
 t
(1 row)

RESET enable_seqscan;
RESET maintenance_work_mem;
DROP TABLE strm;
-- Build memory accounting (regression for the sustained-growth bug): the
-- term hash lives in a CHILD context of the build arena, so the flush budget
-- must count child contexts (MemoryContextMemAllocated(ctx, true)) or a
-- vocabulary-dominant corpus never triggers a flush and the build grows
-- unbounded.  Build a HIGH-distinct-vocabulary corpus (every doc contributes
-- mostly unique terms, so the hash -- not the postings -- dominates memory) at
-- a low maintenance_work_mem, and assert the build completes and returns exact
-- results.  With the pre-fix (child-blind) accounting this build's working set
-- grew far past the budget; with the fix it flushes at the budget as intended.
SET maintenance_work_mem = '1MB';               -- floors to 32MB internally
CREATE TABLE vocab (id serial, body text);
-- ~30k docs, each ~20 unique terms (uniq<id>_<k>) -> ~600k distinct terms, so
-- the term hash dominates the build arena rather than the posting lists.
INSERT INTO vocab(body)
SELECT (SELECT string_agg('uniq'||g||'_'||k, ' ') FROM generate_series(1,20) k)
       || ' shared common'
  FROM generate_series(1, 30000) g;
CREATE INDEX vocab_bm25 ON vocab USING weave (to_wdoc('simple', body));
SET enable_seqscan = off;
-- 'shared' is in every doc: index-scan count == row count == forced-seqscan
SELECT (SELECT count(*) FROM vocab WHERE to_wdoc('simple',body) @@@ 'shared'::wquery) AS idx_shared \gset
SELECT :idx_shared = 30000 AS vocab_shared_all;
 vocab_shared_all 
------------------
 t
(1 row)

SET enable_seqscan = on; SET enable_indexscan = off; SET enable_bitmapscan = off;
SELECT :idx_shared = (SELECT count(*) FROM vocab WHERE to_wdoc('simple',body) @@@ 'shared'::wquery)
       AS vocab_shared_parity;
 vocab_shared_parity 
---------------------
 t
(1 row)

RESET enable_indexscan; RESET enable_bitmapscan; SET enable_seqscan = off;
-- a unique term resolves to exactly its one document (dictionary correct across
-- the many budget-triggered flush segments)
SELECT count(*) = 1 AS vocab_unique_one FROM vocab WHERE to_wdoc('simple',body) @@@ 'uniq7_3'::wquery;
 vocab_unique_one 
------------------
 t
(1 row)

SELECT ndocs = 30000 AS vocab_ndocs FROM weave_index_stats('vocab_bm25');
 vocab_ndocs 
-------------
 t
(1 row)

RESET enable_seqscan;
RESET maintenance_work_mem;
DROP TABLE vocab;
-- FOR-128 block posting codec: a term spanning many 128-doc blocks and pages
-- decodes correctly and block-max WAND top-k matches a full scan+sort.
CREATE TABLE blk (id serial, d wdoc);
INSERT INTO blk(d) SELECT to_wdoc('pop '||repeat('pop ',(g%7))||'w'||g)
  FROM generate_series(1,3000) g;      -- 'pop' in 3000 docs, >20 blocks/page
CREATE INDEX blk_bm25 ON blk USING weave (d);
SET enable_seqscan = off;
SELECT count(*) AS pop_ct FROM blk WHERE d @@@ 'pop'::wquery;   -- 3000
 pop_ct 
--------
   3000
(1 row)

-- WAND top-10 distances equal a full seqscan sort's top-10 distances
CREATE TEMP TABLE w AS SELECT round((d <=> 'pop'::wquery)::numeric,6) dist
  FROM blk WHERE d @@@ 'pop'::wquery ORDER BY dist LIMIT 10;
SET enable_indexscan = off; SET enable_bitmapscan = off; SET enable_seqscan = on;
CREATE TEMP TABLE f AS SELECT round((d <=> 'pop'::wquery)::numeric,6) dist
  FROM blk WHERE d @@@ 'pop'::wquery ORDER BY dist LIMIT 10;
SELECT (SELECT array_agg(dist ORDER BY dist) FROM w)
     = (SELECT array_agg(dist ORDER BY dist) FROM f) AS wand_scores_match_fullsort;
 wand_scores_match_fullsort 
----------------------------
 t
(1 row)

RESET enable_seqscan; RESET enable_indexscan; RESET enable_bitmapscan;
DROP TABLE blk;
-- Sparse dictionary block index (FST-equivalent point lookup): a many-page
-- dictionary routes exact lookups to the right page; first/middle/last/absent
-- terms all resolve correctly, and df via the seek path is exact.
CREATE TABLE voc (id serial, d wdoc);
INSERT INTO voc(d) SELECT to_wdoc('term'||lpad(g::text,5,'0')||' shared')
  FROM generate_series(1,8000) g;      -- 8000 distinct terms -> multi-page dict
CREATE INDEX voc_bm25 ON voc USING weave (d);
SET enable_seqscan = off;
SELECT count(*) AS first_term  FROM voc WHERE d @@@ 'term00001'::wquery;  -- 1
 first_term 
------------
          1
(1 row)

SELECT count(*) AS mid_term    FROM voc WHERE d @@@ 'term04000'::wquery;  -- 1
 mid_term 
----------
        1
(1 row)

SELECT count(*) AS last_term   FROM voc WHERE d @@@ 'term08000'::wquery;  -- 1
 last_term 
-----------
         1
(1 row)

SELECT count(*) AS absent_term FROM voc WHERE d @@@ 'termzzzzz'::wquery;  -- 0
 absent_term 
-------------
           0
(1 row)

SELECT count(*) AS shared_all  FROM voc WHERE d @@@ 'shared'::wquery;     -- 8000
 shared_all 
------------
       8000
(1 row)

SELECT weave_index_df('voc_bm25','term04000'::wquery) AS df_mid;            -- {1}
 df_mid 
--------
 {1}
(1 row)

-- block index survives an insert+flush (new segment gets its own index)
INSERT INTO voc(d) SELECT to_wdoc('term'||lpad(g::text,5,'0')||' shared')
  FROM generate_series(8001,8100) g;
SELECT weave_merge('voc_bm25');
 weave_merge 
-------------
 t
(1 row)

SELECT count(*) AS after_flush FROM voc WHERE d @@@ 'term08050'::wquery;  -- 1
 after_flush 
-------------
           1
(1 row)

RESET enable_seqscan;
DROP TABLE voc;
-- Block-Max WAND (BMW): the block-max skip prunes whole 128-blocks that cannot
-- beat the current top-k threshold, and the exact top-k is unchanged.
CREATE TABLE bmw (id serial, d wdoc);
INSERT INTO bmw(d) SELECT to_wdoc('alpha '||
    CASE WHEN g%50=0 THEN repeat('beta ',5) ELSE '' END||'w'||g)
  FROM generate_series(1,12000) g;
CREATE INDEX bmw_bm25 ON bmw USING weave (d);
SET enable_seqscan = off;
CREATE TEMP TABLE bmw_top AS SELECT round((d <=> 'alpha beta'::wquery)::numeric,6) dist
  FROM bmw WHERE d @@@ 'alpha beta'::wquery ORDER BY dist LIMIT 10;
SET enable_indexscan = off; SET enable_bitmapscan = off; SET enable_seqscan = on;
CREATE TEMP TABLE bmw_all AS SELECT round((d <=> 'alpha beta'::wquery)::numeric,6) dist
  FROM bmw WHERE d @@@ 'alpha beta'::wquery ORDER BY dist LIMIT 10;
SELECT (SELECT array_agg(dist ORDER BY dist) FROM bmw_top)
     = (SELECT array_agg(dist ORDER BY dist) FROM bmw_all) AS bmw_exact_topk;
 bmw_exact_topk 
----------------
 t
(1 row)

RESET enable_seqscan; RESET enable_indexscan; RESET enable_bitmapscan;
DROP TABLE bmw;
-- Levenshtein-automaton fuzzy: matches EXACTLY the dictionary terms within k
-- edits (no trigram over-generation), verified against core levenshtein.
CREATE EXTENSION IF NOT EXISTS fuzzystrmatch;
CREATE TABLE fz (id serial, body text, d wdoc);
INSERT INTO fz(body) SELECT 'document'||g||' filler' FROM generate_series(1,5000) g;
UPDATE fz SET d = to_wdoc(body);
CREATE INDEX fz_bm25 ON fz USING weave (d);
SET enable_seqscan = off;
SELECT count(*) AS dfa_fuzzy FROM fz WHERE d @@@ 'document42~2'::wquery;
 dfa_fuzzy 
-----------
       778
(1 row)

SET enable_seqscan = on; SET enable_indexscan = off; SET enable_bitmapscan = off;
SELECT count(*) AS ground_truth FROM fz
WHERE EXISTS (SELECT 1 FROM unnest(string_to_array(body,' ')) t
              WHERE levenshtein_less_equal(t,'document42',2) <= 2);
 ground_truth 
--------------
          778
(1 row)

RESET enable_seqscan; RESET enable_indexscan; RESET enable_bitmapscan;
DROP TABLE fz;
DROP EXTENSION fuzzystrmatch;
-- MaxScore top-k (chosen for queries with >=4 terms): identical exact top-k to
-- a full scan+sort, doing less work as low-impact terms become non-essential.
CREATE TABLE ms (id serial, d wdoc);
INSERT INTO ms(d) SELECT to_wdoc(
  (CASE WHEN g%2=0 THEN 'alpha ' ELSE '' END)||
  (CASE WHEN g%3=0 THEN 'beta ' ELSE '' END)||
  (CASE WHEN g%5=0 THEN 'gamma ' ELSE '' END)||
  (CASE WHEN g%7=0 THEN 'delta ' ELSE '' END)||
  (CASE WHEN g%11=0 THEN 'epsilon ' ELSE '' END)||'w'||g)
  FROM generate_series(1,20000) g;
CREATE INDEX ms_bm25 ON ms USING weave (d);
SET enable_seqscan = off;
CREATE TEMP TABLE mtop AS SELECT round((d <=> 'alpha beta gamma delta epsilon'::wquery)::numeric,6) dist
  FROM ms WHERE d @@@ 'alpha beta gamma delta epsilon'::wquery ORDER BY dist LIMIT 20;
SET enable_indexscan = off; SET enable_bitmapscan = off; SET enable_seqscan = on;
CREATE TEMP TABLE mall AS SELECT round((d <=> 'alpha beta gamma delta epsilon'::wquery)::numeric,6) dist
  FROM ms WHERE d @@@ 'alpha beta gamma delta epsilon'::wquery ORDER BY dist LIMIT 20;
SELECT (SELECT array_agg(dist ORDER BY dist) FROM mtop)
     = (SELECT array_agg(dist ORDER BY dist) FROM mall) AS maxscore_exact_topk;
 maxscore_exact_topk 
---------------------
 t
(1 row)

RESET enable_seqscan; RESET enable_indexscan; RESET enable_bitmapscan;
DROP TABLE ms;
-- Tombstones: VACUUM must remove deleted docs from the index so the index-only
-- scan and weave_count (which trust the visibility map) never report a
-- vacuumed-and-reused heap slot, and a later merge must physically drop them.
CREATE EXTENSION IF NOT EXISTS pg_weave;
NOTICE:  extension "pg_weave" already exists, skipping
CREATE TABLE tomb (id int primary key, d wdoc);
INSERT INTO tomb SELECT g, to_wdoc('alpha doc'||g) FROM generate_series(1,100) g;
CREATE INDEX tomb_bm25 ON tomb USING weave (d);
SET enable_seqscan = off;
SELECT count(*) AS c_before FROM tomb WHERE d @@@ 'alpha'::wquery;         -- 100
 c_before 
----------
      100
(1 row)

DELETE FROM tomb WHERE id <= 40;
VACUUM tomb;
SELECT count(*) AS c_after FROM tomb WHERE d @@@ 'alpha'::wquery;          -- 60
 c_after 
---------
      60
(1 row)

SELECT weave_count('tomb_bm25','alpha'::wquery) AS fc_after;                 -- 60
 fc_after 
----------
       60
(1 row)

-- delete-all + vacuum + reuse: the reused slots must NOT match 'alpha'
DELETE FROM tomb;
VACUUM tomb;
INSERT INTO tomb SELECT g, to_wdoc('beta doc'||g) FROM generate_series(1,60) g;
VACUUM tomb;
SELECT count(*) AS alpha_reused FROM tomb WHERE d @@@ 'alpha'::wquery;     -- 0
 alpha_reused 
--------------
            0
(1 row)

SELECT count(*) AS beta_reused FROM tomb WHERE d @@@ 'beta'::wquery;       -- 60
 beta_reused 
-------------
          60
(1 row)

SELECT weave_count('tomb_bm25','beta'::wquery) AS beta_reused_fc;            -- 60
 beta_reused_fc 
----------------
             60
(1 row)

RESET enable_seqscan;
-- Corpus statistics (BM25 IDF + length normalization) count only LIVE documents.
-- After deleting rows and REINDEX, weave_index_stats.ndocs must reflect the live
-- corpus, not the pre-delete count -- the build callback must not count a
-- non-live document into ndocs/sumdoclen (it still indexes recently-dead
-- postings for old snapshots, but they do not inflate the statistics).
DELETE FROM tomb WHERE id > 30;                 -- keep 30 of the 60 beta rows
VACUUM tomb;
REINDEX INDEX tomb_bm25;
SELECT ndocs::int AS ndocs_live, nterms > 0 AS has_terms
  FROM weave_index_stats('tomb_bm25');            -- ndocs_live = 30
 ndocs_live | has_terms 
------------+-----------
         30 | t
(1 row)

DROP TABLE tomb;
-- oversized document: an analyzed wdoc larger than one pending page must be
-- indexed as its own segment rather than rejected
CREATE TABLE bigdoc (id int, d wdoc);
CREATE INDEX bigdoc_bm25 ON bigdoc USING weave (d);
INSERT INTO bigdoc SELECT 1, to_wdoc(string_agg('term'||g||'x', ' '))
  FROM generate_series(1,4000) g;
INSERT INTO bigdoc VALUES (2, to_wdoc('small doc with term500x here'));
SET enable_seqscan=off;
SELECT count(*) AS big_term500 FROM bigdoc WHERE d @@@ 'term500x'::wquery;   -- 2
 big_term500 
-------------
           2
(1 row)

SELECT count(*) AS big_term3999 FROM bigdoc WHERE d @@@ 'term3999x'::wquery; -- 1
 big_term3999 
--------------
            1
(1 row)

RESET enable_seqscan;
DROP TABLE bigdoc;
-- parallel index build (amcanbuildparallel): a parallel-built index must return
-- exactly what a serial build does.  Force workers with a zero scan threshold.
CREATE TABLE pbuild (id int, d wdoc);
INSERT INTO pbuild SELECT g, to_wdoc('common term'||(g%200)||' doc'||g)
  FROM generate_series(1,20000) g;
SET min_parallel_table_scan_size = 0;
SET max_parallel_maintenance_workers = 2;
CREATE INDEX pbuild_bm25 ON pbuild USING weave (d);
RESET max_parallel_maintenance_workers;
RESET min_parallel_table_scan_size;
SET enable_seqscan = off;
SELECT weave_count('pbuild_bm25', 'common'::wquery) AS all_docs;      -- 20000
 all_docs 
----------
    20000
(1 row)

SELECT weave_count('pbuild_bm25', 'term7'::wquery) AS term7;          -- 100
 term7 
-------
   100
(1 row)

SELECT count(*) AS ranked FROM (SELECT id FROM pbuild WHERE d @@@ 'common'::wquery
  ORDER BY d <=> 'common'::wquery LIMIT 10) x;                      -- 10
 ranked 
--------
     10
(1 row)

RESET enable_seqscan;
DROP TABLE pbuild;
-- weave_vacuum: full compaction + tail truncation.  A parallel build
-- leaves dead source-segment pages; weave_vacuum reclaims them and truncates the
-- file, and the contents are unchanged afterward.
CREATE TABLE vac (id int, d wdoc);
INSERT INTO vac SELECT g, to_wdoc('common term'||(g%200)||' doc'||g)
  FROM generate_series(1,20000) g;
SET min_parallel_table_scan_size = 0;
SET max_parallel_maintenance_workers = 2;
CREATE INDEX vac_bm25 ON vac USING weave (d);
RESET max_parallel_maintenance_workers;
RESET min_parallel_table_scan_size;
SET enable_seqscan = off;
SELECT weave_count('vac_bm25', 'common'::wquery) AS before_all;       -- 20000
 before_all 
------------
      20000
(1 row)

SELECT weave_vacuum('vac_bm25') IS NOT NULL AS vacuumed;               -- t
 vacuumed 
----------
 t
(1 row)

SELECT weave_count('vac_bm25', 'common'::wquery) AS after_all;        -- 20000
 after_all 
-----------
     20000
(1 row)

SELECT weave_count('vac_bm25', 'term7'::wquery) AS after_term7;       -- 100
 after_term7 
-------------
         100
(1 row)

SELECT weave_index_nsegments('vac_bm25') AS nseg_after;                 -- 1
 nseg_after 
------------
          1
(1 row)

RESET enable_seqscan;
DROP TABLE vac;
-- weave_vacuum convergence + genuine reclaim (regression: the compactor used to
-- either OSCILLATE (shrink then re-grow) or be STABLE-but-INEFFECTIVE (never
-- reclaim), leaving ~35-65% of the file as stranded free space on the dominant
-- bloat layout, where the live segment sits at HIGH blocks and the freed dead
-- pages form a LOW free region SMALLER than the live segment).  Build that
-- layout deterministically, then assert a single weave_vacuum():
--   (i)   SHRINKS the bloated index toward its floor,
--   (ii)  reaches a low dead-space ratio (within 15% of a freshly-built twin),
--   (iii) is STABLE across repeated calls (no oscillation, never exceeds pre).
-- Deterministic: fixed data, parallelism off (a parallel merge/build changes
-- the page layout and the segment count).
SET max_parallel_maintenance_workers = 0;
SET max_parallel_workers_per_gather = 0;
CREATE TABLE vconv (id int, d wdoc);
INSERT INTO vconv SELECT g, to_wdoc('term'||(g%800)||' shared'||' w'||(g%53)||' doc'||g)
  FROM generate_series(1,40000) g;
CREATE INDEX vconv_bm25 ON vconv USING weave (d);
INSERT INTO vconv SELECT g+40000, to_wdoc('term'||(g%800)||' shared'||' w'||(g%53)||' doc'||g)
  FROM generate_series(1,40000) g;
SELECT weave_merge('vconv_bm25') IS NOT NULL AS merged1;
 merged1 
---------
 t
(1 row)

DELETE FROM vconv WHERE id % 5 = 0;
-- weave_merge (NO vacuum here: a VACUUM would auto-compact and hide the bloat)
-- folds the tombstones into a smaller segment written to fresh HIGH blocks,
-- freeing the old segment's LOW pages -- the free<live layout the fix reclaims.
SELECT weave_merge('vconv_bm25') IS NOT NULL AS merged2;
 merged2 
---------
 t
(1 row)

-- A freshly-built twin over the SAME surviving rows is the size FLOOR reference.
CREATE TABLE vfloor (id int, d wdoc);
INSERT INTO vfloor SELECT id, d FROM vconv;
CREATE INDEX vfloor_bm25 ON vfloor USING weave (d);
SELECT weave_merge('vfloor_bm25') IS NOT NULL AS floor_merged;
 floor_merged 
--------------
 t
(1 row)

SET enable_seqscan = off;
SELECT pg_relation_size('vconv_bm25') AS sz_bloat \gset
SELECT pg_relation_size('vfloor_bm25') AS sz_floor \gset
SELECT weave_vacuum('vconv_bm25') IS NOT NULL AS vac1;
 vac1 
------
 t
(1 row)

SELECT pg_relation_size('vconv_bm25') AS sz1 \gset
SELECT weave_vacuum('vconv_bm25') IS NOT NULL AS vac2;
 vac2 
------
 t
(1 row)

SELECT pg_relation_size('vconv_bm25') AS sz2 \gset
SELECT weave_vacuum('vconv_bm25') IS NOT NULL AS vac3;
 vac3 
------
 t
(1 row)

SELECT pg_relation_size('vconv_bm25') AS sz3 \gset
-- (i) SHRANK: the single vacuum reclaimed a large fraction of the bloated file
SELECT :sz1 < :sz_bloat AS shrank;                                   -- t
 shrank 
--------
 t
(1 row)

-- (ii) EFFECTIVE: reclaimed most of the bloat (well under half the bloated size).
-- (Not compared to a fresh single-build floor: weave_vacuum packs+truncates the
-- merged segment set, which for a churned multi-segment index is legitimately
-- larger than a from-scratch rebuild; "reclaimed most of the dead space" is the
-- property that matters, and the fresh-floor ratio is sensitive to per-segment
-- overhead as a fraction of a small index.)
SELECT :sz1 <= :sz_bloat / 2 AS reclaimed_most;                      -- t
 reclaimed_most 
----------------
 t
(1 row)

-- (iii) STABLE + never grew: repeated calls do not change size or exceed pre
SELECT :sz1 = :sz2 AND :sz2 = :sz3 AS converged;                     -- t
 converged 
-----------
 t
(1 row)

SELECT :sz1 <= :sz_bloat AND :sz2 <= :sz_bloat AND :sz3 <= :sz_bloat AS never_grew; -- t
 never_grew 
------------
 t
(1 row)

-- contents intact after convergence (count parity vs the surviving rows)
SELECT weave_count('vconv_bm25', 'shared'::wquery) AS shared_cnt;    -- 64000
 shared_cnt 
------------
      64000
(1 row)

SELECT weave_index_nsegments('vconv_bm25') AS nseg;                    -- 1
 nseg 
------
    1
(1 row)

RESET enable_seqscan;
RESET max_parallel_maintenance_workers;
RESET max_parallel_workers_per_gather;
DROP TABLE vconv;
DROP TABLE vfloor;
-- COUNT pushdown CustomScan (transparent count(*) WHERE @@@ answered from the
-- index).  The plan is a Custom Scan (WeaveCount); the count matches weave_count;
-- and it must NOT trigger when the shape is unsupported (extra qual, GROUP BY).
CREATE TABLE cnt (id int, body text);
INSERT INTO cnt SELECT g, 'common '||CASE WHEN g%4=0 THEN 'quarter ' ELSE '' END||'w'||(g%100)
  FROM generate_series(1,10000) g;
CREATE INDEX cnt_bm25 ON cnt USING weave(to_wdoc('english',body));
ANALYZE cnt;
SET enable_seqscan=off;
SELECT count(*) = weave_count('cnt_bm25', to_wquery('english','common')) AS count_matches
  FROM cnt WHERE to_wdoc('english',body) @@@ to_wquery('english','common');
 count_matches 
---------------
 t
(1 row)

SELECT count(*) AS quarter_cnt FROM cnt WHERE to_wdoc('english',body) @@@ to_wquery('english','quarter');  -- 2500
 quarter_cnt 
-------------
        2500
(1 row)

-- the bare count(*) plan is a Custom Scan (WeaveCount)
EXPLAIN (COSTS OFF) SELECT count(*) FROM cnt
  WHERE to_wdoc('english',body) @@@ to_wquery('english','common');
        QUERY PLAN        
--------------------------
 Custom Scan (WeaveCount)
(1 row)

-- an extra qual disables the pushdown (falls back to Aggregate over a scan)
EXPLAIN (COSTS OFF) SELECT count(*) FROM cnt
  WHERE to_wdoc('english',body) @@@ to_wquery('english','common') AND id > 5;
                                        QUERY PLAN                                        
------------------------------------------------------------------------------------------
 Aggregate
   ->  Bitmap Heap Scan on cnt
         Recheck Cond: (to_wdoc('english'::regconfig, body) @@@ '''common'''::wquery)
         Filter: (id > 5)
         ->  Bitmap Index Scan on cnt_bm25
               Index Cond: (to_wdoc('english'::regconfig, body) @@@ '''common'''::wquery)
(6 rows)

RESET enable_seqscan;
DROP TABLE cnt;
-- ============================================================================
-- Ranked index scan must respect boolean AND/NOT/PHRASE structure.
-- The `<=>` ordering scan flattened the query to its terms and ranked the
-- disjunction, so AND/NOT queries could return docs that fail `@@@` (e.g.
-- `a & !b` ranking docs that contain b).  Every doc a ranked scan returns must
-- satisfy `@@@`.  The AM ordering path (weave_gettuple) is only reached when the
-- planner picks an "Index Scan ... Order By" on the weave index -- that needs a
-- stored wdoc column (not an expression index) AND the `WHERE d @@@ q`
-- restriction alongside `ORDER BY d <=> q`.  Without both, the planner falls
-- back to a Seq Scan + Sort over the `<=>` operator (which never enters the AM
-- candidate path), so we assert the plan first, then assert zero violations.
CREATE TABLE bp (id serial, d wdoc);
INSERT INTO bp(d) SELECT to_wdoc('alpha gamma d'||g)       FROM generate_series(1,40) g;  -- alpha, no beta
INSERT INTO bp(d) SELECT to_wdoc('alpha beta d'||g)        FROM generate_series(1,40) g;  -- alpha AND beta
INSERT INTO bp(d) SELECT to_wdoc('beta delta d'||g)        FROM generate_series(1,40) g;  -- beta, no alpha
INSERT INTO bp(d) SELECT to_wdoc('alpha beta gamma d'||g)  FROM generate_series(1,20) g;  -- all three
CREATE INDEX bp_weave ON bp USING weave (d);
ANALYZE bp;
SET enable_seqscan=off; SET enable_bitmapscan=off; SET enable_indexscan=on;
-- the plan MUST be the AM ordering Index Scan (no Sort); otherwise the filter
-- code is never exercised and the test would silently pass on the buggy engine.
EXPLAIN (COSTS OFF) SELECT id FROM bp WHERE d @@@ 'alpha & !beta'::wquery
  ORDER BY d <=> 'alpha & !beta'::wquery LIMIT 20;
                          QUERY PLAN                           
---------------------------------------------------------------
 Limit
   ->  Index Scan using bp_weave on bp
         Index Cond: (d @@@ '(''alpha'' & !''beta'')'::wquery)
         Order By: (d <=> '(''alpha'' & !''beta'')'::wquery)
(4 rows)

-- NOT: `alpha & !beta` ranked top-20 must contain NO doc with beta (0 violations).
SELECT count(*) AS not_violations FROM (
  SELECT d FROM bp WHERE d @@@ 'alpha & !beta'::wquery
  ORDER BY d <=> 'alpha & !beta'::wquery LIMIT 20
) s WHERE NOT (s.d @@@ 'alpha & !beta'::wquery);
 not_violations 
----------------
              0
(1 row)

-- AND: `alpha & beta & gamma` ranked top-20 must contain only docs with all three.
SELECT count(*) AS and3_violations FROM (
  SELECT d FROM bp WHERE d @@@ 'alpha & beta & gamma'::wquery
  ORDER BY d <=> 'alpha & beta & gamma'::wquery LIMIT 20
) s WHERE NOT (s.d @@@ 'alpha & beta & gamma'::wquery);
 and3_violations 
-----------------
               0
(1 row)

-- every ranked row must satisfy @@@ for the AND query (retrieval == match set).
SELECT count(*) AS and_atatat_violations FROM (
  SELECT id, d FROM bp WHERE d @@@ 'alpha & beta'::wquery
  ORDER BY d <=> 'alpha & beta'::wquery LIMIT 20
) s WHERE NOT (s.d @@@ 'alpha & beta'::wquery);
 and_atatat_violations 
-----------------------
                     0
(1 row)

-- grow-k must terminate and return all matches when LIMIT exceeds the match
-- count: only 40 docs satisfy `alpha & !beta`, so LIMIT 500 returns exactly 40.
SELECT count(*) AS not_all_matches FROM (
  SELECT d FROM bp WHERE d @@@ 'alpha & !beta'::wquery
  ORDER BY d <=> 'alpha & !beta'::wquery LIMIT 500
) s;
 not_all_matches 
-----------------
              40
(1 row)

RESET enable_seqscan; RESET enable_bitmapscan; RESET enable_indexscan;
DROP TABLE bp;
-- ----------------------------------------------------------------------------
-- Ranked index scan must ALSO enforce PHRASE/NEAR adjacency and FUZZY/REGEX
-- edit-distance -- not just boolean AND/NOT.  weave_collect_matches returns the
-- over-generated set (PHRASE = AND-set with adjacency unenforced; fuzzy/regex =
-- trigram-funnel candidates) with recheck=true.  The bitmap @@@ path resolves
-- this with an executor recheck; the ranked <=> scan has none, so the AM must
-- recheck the exact @@@ test against the heap wdoc before ranking.  Before
-- the fix, a ranked `"quick brown"` over the rows below returned all 20
-- non-adjacent "quick red slow brown" docs; it must now return 0.
CREATE TABLE rp (id serial, d wdoc);
-- 20 NON-adjacent docs (both terms present, not consecutive): the AND-set, and
-- the phrase-recheck must reject every one.
INSERT INTO rp(d) SELECT to_wdoc('simple'::regconfig, 'quick red slow brown d'||g)
  FROM generate_series(1,20) g;
-- 5 ADJACENT docs ("quick brown" consecutive): the true phrase matches.
INSERT INTO rp(d) SELECT to_wdoc('simple'::regconfig, 'quick brown fox d'||g)
  FROM generate_series(1,5) g;
CREATE INDEX rp_weave ON rp USING weave (d);
ANALYZE rp;
SET enable_seqscan=off; SET enable_bitmapscan=off; SET enable_indexscan=on;
-- plan MUST be the AM ordering Index Scan (no Sort), else the recheck code is
-- never exercised and a buggy engine would pass silently.
EXPLAIN (COSTS OFF) SELECT id FROM rp
  WHERE d @@@ to_wquery('simple'::regconfig, '"quick brown"')
  ORDER BY d <=> to_wquery('simple'::regconfig, '"quick brown"') LIMIT 50;
                           QUERY PLAN                            
-----------------------------------------------------------------
 Limit
   ->  Index Scan using rp_weave on rp
         Index Cond: (d @@@ '(''quick'' <-> ''brown'')'::wquery)
         Order By: (d <=> '(''quick'' <-> ''brown'')'::wquery)
(4 rows)

-- PHRASE: ranked top-50 must contain ZERO non-adjacent docs (was 20 pre-fix).
SELECT count(*) AS phrase_violations FROM (
  SELECT d FROM rp WHERE d @@@ to_wquery('simple'::regconfig, '"quick brown"')
  ORDER BY d <=> to_wquery('simple'::regconfig, '"quick brown"') LIMIT 50
) s WHERE NOT (s.d @@@ to_wquery('simple'::regconfig, '"quick brown"'));
 phrase_violations 
-------------------
                 0
(1 row)

-- and it returns exactly the 5 true adjacent matches (grow-k terminates even
-- though the exact set (5) is far smaller than the AND-set (25)).
SELECT count(*) AS phrase_matches FROM (
  SELECT d FROM rp WHERE d @@@ to_wquery('simple'::regconfig, '"quick brown"')
  ORDER BY d <=> to_wquery('simple'::regconfig, '"quick brown"') LIMIT 500
) s;
 phrase_matches 
----------------
              5
(1 row)

-- NEAR: within-k admits, beyond-k rejects, all on the ranked path.
-- "quick" and "brown" are adjacent in the 5 rows (distance 1) and 3 apart in
-- the 20 rows ("quick red slow brown").  NEAR(...,3) admits all 25; NEAR(...,1)
-- admits only the 5 adjacent ones.
SELECT count(*) AS near3_matches FROM (
  SELECT d FROM rp WHERE d @@@ to_wquery('simple'::regconfig, 'NEAR(quick brown, 3)')
  ORDER BY d <=> to_wquery('simple'::regconfig, 'NEAR(quick brown, 3)') LIMIT 500
) s;
 near3_matches 
---------------
            25
(1 row)

SELECT count(*) AS near1_matches FROM (
  SELECT d FROM rp WHERE d @@@ to_wquery('simple'::regconfig, 'NEAR(quick brown, 1)')
  ORDER BY d <=> to_wquery('simple'::regconfig, 'NEAR(quick brown, 1)') LIMIT 500
) s;
 near1_matches 
---------------
             5
(1 row)

SELECT count(*) AS near1_violations FROM (
  SELECT d FROM rp WHERE d @@@ to_wquery('simple'::regconfig, 'NEAR(quick brown, 1)')
  ORDER BY d <=> to_wquery('simple'::regconfig, 'NEAR(quick brown, 1)') LIMIT 500
) s WHERE NOT (s.d @@@ to_wquery('simple'::regconfig, 'NEAR(quick brown, 1)'));
 near1_violations 
------------------
                0
(1 row)

RESET enable_seqscan; RESET enable_bitmapscan; RESET enable_indexscan;
DROP TABLE rp;
-- ----------------------------------------------------------------------------
-- Positional postings (WITH positions=on): phrase/NEAR answered DIRECTLY from
-- the posting lists (no heap recheck).  The results MUST be identical to the
-- recheck path (positions=off), and the phrase set MUST be smaller than the
-- AND set.  Same corpus shape as the cliff repro: an adjacent phrase, a
-- co-occurring-but-not-adjacent set, and noise.
CREATE TABLE pos_on  (id serial, body text);
CREATE TABLE pos_off (id serial, body text);
INSERT INTO pos_on(body)
SELECT CASE WHEN g % 3 = 0 THEN 'alpha united states beta d'||g          -- adjacent phrase
            WHEN g % 3 = 1 THEN 'alpha united middle states beta d'||g   -- AND, not phrase
            ELSE 'gamma delta noise d'||g END                           -- neither
FROM generate_series(1, 600) g;
INSERT INTO pos_off(body) SELECT body FROM pos_on;
CREATE INDEX pos_on_idx  ON pos_on  USING weave (to_wdoc('simple'::regconfig, body)) WITH (positions = on);
CREATE INDEX pos_off_idx ON pos_off USING weave (to_wdoc('simple'::regconfig, body));  -- default off
ANALYZE pos_on; ANALYZE pos_off;
SET enable_seqscan = off;
-- phrase count from positions == phrase count from recheck (identical answer)
SELECT
  (SELECT count(*) FROM pos_on  WHERE to_wdoc('simple'::regconfig, body) @@@ to_wquery('simple'::regconfig, '"united states"')) AS pos_on_phrase,
  (SELECT count(*) FROM pos_off WHERE to_wdoc('simple'::regconfig, body) @@@ to_wquery('simple'::regconfig, '"united states"')) AS pos_off_phrase;
 pos_on_phrase | pos_off_phrase 
---------------+----------------
           200 |            200
(1 row)

-- phrase count is STRICTLY less than the AND count (adjacency really enforced)
SELECT
  (SELECT count(*) FROM pos_on WHERE to_wdoc('simple'::regconfig, body) @@@ to_wquery('simple'::regconfig, '"united states"')) <
  (SELECT count(*) FROM pos_on WHERE to_wdoc('simple'::regconfig, body) @@@ to_wquery('simple'::regconfig, 'united & states')) AS phrase_lt_and;
 phrase_lt_and 
---------------
 t
(1 row)

-- the matched id SET is identical between the positional and recheck indexes:
-- the symmetric difference of the two match sets must be empty (0).
SELECT
  (SELECT count(*) FROM (
     SELECT id FROM pos_on  WHERE to_wdoc('simple'::regconfig, body) @@@ to_wquery('simple'::regconfig, '"united states"')
     EXCEPT
     SELECT id FROM pos_off WHERE to_wdoc('simple'::regconfig, body) @@@ to_wquery('simple'::regconfig, '"united states"')) d1)
+ (SELECT count(*) FROM (
     SELECT id FROM pos_off WHERE to_wdoc('simple'::regconfig, body) @@@ to_wquery('simple'::regconfig, '"united states"')
     EXCEPT
     SELECT id FROM pos_on  WHERE to_wdoc('simple'::regconfig, body) @@@ to_wquery('simple'::regconfig, '"united states"')) d2)
  AS phrase_symdiff;  -- 0: the two index shapes agree exactly
 phrase_symdiff 
----------------
              0
(1 row)

-- weave_count on the positional index equals the phrase (adjacency) count
SELECT weave_count('pos_on_idx', to_wquery('simple'::regconfig, '"united states"'))
     = (SELECT count(*) FROM pos_on WHERE to_wdoc('simple'::regconfig, body) @@@ to_wquery('simple'::regconfig, '"united states"'))
     AS weave_count_phrase_ok;
 weave_count_phrase_ok 
-----------------------
 t
(1 row)

-- NEAR on positions: within-k admits the co-occurring 'united ... states' too
SELECT
  (SELECT count(*) FROM pos_on  WHERE to_wdoc('simple'::regconfig, body) @@@ to_wquery('simple'::regconfig, 'NEAR(united states, 2)')) =
  (SELECT count(*) FROM pos_off WHERE to_wdoc('simple'::regconfig, body) @@@ to_wquery('simple'::regconfig, 'NEAR(united states, 2)')) AS near_pos_eq_recheck;
 near_pos_eq_recheck 
---------------------
 t
(1 row)

-- plain (non-phrase) AND count is identical between on/off (positions invisible)
SELECT
  (SELECT count(*) FROM pos_on  WHERE to_wdoc('simple'::regconfig, body) @@@ to_wquery('simple'::regconfig, 'united & states')) =
  (SELECT count(*) FROM pos_off WHERE to_wdoc('simple'::regconfig, body) @@@ to_wquery('simple'::regconfig, 'united & states')) AS and_on_eq_off;
 and_on_eq_off 
---------------
 t
(1 row)

RESET enable_seqscan;
-- multi-segment / pending: phrase must be correct across several segments (the
-- positional hits accumulate per-segment and are merged); insert more rows
-- after the index exists so they land in new segments / the pending list.
INSERT INTO pos_on(body)
SELECT CASE WHEN g % 2 = 0 THEN 'zeta united states omega e'||g
            ELSE 'zeta united gap states omega e'||g END
FROM generate_series(1, 300) g;
SET enable_seqscan = off;
SELECT weave_count('pos_on_idx', to_wquery('simple'::regconfig, '"united states"'))
     = (SELECT count(*) FROM pos_on WHERE to_wdoc('simple'::regconfig, body) @@@ to_wquery('simple'::regconfig, '"united states"'))
     AS multiseg_phrase_ok;
 multiseg_phrase_ok 
--------------------
 t
(1 row)

RESET enable_seqscan;
-- weave_vacuum must still reclaim on the v3 positional format (P1 gate): delete
-- most rows, vacuum, assert the index shrinks.
DELETE FROM pos_on WHERE id % 3 <> 0;
SELECT weave_vacuum('pos_on_idx');
 weave_vacuum 
--------------
 t
(1 row)

SELECT weave_merge('pos_on_idx');
 weave_merge 
-------------
 f
(1 row)

-- phrase still correct after vacuum/merge carried positions through
SELECT count(*) > 0 AS phrase_survives_vacuum
  FROM pos_on WHERE to_wdoc('simple'::regconfig, body) @@@ to_wquery('simple'::regconfig, '"united states"');
 phrase_survives_vacuum 
------------------------
 t
(1 row)

DROP TABLE pos_on; DROP TABLE pos_off;
-- Positions-decode allocation guard (regression for the 1.0.1 read-path crash):
-- weave_decode_term sizes a per-block scratch from Sum(tf) of one block.  A doc
-- that repeats a term very many times drives a large Sum(tf); the decode must
-- (a) NOT throw "invalid memory alloc request size" (huge-safe alloc), and
-- (b) NOT false-positive its corruption guard on the legitimate width-0 case
-- (a term always at the same position -> all-zero position deltas -> a width-0
-- positions column whose posbytelen is tiny even though Sum(tf) is large).
-- Build a positions=on index over such docs and assert phrase/count still work
-- and match the recheck (positions=off) path exactly, with no corruption WARNING.
CREATE TABLE posbig (id serial, body text);
-- 'hot' repeated 300x/doc (large per-posting tf -> large Sum(tf) per block);
-- 'edge' appears once so a phrase mixing them is exercised too.
INSERT INTO posbig(body)
SELECT repeat('hot ', 300) || 'edge tail d'||g FROM generate_series(1, 400) g;
CREATE INDEX posbig_on  ON posbig USING weave (to_wdoc('simple'::regconfig, body)) WITH (positions = on);
CREATE TABLE posbig_off (id serial, body text);
INSERT INTO posbig_off(body) SELECT body FROM posbig;
CREATE INDEX posbig_offidx ON posbig_off USING weave (to_wdoc('simple'::regconfig, body));
SET enable_seqscan = off;
-- (a) a plain term-count over the high-Sum(tf) term does not error
SELECT count(*) = 400 AS posbig_hot_count
  FROM posbig WHERE to_wdoc('simple'::regconfig, body) @@@ 'hot'::wquery;
 posbig_hot_count 
------------------
 t
(1 row)

-- (b) phrase from positions == phrase from recheck (identical), guard did not
-- spuriously drop the legitimate high-Sum(tf) block
SELECT
  (SELECT count(*) FROM posbig     WHERE to_wdoc('simple'::regconfig, body) @@@ to_wquery('simple'::regconfig, '"hot edge"'))
  = (SELECT count(*) FROM posbig_off WHERE to_wdoc('simple'::regconfig, body) @@@ to_wquery('simple'::regconfig, '"hot edge"'))
    AS posbig_phrase_parity;
 posbig_phrase_parity 
----------------------
 t
(1 row)

-- force a merge (re-decodes every block through the same path) then re-check
SELECT weave_merge('posbig_on') IS NOT NULL AS posbig_merged;
 posbig_merged 
---------------
 t
(1 row)

SELECT count(*) = 400 AS posbig_hot_after_merge
  FROM posbig WHERE to_wdoc('simple'::regconfig, body) @@@ 'hot'::wquery;
 posbig_hot_after_merge 
------------------------
 t
(1 row)

RESET enable_seqscan;
DROP TABLE posbig; DROP TABLE posbig_off;
-- three-word positional phrase + NEAR must match the recheck path exactly (the
-- phrase_step chain over posting positions == the heap adjacency chain).
CREATE TABLE pos3 (id serial, body text);
INSERT INTO pos3(body) VALUES
 ('x quick brown fox y'),        -- adjacent 3-word
 ('quick brown cat'),            -- only 2 of 3
 ('quick red brown fox'),        -- not fully adjacent
 ('a quick brown fox');          -- adjacent 3-word
INSERT INTO pos3(body) SELECT 'noise d'||g FROM generate_series(1,200) g;
CREATE INDEX pos3_on  ON pos3 USING weave (to_wdoc('simple'::regconfig, body)) WITH (positions = on);
CREATE INDEX pos3_off ON pos3 USING weave (to_wdoc('simple'::regconfig, body));
SET enable_seqscan = off;
SELECT array_agg(id ORDER BY id) AS phrase3_ids
  FROM pos3 WHERE to_wdoc('simple'::regconfig, body) @@@ to_wquery('simple'::regconfig, '"quick brown fox"');  -- {1,4}
 phrase3_ids 
-------------
 {1,4}
(1 row)

SELECT weave_count('pos3_on',  to_wquery('simple'::regconfig, '"quick brown fox"'))
     = weave_count('pos3_off', to_wquery('simple'::regconfig, '"quick brown fox"')) AS phrase3_on_eq_off;
 phrase3_on_eq_off 
-------------------
 t
(1 row)

SELECT weave_count('pos3_on',  to_wquery('simple'::regconfig, 'NEAR(quick brown fox, 2)'))
     = weave_count('pos3_off', to_wquery('simple'::regconfig, 'NEAR(quick brown fox, 2)')) AS near3_on_eq_off;
 near3_on_eq_off 
-----------------
 t
(1 row)

RESET enable_seqscan;
DROP TABLE pos3;
-- v2 index rejected with a REINDEX hint (format version bump 2 -> 3).  We can't
-- easily fabricate a v2 index here, but the version guard message is asserted
-- by the build-time check; the reloption round-trips through pg_class:
CREATE TABLE reloptt (id serial, d wdoc);
INSERT INTO reloptt(d) SELECT to_wdoc('a b c d'||g) FROM generate_series(1,5) g;
CREATE INDEX reloptt_idx ON reloptt USING weave (d) WITH (positions = on);
SELECT reloptions FROM pg_class WHERE relname = 'reloptt_idx';  -- {positions=on}
   reloptions   
----------------
 {positions=on}
(1 row)

DROP TABLE reloptt;
-- FUZZY ranked scan: the trigram funnel over-generates candidates (recheck),
-- so the ranked scan must apply the exact edit-distance test.  All rows share
-- trigrams with the query term but only some are within edit distance 1.
CREATE TABLE rf (id serial, d wdoc);
INSERT INTO rf(d) VALUES
  (to_wdoc('document zulu')),   -- 1: exact "document" (edit distance 0)
  (to_wdoc('documemt zulu')),   -- 2: "documemt" (distance 1: t<-m... n->m)
  (to_wdoc('documenta zulu')),  -- 3: "documenta" (distance 1: trailing a)
  (to_wdoc('doc zulu')),        -- 4: "doc" shares trigrams, distance > 1
  (to_wdoc('dokumemt zulu'));   -- 5: "dokumemt" (distance 2) -- candidate, rejected
CREATE INDEX rf_weave ON rf USING weave (d);
ANALYZE rf;
SET enable_seqscan=off; SET enable_bitmapscan=off; SET enable_indexscan=on;
-- ranked `document~1`: every returned row must truly be within edit distance 1
-- (the funnel yields more candidates; the recheck drops docs 4 and 5).
SELECT count(*) AS fuzzy_violations FROM (
  SELECT d FROM rf WHERE d @@@ 'document~1'::wquery
  ORDER BY d <=> 'document~1'::wquery LIMIT 500
) s WHERE NOT (s.d @@@ 'document~1'::wquery);
 fuzzy_violations 
------------------
                0
(1 row)

-- ranked fuzzy/prefix/regex return a correct SUBSET of the @@@ matches, not the
-- identical set: the ranked WAND path builds cursors from the literal query term
-- (weave_query_terms), so a doc that matches only via a fuzzy/prefix/regex
-- EXPANSION (no posting for the literal term) is never generated as a ranked
-- candidate.  weave_recheck_exact only ever shrinks, so every returned row is a
-- true match (fuzzy_violations = 0 above) but the ranked count can be < the
-- bitmap @@@ count.  Hence f, by design (a known limitation, documented in
-- CAPABILITIES.md / ROADMAP.md); use @@@ for exhaustive fuzzy/prefix retrieval.
SELECT (SELECT count(*) FROM (
          SELECT d FROM rf WHERE d @@@ 'document~1'::wquery
          ORDER BY d <=> 'document~1'::wquery LIMIT 500) s)
     = (SELECT count(*) FROM rf WHERE d @@@ 'document~1'::wquery)
     AS fuzzy_ranked_eq_bitmap;
 fuzzy_ranked_eq_bitmap 
------------------------
 f
(1 row)

RESET enable_seqscan; RESET enable_bitmapscan; RESET enable_indexscan;
DROP TABLE rf;
-- ============================================================================
-- Ranked <=> parity: the ordering index scan must return the same top-k SET
-- as an exact brute-force BM25 score sort (distinct scores => deterministic).
-- Guards the WAND/MaxScore recall + the 0.2.1 boolean-structure gate.
-- ranked <=> ordering scan must equal the fair brute-force BM25 top-k SET.
-- Distinct scores (unique tf per doc) => deterministic, no tie ambiguity.
-- Index MUST be flushed (VACUUM) so the ranked path covers all docs; pending
-- docs are intentionally not ranked (CAPABILITIES.md), so a flush is part of
-- the contract this test checks.
CREATE TABLE rankparity (id int, d wdoc);
-- unique alpha tf per doc (1..600) -> strictly distinct single-term scores;
-- every 4th doc also carries beta/delta/epsilon for OR/AND/4-term coverage.
INSERT INTO rankparity(id, d)
SELECT g, to_wdoc(repeat('alpha ', g) ||
       (CASE WHEN g % 4 = 0 THEN 'beta delta epsilon ' ELSE '' END))
FROM generate_series(1, 600) g;
-- rare term, distinct tf
INSERT INTO rankparity(id, d)
SELECT 10000+g, to_wdoc(repeat('gamma ', g)) FROM generate_series(1, 12) g;
CREATE INDEX rankparity_idx ON rankparity USING weave (d);
VACUUM rankparity;   -- flush: ranked path covers all docs
ANALYZE rankparity;
-- returns the number of index-top-k rows NOT in the fair-oracle top-k (expect 0)
CREATE OR REPLACE FUNCTION _rank_miss(qtext text, kk int) RETURNS int
LANGUAGE plpgsql AS $$
DECLARE nd float8; ad float8; dfs float8[]; ntie int; nmiss int;
BEGIN
  SELECT ndocs, avgdl INTO nd, ad FROM weave_index_stats('rankparity_idx');
  SELECT weave_index_df('rankparity_idx', qtext::wquery) INTO dfs;
  -- distinct-score guard: the test is only meaningful with 0 ties
  EXECUTE format($f$SELECT count(*) FROM (
     SELECT round(weave_bm25(d,%L::wquery,%s,%s,%L)::numeric,12) sc
     FROM rankparity WHERE d @@@ %L::wquery) z GROUP BY sc HAVING count(*)>1$f$,
     qtext,nd,ad,dfs,qtext) INTO ntie;
  IF COALESCE(ntie,0) <> 0 THEN
    RAISE EXCEPTION 'rank parity test corpus has % score ties for %', ntie, qtext;
  END IF;
  SET LOCAL enable_seqscan = off; SET LOCAL enable_bitmapscan = off;
  -- A genuine miss is an index-returned doc whose EXACT score (weave_bm25 with the
  -- true stored doclen) is more than 1% below the exact k-th score.  v4 scores
  -- with a quantized doclen, so at a score boundary the index may return an
  -- equivalently-scored doc; that is the documented fieldnorm tradeoff, not a
  -- recall error.  (For a v3 index the quantization is absent and this is exact.)
  EXECUTE format($f$
    WITH ix AS (
      SELECT weave_bm25(d,%L::wquery,%s,%s,%L) AS sc
      FROM rankparity WHERE d @@@ %L::wquery
      ORDER BY d <=> %L::wquery LIMIT %s),
    cut AS (
      SELECT min(sc) AS kth FROM (
        SELECT weave_bm25(d,%L::wquery,%s,%s,%L) AS sc
        FROM rankparity WHERE d @@@ %L::wquery
        ORDER BY sc DESC LIMIT %s) z)
    SELECT count(*) FROM ix, cut WHERE ix.sc < cut.kth * 0.99 - 1e-9$f$,
    qtext, nd, ad, dfs, qtext, qtext, kk,
    qtext, nd, ad, dfs, qtext, kk) INTO nmiss;
  RETURN nmiss;
END $$;
SELECT _rank_miss('alpha',1)                          AS common_k1,   -- 0
       _rank_miss('alpha',10)                         AS common_k10,  -- 0
       _rank_miss('alpha',50)                         AS common_k50,  -- 0
       _rank_miss('alpha',100)                        AS common_k100, -- 0
       _rank_miss('gamma',10)                         AS rare_k10,    -- 0
       _rank_miss('alpha | beta',50)                  AS or_k50,      -- 0
       _rank_miss('alpha & beta',50)                  AS and_k50,     -- 0
       _rank_miss('alpha & beta & delta & epsilon',50) AS and4_k50;   -- 0 (MaxScore)
 common_k1 | common_k10 | common_k50 | common_k100 | rare_k10 | or_k50 | and_k50 | and4_k50 
-----------+------------+------------+-------------+----------+--------+---------+----------
         0 |          0 |          0 |           0 |        0 |      0 |       0 |        0
(1 row)

-- boolean-structure gate (v0.2.2 DocidFilter): AND/NOT top-k rows must satisfy @@@
SET enable_seqscan = off; SET enable_bitmapscan = off;
SELECT count(*) AS and_bool_violations FROM (
  SELECT d FROM rankparity WHERE d @@@ 'alpha & beta'::wquery
  ORDER BY d <=> 'alpha & beta'::wquery LIMIT 50) x
WHERE NOT (x.d @@@ 'alpha & beta'::wquery);          -- 0
 and_bool_violations 
---------------------
                   0
(1 row)

SELECT count(*) AS not_bool_violations FROM (
  SELECT d FROM rankparity WHERE d @@@ 'alpha & !beta'::wquery
  ORDER BY d <=> 'alpha & !beta'::wquery LIMIT 50) x
WHERE NOT (x.d @@@ 'alpha & !beta'::wquery);         -- 0
 not_bool_violations 
---------------------
                   0
(1 row)

RESET enable_seqscan; RESET enable_bitmapscan;
DROP FUNCTION _rank_miss(text,int);
DROP TABLE rankparity;
-- ============================================================
-- wdoc I/O faithful round-trip (Codeberg #3).
--
--   wdoc_in(wdoc_out(x))    = x   (text)
--   wdoc_recv(wdoc_send(x)) = x   (binary, via COPY ... WITH (FORMAT binary))
--
-- wdoc has no '=' operator, so equality is byte-identity of the binary form:
-- wdoc_send now encodes version+nterms+doclen+has_pos+terms+tf+positions, so
-- equal send() output <=> semantically equal document (terms, tf AND positions).
-- Each property yields a single boolean sentinel; both must be t.
-- ============================================================
CREATE TEMP TABLE rt (id int, d wdoc);
INSERT INTO rt VALUES
  (1, to_wdoc('The quick brown fox, the QUICK fox!')),  -- positions, tf>1, multi-pos
  (2, to_wdoc('')),                                      -- empty (nterms=0)
  (3, to_wdoc('single')),                                -- one term
  (4, to_wdoc('a a a b')),                               -- repeats -> tf 3 with 3 positions
  (5, $$'br\'o\\wn':1@3 'f:o@x':2@4,7$$::wdoc),          -- escaped ' and \, literal : @ in lexeme
  (6, $$'caf\u00e9':1@1$$::wdoc),                        -- unicode-ish lexeme (bytes preserved)
  (7, $$'x':2@1,4 'y':1@9$$::wdoc);                      -- distinct terms, gaps in positions
-- text round-trip: parse of the canonical rendering equals the original.
SELECT bool_and(wdoc_send(wdoc_out(d)::text::wdoc) = wdoc_send(d)) AS text_roundtrip_ok
FROM rt;
 text_roundtrip_ok 
-------------------
 t
(1 row)

-- binary round-trip: send then recv (COPY binary) equals the original.
COPY rt TO '/tmp/pg_weave_rt.bin' WITH (FORMAT binary);
CREATE TEMP TABLE rt2 (id int, d wdoc);
COPY rt2 FROM '/tmp/pg_weave_rt.bin' WITH (FORMAT binary);
SELECT bool_and(wdoc_send(a.d) = wdoc_send(b.d)) AS binary_roundtrip_ok
FROM rt a JOIN rt2 b USING (id);
 binary_roundtrip_ok 
---------------------
 t
(1 row)

-- the bare-string cast must still tokenize (not be parsed as canonical).
SELECT wdoc_out('the quick brown fox'::wdoc) AS bare_cast_still_analyzes;
          bare_cast_still_analyzes           
---------------------------------------------
 'brown':1@3 'fox':1@4 'quick':1@2 'the':1@1
(1 row)

-- malformed canonical input is rejected cleanly (no crash).  Detection rule:
-- input is canonical once a first complete 'term':tf token parses; a later
-- malformation is then a hard error (trust boundary).  Input that never
-- completes one token is treated as raw text instead (the bare-string cast),
-- so each case below carries a valid leading token to force the error path.
SELECT $$'ok':1 'unterminated:1$$::wdoc;             -- ERROR: unterminated quoted term
ERROR:  malformed wdoc literal
LINE 1: SELECT $$'ok':1 'unterminated:1$$::wdoc;
               ^
DETAIL:  unterminated quoted term at "'unterminated:1".
SELECT $$'ok':1 'a':0$$::wdoc;                       -- ERROR: tf must be >= 1
ERROR:  invalid wdoc: term frequency must be at least 1
LINE 1: SELECT $$'ok':1 'a':0$$::wdoc;
               ^
SELECT $$'b':1@2 'a':1@1$$::wdoc;                    -- ERROR: terms not sorted
ERROR:  invalid wdoc: terms must be sorted and distinct
LINE 1: SELECT $$'b':1@2 'a':1@1$$::wdoc;
               ^
SELECT $$'a':2@5,5$$::wdoc;                          -- ERROR: positions not ascending
ERROR:  invalid wdoc: positions must be ascending within a term
LINE 1: SELECT $$'a':2@5,5$$::wdoc;
               ^
SELECT $$'a':2@1$$::wdoc;                            -- ERROR: fewer positions than tf
ERROR:  malformed wdoc literal
LINE 1: SELECT $$'a':2@1$$::wdoc;
               ^
DETAIL:  expected 2 positions for tf=2.
DROP TABLE rt2;
DROP TABLE rt;
-- ============================================================================
-- Crash regression (issue: SIGABRT in add_posting / SIGSEGV in weave_doc_matches
-- on the pending-list + flush path with long punctuation-dense tokens).  The
-- readers now validate each pending document (weave_doc_is_valid) before trusting
-- its term offsets, so a malformed page is skipped with a WARNING instead of
-- crashing.  This exercises the valid long-token path end to end (build empty
-- -> pending insert -> @@@/count/phrase scan over pending -> VACUUM flush ->
-- scan again); it must complete and return stable counts, never crash.
-- ============================================================================
CREATE TABLE crashreg (id bigint, subject text, from_addr text, mid text);
CREATE INDEX crashreg_weave ON crashreg
  USING weave (to_wdoc('english'::regconfig,
    COALESCE(subject,'') || ' ' || COALESCE(from_addr,'') || ' ' || COALESCE(mid,'')))
  WITH (positions = on);
-- inserts go to the pending list (index already exists); long base64/msgid-like
-- single tokens (>64 bytes -> the hash-key chaining path) + a high-tf term.
INSERT INTO crashreg
SELECT g, 'Re: meeting notes ' || g,
       'user' || g || '@example.com',
       'rIdUrvZaMegl2LcXsPOkRgaQKN5dyOoMF4hWSNJ5h-H4fN-LT5ODLPwFRG7sutCKpAcAWzTs' || g || '=@pm.me'
FROM generate_series(1, 400) g;
SET enable_seqscan = off;
-- crash-2 path: count(*) pushdown + phrase over pending docs
SELECT count(*) AS pending_word_hits FROM crashreg
  WHERE to_wdoc('english', COALESCE(subject,'')||' '||COALESCE(from_addr,'')||' '||COALESCE(mid,''))
        @@@ to_wquery('english','notes');
 pending_word_hits 
-------------------
               400
(1 row)

SELECT count(*) AS pending_phrase_hits FROM crashreg
  WHERE to_wdoc('english', COALESCE(subject,'')||' '||COALESCE(from_addr,'')||' '||COALESCE(mid,''))
        @@@ to_wquery('english','"meeting notes"');
 pending_phrase_hits 
---------------------
                 400
(1 row)

-- crash-1 path: flush the pending list into a segment
VACUUM crashreg;
-- same queries after the flush must return the same counts
SELECT count(*) AS flushed_word_hits FROM crashreg
  WHERE to_wdoc('english', COALESCE(subject,'')||' '||COALESCE(from_addr,'')||' '||COALESCE(mid,''))
        @@@ to_wquery('english','notes');
 flushed_word_hits 
-------------------
               400
(1 row)

SELECT count(*) AS flushed_phrase_hits FROM crashreg
  WHERE to_wdoc('english', COALESCE(subject,'')||' '||COALESCE(from_addr,'')||' '||COALESCE(mid,''))
        @@@ to_wquery('english','"meeting notes"');
 flushed_phrase_hits 
---------------------
                 400
(1 row)

RESET enable_seqscan;
DROP TABLE crashreg;
-- ============================================================================
-- Crash regression (issue: SIGSEGV in weave_doc_matches <- weave_collect_matches
-- <- weave_gettuple, intermittent, in the SEGMENT posting-decode path).  Root
-- cause: weave_decode_term read a block header's `count` from disk and unpacked
-- that many values into fixed 128-element stack arrays (gaps/tfs/dls) with no
-- bound check -- a torn/corrupt header with count > WEAVE_BLOCK_SIZE overflowed
-- the stack (the WAND loader already clamped; this decoder did not).  The fix
-- clamps count to WEAVE_BLOCK_SIZE and stops decoding a block whose declared
-- byte lengths run past the page.  This exercises the decoder over a large
-- multi-block posting list (df >> 128, with positions) through count/phrase
-- scans and a merge; it must complete with stable counts.
-- ============================================================================
CREATE TABLE decreg (id int, body text);
CREATE INDEX decreg_idx ON decreg USING weave (to_wdoc('simple', body)) WITH (positions = on);
-- 'common' appears in every row -> a df=4000 posting list spanning ~32 blocks;
-- 'alpha beta' phrase spans blocks too (positions decoded across block boundaries).
INSERT INTO decreg SELECT g, 'alpha beta common tok' || (g % 200) FROM generate_series(1, 4000) g;
VACUUM decreg;                              -- flush pending -> segment blocks
SELECT weave_merge('decreg_idx'::regclass);   -- one segment; longest posting lists
 weave_merge 
-------------
 f
(1 row)

SET enable_seqscan = off;
SELECT count(*) AS common_df FROM decreg
  WHERE to_wdoc('simple', body) @@@ to_wquery('simple','common');
 common_df 
-----------
      4000
(1 row)

SELECT count(*) AS phrase_hits FROM decreg
  WHERE to_wdoc('simple', body) @@@ to_wquery('simple','"alpha beta"');
 phrase_hits 
-------------
        4000
(1 row)

RESET enable_seqscan;
DROP TABLE decreg;
-- ============================================================================
-- Coverage: exercise paths the main suite misses (wquery binary recv, the
-- <=> commutator, a parallel-built index + parallel merge, and an empty-index
-- build).  These are all reachable via SQL and were previously untested.
-- ============================================================================
-- wquery binary send/recv round-trip (wquery_recv): COPY BINARY out+back.
CREATE TEMP TABLE qrt (id int, q wquery);
INSERT INTO qrt VALUES
  (1, 'alpha & beta'::wquery),
  (2, 'alpha | (beta & !gamma)'::wquery),
  (3, '"quick brown fox"'::wquery),
  (4, 'NEAR(alpha beta, 3)'::wquery),
  (5, 'quick* & alpha'::wquery);
COPY qrt TO '/tmp/pg_weave_qrt.bin' WITH (FORMAT binary);
CREATE TEMP TABLE qrt2 (id int, q wquery);
COPY qrt2 FROM '/tmp/pg_weave_qrt.bin' WITH (FORMAT binary);
SELECT bool_and(wquery_send(a.q) = wquery_send(b.q)) AS wquery_binary_roundtrip_ok
FROM qrt a JOIN qrt2 b USING (id);
 wquery_binary_roundtrip_ok 
----------------------------
 t
(1 row)

-- the <=> distance commutator: query <=> doc must equal doc <=> query.
SELECT (to_wquery('quick') <=> to_wdoc('the quick brown fox'))
     = (to_wdoc('the quick brown fox') <=> to_wquery('quick')) AS commutator_ok;
 commutator_ok 
---------------
 t
(1 row)

-- parallel index build + parallel merge over a table big enough to split.
SET max_parallel_maintenance_workers = 2;
SET min_parallel_table_scan_size = 0;
CREATE TABLE parbuild (id int, body text);
INSERT INTO parbuild SELECT g, 'term'||(g%500)||' common alpha beta' FROM generate_series(1, 20000) g;
CREATE INDEX parbuild_idx ON parbuild USING weave (to_wdoc('simple', body));
SELECT weave_merge('parbuild_idx'::regclass) IS NOT NULL AS merged;
 merged 
--------
 t
(1 row)

SET enable_seqscan = off;
SELECT count(*) AS par_hits FROM parbuild
  WHERE to_wdoc('simple', body) @@@ to_wquery('simple','common');
 par_hits 
----------
    20000
(1 row)

RESET enable_seqscan;
RESET max_parallel_maintenance_workers;
RESET min_parallel_table_scan_size;
DROP TABLE parbuild;
-- empty-table index build (weave_buildempty / a build with zero rows).
CREATE TABLE emptydoc (id int, body text);
CREATE INDEX emptydoc_idx ON emptydoc USING weave (to_wdoc('simple', body));
SELECT count(*) AS empty_hits FROM emptydoc
  WHERE to_wdoc('simple', body) @@@ to_wquery('simple','anything');
 empty_hits 
------------
          0
(1 row)

DROP TABLE emptydoc;
-- ============================================================================
-- Coverage: highlight/snippet, canonical wdoc parsing (positions + escapes +
-- error paths), wdoc binary recv WITH positions, and regex-query trigram
-- extraction -- functions the main suite exercises only lightly.
-- ============================================================================
-- weave_highlight / weave_snippet with default and custom markers + boolean/phrase.
SELECT weave_highlight('the quick brown fox jumps', 'quick & fox'::wquery) AS hl_default;
               hl_default                
-----------------------------------------
 the <b>quick</b> brown <b>fox</b> jumps
(1 row)

SELECT weave_highlight('the quick brown fox', 'quick'::wquery, '[', ']') AS hl_custom;
       hl_custom       
-----------------------
 the [quick] brown fox
(1 row)

SELECT weave_highlight('nothing matches here', 'zzz'::wquery) AS hl_nomatch;
      hl_nomatch      
----------------------
 nothing matches here
(1 row)

SELECT weave_snippet(repeat('alpha beta gamma delta ', 20) || 'needle tail',
                   'needle'::wquery) AS snip_default;
                                             snip_default                                             
------------------------------------------------------------------------------------------------------
 ...gamma delta alpha beta gamma delta alpha beta gamma delta alpha beta gamma delta <b>needle</b>...
(1 row)

SELECT weave_snippet('short doc with needle', 'needle'::wquery,
                   '<<', '>>', ' ... ', 5) AS snip_custom;
        snip_custom        
---------------------------
 short doc with <<needle>>
(1 row)

SELECT weave_snippet('the quick brown fox', '"quick brown"'::wquery) AS snip_phrase;
            snip_phrase            
-----------------------------------
 the <b>quick</b> <b>brown</b> fox
(1 row)

-- canonical wdoc parsing: positions, repeated tf, escaped quote/backslash.
SELECT ($$'brown':1@3 'fox':2@2,5 'quick':1@1$$::wdoc)::text AS canon_positions;
           canon_positions           
-------------------------------------
 'brown':1@3 'fox':2@2,5 'quick':1@1
(1 row)

SELECT ($$'a''b':1@1 'c\\d':1@2$$::wdoc)::text AS canon_escapes;
                    canon_escapes                    
-----------------------------------------------------
 '1':3@3,4,7 '2':1@8 'a':1@1 'b':1@2 'c':1@5 'd':1@6
(1 row)

-- malformed canonical input -> clean errors (parser error branches).
SELECT $$'ok':1 'bad$$::wdoc;             -- unterminated quoted term
ERROR:  malformed wdoc literal
LINE 1: SELECT $$'ok':1 'bad$$::wdoc;
               ^
DETAIL:  unterminated quoted term at "'bad".
SELECT $$'ok':1 'x':abc$$::wdoc;          -- non-numeric tf
ERROR:  malformed wdoc literal
LINE 1: SELECT $$'ok':1 'x':abc$$::wdoc;
               ^
DETAIL:  expected term frequency after ':' at "abc".
SELECT $$'z':1@ $$::wdoc;                 -- '@' with no positions
ERROR:  malformed wdoc literal
LINE 1: SELECT $$'z':1@ $$::wdoc;
               ^
DETAIL:  expected a position at " ".
-- wdoc binary recv carrying positions (COPY BINARY of a positional doc).
CREATE TEMP TABLE drt (id int, d wdoc);
INSERT INTO drt VALUES (1, to_wdoc('alpha beta alpha gamma alpha')); -- alpha tf=3, positions
COPY drt TO '/tmp/pg_weave_drt.bin' WITH (FORMAT binary);
CREATE TEMP TABLE drt2 (id int, d wdoc);
COPY drt2 FROM '/tmp/pg_weave_drt.bin' WITH (FORMAT binary);
SELECT bool_and(wdoc_send(a.d) = wdoc_send(b.d)) AS doc_pos_binary_roundtrip_ok
FROM drt a JOIN drt2 b USING (id);
 doc_pos_binary_roundtrip_ok 
-----------------------------
 t
(1 row)

-- regex-query trigram extraction (weave_regex_trigrams) over varied patterns.
SELECT to_wdoc('the quicksand shifts') @@@ '/quick.*/'::wquery AS rx_star;
 rx_star 
---------
 t
(1 row)

SELECT to_wdoc('color colour') @@@ '/colou?r/'::wquery AS rx_opt;
 rx_opt 
--------
 t
(1 row)

SELECT to_wdoc('cat bat hat') @@@ '/[cbh]at/'::wquery AS rx_class;
 rx_class 
----------
 t
(1 row)

SELECT to_wdoc('foobar') @@@ '/foo|xyz/'::wquery AS rx_alt;
 rx_alt 
--------
 t
(1 row)

-- ============================================================================
-- Coverage: force the size-tiered segment merge (many small segments -> group
-- merge, weave_merge_one_group / weave_merge_group_to_seg) and a parallel index
-- build over a larger table (weave_parallel_build_main), plus a delete/vacuum
-- compaction cycle (tombstone drop during merge).
-- ============================================================================
CREATE TABLE segmerge (id int, body text);
CREATE INDEX segmerge_idx ON segmerge USING weave (to_wdoc('simple', body));
-- many small INSERT batches, each flushed to its own segment via VACUUM, so a
-- later weave_merge has similarly-sized segments to group-merge.
DO $$
BEGIN
  FOR b IN 0..7 LOOP
    INSERT INTO segmerge SELECT b*1000 + g, 'common term'||((b*1000+g)%300)||' alpha'
      FROM generate_series(1, 1000) g;
    PERFORM weave_vacuum('segmerge_idx'::regclass);  -- flush this batch to a segment
  END LOOP;
END $$;
SELECT weave_merge('segmerge_idx'::regclass) IS NOT NULL AS grouped;   -- size-tiered group merge
 grouped 
---------
 t
(1 row)

-- delete a chunk + vacuum: tombstones must be dropped by the next merge.
DELETE FROM segmerge WHERE id % 3 = 0;
VACUUM segmerge;
SELECT weave_vacuum('segmerge_idx'::regclass) IS NOT NULL AS compacted;
 compacted 
-----------
 t
(1 row)

SET enable_seqscan = off;
SELECT count(*) > 0 AS merge_hits FROM segmerge
  WHERE to_wdoc('simple', body) @@@ to_wquery('simple','common');
 merge_hits 
------------
 t
(1 row)

RESET enable_seqscan;
DROP TABLE segmerge;
-- parallel index build: a larger table + forced workers so the parallel build
-- leader/worker paths (weave_parallel_build_main) actually run.
CREATE TABLE parbig (id int, body text);
INSERT INTO parbig SELECT g, 'word'||(g%1000)||' shared alpha beta gamma delta epsilon'
  FROM generate_series(1, 60000) g;
SET max_parallel_maintenance_workers = 3;
SET min_parallel_table_scan_size = 0;
SET maintenance_work_mem = '64MB';
ALTER TABLE parbig SET (parallel_workers = 3);
CREATE INDEX parbig_idx ON parbig USING weave (to_wdoc('simple', body));
SET enable_seqscan = off;
SELECT count(*) > 0 AS parbig_hits FROM parbig
  WHERE to_wdoc('simple', body) @@@ to_wquery('simple','shared');
 parbig_hits 
-------------
 t
(1 row)

RESET enable_seqscan;
RESET max_parallel_maintenance_workers;
RESET min_parallel_table_scan_size;
RESET maintenance_work_mem;
DROP TABLE parbig;
-- ============================================================================
-- Coverage: the BM25 scoring functions (weave_bm25 / weave_bm25_opts / weave_bm25f)
-- across all variants and parameter paths -- pure scalar functions, so these
-- are deterministic and index-free.
-- ============================================================================
-- weave_bm25: default scoring, with and without an explicit per-term df array.
SELECT round(weave_bm25(to_wdoc('the quick brown fox'), 'quick & fox'::wquery,
                      1000.0, 12.0)::numeric, 4) AS weave_default;
 weave_default 
---------------
       17.8840
(1 row)

SELECT round(weave_bm25(to_wdoc('the quick brown fox'), 'quick'::wquery,
                      1000.0, 12.0, ARRAY[50.0])::numeric, 4) AS weave_with_dfs;
 weave_with_dfs 
----------------
         4.1068
(1 row)

SELECT weave_bm25(to_wdoc('no match here'), 'zzz'::wquery, 1000.0, 12.0) AS weave_nomatch;
 weave_nomatch 
---------------
             0
(1 row)

-- weave_bm25_opts: every variant + custom k1/b.
SELECT v AS variant,
       round(weave_bm25_opts(to_wdoc('the quick brown fox jumps'),
                           'quick & fox'::wquery,
                           1000.0, 12.0, 1.2, 0.75, v)::numeric, 4) AS score
FROM unnest(ARRAY['lucene','robertson','atire','bm25+','bm25l']) AS v
ORDER BY v;
  variant  |  score  
-----------+---------
 atire     | 18.1457
 bm25+     | 30.0898
 bm25l     | 18.7411
 lucene    | 17.0833
 robertson | 17.0793
(5 rows)

-- non-default k1/b (parameter path).
SELECT round(weave_bm25_opts(to_wdoc('alpha beta alpha gamma'),
                           'alpha'::wquery, 500.0, 8.0, 2.0, 0.5, 'lucene')::numeric, 4)
       AS weave_opts_tuned;
 weave_opts_tuned 
------------------
           9.9620
(1 row)

-- weave_bm25f: multi-field weighted scoring (title weighted higher than body).
SELECT round(weave_bm25f(
         ARRAY[to_wdoc('quick fox'), to_wdoc('the quick brown fox runs fast')],
         'quick & fox'::wquery,
         ARRAY[2.0, 1.0],          -- field weights (title x2, body x1)
         1000.0,
         ARRAY[3.0, 10.0])::numeric, 4) AS bm25f_score;
 bm25f_score 
-------------
     22.1299
(1 row)

-- ============================================================================
-- Coverage: WAND/MaxScore block skipping in the ranked <=> scan (wand_seek /
-- wand_skip_blocks / wand_block_max_contrib).  These only fire when a term's
-- posting list spans many 128-doc blocks and a small-LIMIT top-k lets the
-- traversal skip whole blocks that cannot beat the running threshold.  Build a
-- large index where 'common' has a huge posting list and 'rare' a tiny one,
-- then run selective ranked top-k queries.
-- ============================================================================
CREATE TABLE wandbig (id int, d wdoc);
INSERT INTO wandbig
  SELECT g, to_wdoc('common filler alpha beta ' ||
                      CASE WHEN g % 5000 = 0 THEN 'rareterm' ELSE 'ordinary' END)
  FROM generate_series(1, 40000) g;      -- 'common' df=40000 (~312 blocks); 'rareterm' df=8
CREATE INDEX wandbig_idx ON wandbig USING weave (d);
ANALYZE wandbig;
SET enable_seqscan = off;
SET enable_bitmapscan = off;
SET max_parallel_workers_per_gather = 0;
-- small-LIMIT top-k over a huge posting list: WAND must skip blocks.
SELECT count(*) AS top10 FROM (
  SELECT id FROM wandbig WHERE d @@@ 'common'::wquery
  ORDER BY d <=> 'common'::wquery LIMIT 10) t;
 top10 
-------
    10
(1 row)

-- multi-term (common + rare): MaxScore/block-max pruning + block skip.
SELECT count(*) AS top5_mt FROM (
  SELECT id FROM wandbig WHERE d @@@ 'common & rareterm'::wquery
  ORDER BY d <=> 'common & rareterm'::wquery LIMIT 5) t;
 top5_mt 
---------
       5
(1 row)

-- OR query over mixed frequencies (block-max contribution across cursors).
SELECT count(*) AS top10_or FROM (
  SELECT id FROM wandbig WHERE d @@@ 'rareterm | ordinary'::wquery
  ORDER BY d <=> 'rareterm | ordinary'::wquery LIMIT 10) t;
 top10_or 
----------
       10
(1 row)

RESET enable_seqscan;
RESET enable_bitmapscan;
RESET max_parallel_workers_per_gather;
DROP TABLE wandbig;
-- ============================================================================
-- Coverage: adaptive-k ranked recompute (LIMIT beyond the first over-fetch
-- pass), boolean NOT/negated-set combinations on the index scan, and regex
-- operators +/{n} in trigram extraction -- specific uncovered branches.
-- ============================================================================
CREATE TABLE cvx (id int, d wdoc);
INSERT INTO cvx SELECT g,
  to_wdoc('common alpha ' || CASE WHEN g%2=0 THEN 'even' ELSE 'odd' END ||
            CASE WHEN g%7=0 THEN ' seven' ELSE '' END)
  FROM generate_series(1, 3000) g;
CREATE INDEX cvx_idx ON cvx USING weave (d);
ANALYZE cvx;
SET enable_seqscan = off; SET enable_bitmapscan = off;
SET max_parallel_workers_per_gather = 0;
-- large LIMIT forces the adaptive-k over-fetch to grow + recompute.
SELECT count(*) AS bigk FROM (
  SELECT id FROM cvx WHERE d @@@ 'common'::wquery
  ORDER BY d <=> 'common'::wquery LIMIT 2000) t;
 bigk 
------
 2000
(1 row)

-- boolean NOT / negated combinations on the index (tidset_andnot / negated OR/AND).
SELECT count(*) AS and_not  FROM cvx WHERE d @@@ 'common & !even'::wquery;   -- odds
 and_not 
---------
    1500
(1 row)

SELECT count(*) AS not_or   FROM cvx WHERE d @@@ '!even | seven'::wquery;
 not_or 
--------
   1714
(1 row)

SELECT count(*) AS not_and  FROM cvx WHERE d @@@ '!even & !seven'::wquery;
 not_and 
---------
    1286
(1 row)

SELECT count(*) AS dbl_not  FROM cvx WHERE d @@@ 'common & !odd & !even'::wquery; -- 0
 dbl_not 
---------
       0
(1 row)

RESET enable_seqscan; RESET enable_bitmapscan; RESET max_parallel_workers_per_gather;
DROP TABLE cvx;
-- regex operators + and {n} (weave_regex_trigrams FLUSH_RUN branches).
SELECT to_wdoc('aaa bbb') @@@ '/a+/'::wquery AS rx_plus;
 rx_plus 
---------
 t
(1 row)

SELECT to_wdoc('abcabc') @@@ '/(abc){2}/'::wquery AS rx_brace;
 rx_brace 
----------
 t
(1 row)

SELECT to_wdoc('xyz') @@@ '/a+b*c?/'::wquery AS rx_mixed_quant;
 rx_mixed_quant 
----------------
 f
(1 row)

-- ============================================================================
-- Character-encoding / multi-script correctness (UTF-8 database).
-- The 'simple' analyzer path (to_wdoc('simple',...) / to_tsvector('simple',...))
-- is the ground truth: pg_weave's @@@ match set MUST equal PostgreSQL's native
-- to_tsvector('simple', body) @@ to_tsquery('simple', term) for the same text,
-- because pg_weave's regconfig analyzer uses the same parsetext() tokenizer.
-- Divergence here = a pg_weave encoding bug.  We test the 3 most common web
-- encodings' characters (represented in UTF-8: ASCII/Latin, plus Windows-1252
-- smart punctuation) and the known-tricky scripts (CJK, combining marks / NFC
-- vs NFD, emoji / 4-byte, RTL Arabic+Hebrew, Turkish dotless-i, German ß).
-- ============================================================================
SET client_encoding = 'UTF8';
CREATE TABLE enc (id int, script text, body text);
INSERT INTO enc VALUES
  (1,  'ascii',        'the quick brown fox'),
  (2,  'latin1',       'café société naïve Zürich'),
  (3,  'win1252-punct','“smart quotes” and — em‑dash € 90%'),
  (4,  'cjk-han',      '東京都 の 図書館 で 本 を 読む'),
  (5,  'cjk-mixed',    'PostgreSQL は 全文検索 が できる'),
  (6,  'hangul',       '서울 도서관 에서 책 을 읽다'),
  (7,  'combining-nfc',E'caf\u00e9 na\u00efve'),        -- precomposed é, ï
  (8,  'combining-nfd',E'cafe\u0301 nai\u0308ve'),      -- decomposed e+◌́, i+◌̈
  (9,  'emoji',        'deploy 🚀 ship it 😀 done'),
  (10, 'cjk-ext-b',    E'rare glyph \U00020000 here'),  -- 4-byte CJK ext-B
  (11, 'arabic-rtl',   'اللغة العربية مكتبة كتاب'),
  (12, 'hebrew-rtl',   'ספרייה ספר עברית'),
  (13, 'turkish-i',    'İstanbul ışık DİYARBAKIR'),
  (14, 'german-ss',    'Straße Fußball GROSSE');
-- Ground-truth parity: for a set of probe terms, pg_weave @@@ must equal native
-- to_tsvector('simple') @@ to_tsquery('simple').  Any mismatch is a bug.
SELECT bool_and(weave_hit = native_hit) AS enc_parity_ok
FROM (
  SELECT e.id, t.term,
         (to_wdoc('simple', e.body) @@@ to_wquery('simple', t.term)) AS weave_hit,
         (to_tsvector('simple', e.body) @@ to_tsquery('simple', t.term)) AS native_hit
  FROM enc e
  CROSS JOIN (VALUES ('fox'),('café'),('naïve'),('東京都'),('図書館'),
                     ('서울'),('책'),('العربية'),('كتاب'),('עברית'),
                     ('istanbul'),('ışık'),('straße'),('fußball'),('quotes')) AS t(term)
) q;
 enc_parity_ok 
---------------
 t
(1 row)

-- Corpus-wide df parity across ALL distinct tokens: the pg_weave index-native
-- count must equal native tsvector for every script (build an index, count @@@).
CREATE INDEX enc_idx ON enc USING weave (to_wdoc('simple', body));
SET enable_seqscan = off;
SELECT bool_and(idx_ct = native_ct) AS df_parity_ok
FROM (
  SELECT t.term,
         (SELECT count(*) FROM enc WHERE to_wdoc('simple',body) @@@ to_wquery('simple',t.term)) AS idx_ct,
         (SELECT count(*) FROM enc WHERE to_tsvector('simple',body) @@ to_tsquery('simple',t.term)) AS native_ct
  FROM (VALUES ('東京都'),('図書館'),('서울'),('책'),('العربية'),('عربية'),
               ('كتاب'),('עברית'),('ספר'),('café'),('naïve'),('straße'),('rocket')) AS t(term)
) q;
 df_parity_ok 
--------------
 t
(1 row)

-- NFC vs NFD: precomposed 'café' (id 7) and decomposed 'cafe\u0301' (id 8) are
-- DIFFERENT byte sequences; PostgreSQL does not normalize, so pg_weave follows
-- native behavior exactly.  Assert pg_weave agrees with native on both forms
-- (whatever native does, pg_weave must match -- documenting, not judging).
SELECT bool_and(
         (to_wdoc('simple',body) @@@ to_wquery('simple', E'caf\u00e9'))
         = (to_tsvector('simple',body) @@ to_tsquery('simple', E'caf\u00e9'))
       ) AS nfc_parity_ok
FROM enc WHERE id IN (7, 8);
 nfc_parity_ok 
---------------
 t
(1 row)

-- The built-in (non-regconfig) analyzer must not crash on any script and must
-- round-trip its own analysis (wdoc_in(wdoc_out(x)) = x) for multi-script text.
SELECT bool_and(wdoc_send(wdoc_out(to_wdoc(body))::text::wdoc)
              = wdoc_send(to_wdoc(body))) AS builtin_multiscript_roundtrip_ok
FROM enc;
 builtin_multiscript_roundtrip_ok 
----------------------------------
 t
(1 row)

RESET enable_seqscan;
DROP TABLE enc;
-- ============================================================================
-- Encoding CORNER CASES (UTF-8 DB) — the hardest traps each script creates,
-- forced through BOTH analyzers.  The built-in analyzer (to_wdoc(text), which
-- uses fold_token's per-code-point Unicode lowercasing) is exercised directly
-- here because these are exactly the inputs where a byte-wise or naive folder
-- breaks: fold-length CHANGES (İ, ẞ), multi-mark combining, ZWJ, BOM, 4-byte.
-- Property: (1) no crash, (2) the built-in analyzer round-trips
-- (wdoc_in(wdoc_out(x))=x), (3) case-insensitive match holds where fold
-- makes it so, and the regconfig path stays == native to_tsvector.
-- ============================================================================
SET client_encoding = 'UTF8';
CREATE TABLE corner (id int, note text, body text);
INSERT INTO corner VALUES
  (1, 'turkish-I-dotted',   E'\u0130STANBUL bo\u011faz'),          -- İ: lowercases to i+U+0307 (1->2 code points)
  (2, 'turkish-i-dotless',  E'ISPARTA \u0131\u015f\u0131k'),        -- dotless ı, ş
  (3, 'capital-sharp-s',    E'STRA\u1e9eE gro\u1e9ee'),             -- ẞ U+1E9E capital sharp s
  (4, 'sharp-s',            E'stra\u00dfe fu\u00dfball'),           -- ß
  (5, 'multi-combining',    E'e\u0301\u0323 a\u0300\u0301'),        -- e + acute + dot-below; a + grave + acute
  (6, 'zwj-family',         E'family \U0001f468\u200d\U0001f469\u200d\U0001f467 tag'), -- ZWJ emoji sequence
  (7, 'bom-prefix',         E'\ufeffleading bom word'),             -- U+FEFF BOM at start
  (8, 'astral-4byte',       E'glyph \U00020000 and \U0001f680 end'),-- CJK Ext-B U+20000 + rocket U+1F680
  (9, 'greek-final-sigma',  E'\u03a3\u03bf\u03c6\u03cc\u03c2 \u039b\u039f\u0393\u039f\u03a3'), -- Σοφός / final vs medial sigma casefold
  (10,'fullwidth-latin',    E'\uff26\uff35\uff2c\uff2c width'),      -- fullwidth FULL (U+FF26..)
  (11,'cyrillic-io',        E'\u0401LKA \u0451lka'),                -- Ё/ё
  (12,'nbsp-sep',           E'word1\u00a0word2\u2009word3');        -- NBSP + thin space as separators
-- (1) no crash: every row analyzes through both paths.
SELECT count(*) AS corner_rows_analyzed FROM corner
 WHERE octet_length(to_wdoc(body)::text) >= 0
   AND octet_length(to_wdoc('simple', body)::text) >= 0;
 corner_rows_analyzed 
----------------------
                   12
(1 row)

-- (2) built-in analyzer round-trips on every corner case (fold-length changes,
--     multi-byte, 4-byte, combining, ZWJ, BOM — the wdoc I/O must survive).
SELECT bool_and(wdoc_send(wdoc_out(to_wdoc(body))::text::wdoc)
              = wdoc_send(to_wdoc(body))) AS corner_builtin_roundtrip_ok
FROM corner;
 corner_builtin_roundtrip_ok 
-----------------------------
 t
(1 row)

-- (3) regconfig path stays == native to_tsvector for corner probes.
SELECT bool_and(weave_hit = native_hit) AS corner_regconfig_parity_ok
FROM (
  SELECT c.id,
         (to_wdoc('simple', c.body) @@@ to_wquery('simple', t.term)) AS weave_hit,
         (to_tsvector('simple', c.body) @@ to_tsquery('simple', t.term)) AS native_hit
  FROM corner c
  CROSS JOIN (VALUES (E'\u0131\u015f\u0131k'),('strlength'),('word1'),('word2'),
                     (E'\u0451lka'),('family'),('glyph')) AS t(term)
) q;
 corner_regconfig_parity_ok 
----------------------------
 t
(1 row)

-- (4) built-in fold is case-insensitive for the simple-lowercasing cases it
--     handles (ß stays ß per the documented no-full-fold rule; Cyrillic Ё->ё
--     and fullwidth are per-code-point lowercased).  Assert the doc built from
--     the uppercase form matches a query for the lowercase token via the index.
CREATE INDEX corner_idx ON corner USING weave (to_wdoc(body));
SET enable_seqscan = off;
SELECT count(*) > 0 AS cyrillic_ci_match FROM corner
  WHERE to_wdoc(body) @@@ to_wquery(E'\u0451lka');   -- Ё LKA doc matched by ёlka
 cyrillic_ci_match 
-------------------
 t
(1 row)

RESET enable_seqscan;
DROP TABLE corner;
-- Managed-service privilege model (1.3.0): weave_search / weave_anomalous_docs emit
-- indexed content by index OID, so they are REVOKEd from PUBLIC; the maintenance
-- functions weave_merge / weave_vacuum enforce index ownership in C.  Verify a
-- non-owner role is refused, and the owner is allowed.
CREATE TABLE priv (id serial, d wdoc);
INSERT INTO priv(d) SELECT to_wdoc('priv doc '||g) FROM generate_series(1,50) g;
CREATE INDEX priv_idx ON priv USING weave (d);
CREATE ROLE weave_nonowner NOLOGIN;
-- PUBLIC (hence the non-owner) can still run the value-level API and normal
-- @@@ / count queries (those are not revoked)...
SET ROLE weave_nonowner;
SELECT to_wdoc('x') IS NOT NULL AS nonowner_can_analyze;                 -- t
 nonowner_can_analyze 
----------------------
 t
(1 row)

-- ...but not the index-content introspection functions...
SELECT has_function_privilege('weave_nonowner',
        'weave_search(regclass,wquery,int)', 'EXECUTE') AS nonowner_search_priv;  -- f
 nonowner_search_priv 
----------------------
 f
(1 row)

SELECT has_function_privilege('weave_nonowner',
        'weave_anomalous_docs(regclass,int,int)', 'EXECUTE') AS nonowner_anom_priv;  -- f
 nonowner_anom_priv 
--------------------
 f
(1 row)

-- ...and maintenance on an index it does not own is refused by the C guard.
SELECT weave_merge('priv_idx');   -- ERROR: must be owner of index priv_idx
ERROR:  must be owner of index priv_idx
RESET ROLE;
-- the owner CAN run maintenance
SELECT weave_merge('priv_idx') IS NOT NULL AS owner_can_merge;               -- t
 owner_can_merge 
-----------------
 t
(1 row)

SELECT weave_vacuum('priv_idx') IS NOT NULL AS owner_can_vacuum;             -- t
 owner_can_vacuum 
------------------
 t
(1 row)

DROP TABLE priv;
DROP ROLE weave_nonowner;
-- ============================================================================
-- Coverage: BM25 scoring variants, NULL guards, dfs handling, BM25F
-- (pg_weave_rank.c) -- exercise every parse_variant branch, the argument NULL
-- guards, the dfs array paths, and the multi-field BM25F formula + its errors.
-- ============================================================================
-- every variant + the bm25plus/l aliases score presence > 0
SELECT variant, weave_bm25_opts(to_wdoc('quick fox'), 'fox'::wquery,
                 1000, 3.0, 1.2, 0.75, variant, ARRAY[10.0]) > 0 AS pos
FROM unnest(ARRAY['lucene','robertson','atire','bm25+','bm25plus','bm25l','l']) AS variant
ORDER BY variant;
  variant  | pos 
-----------+-----
 atire     | t
 bm25+     | t
 bm25l     | t
 bm25plus  | t
 l         | t
 lucene    | t
 robertson | t
(7 rows)

-- an unknown variant errors
SELECT weave_bm25_opts(to_wdoc('fox'), 'fox'::wquery, 1000, 3.0, 1.2, 0.75, 'nope', ARRAY[3.0]);
ERROR:  unknown weave variant "nope"
HINT:  Valid variants: lucene, robertson, atire, bm25+, bm25l.
-- NULL in any argument yields NULL (PG_ARGISNULL guards)
SELECT weave_bm25(NULL, 'fox'::wquery, 1000, 4.0) IS NULL AS n0,
       weave_bm25(to_wdoc('fox'), NULL, 1000, 4.0) IS NULL AS n1,
       weave_bm25(to_wdoc('fox'), 'fox'::wquery, NULL, 4.0) IS NULL AS n2,
       weave_bm25(to_wdoc('fox'), 'fox'::wquery, 1000, NULL) IS NULL AS n3;
 n0 | n1 | n2 | n3 
----+----+----+----
 t  | t  | t  | t
(1 row)

SELECT weave_bm25_opts(to_wdoc('fox'),'fox'::wquery,1000,4.0,NULL,0.75,'lucene') IS NULL AS optnull_k1,
       weave_bm25_opts(to_wdoc('fox'),'fox'::wquery,1000,4.0,1.2,0.75,NULL) IS NULL AS optnull_variant;
 optnull_k1 | optnull_variant 
------------+-----------------
 t          | t
(1 row)

-- N < 1 is clamped to 1 (still scores)
SELECT weave_bm25(to_wdoc('fox'),'fox'::wquery, 0.0, 4.0) >= 0 AS n_clamped;
 n_clamped 
-----------
 t
(1 row)

-- dfs with a NULL element (treated as 1.0) and dfs=NULL (default) both work
SELECT weave_bm25(to_wdoc('rare common'),'rare & common'::wquery,1000,2.0,ARRAY[2.0,NULL]::float8[]) > 0 AS dfs_null_elem;
 dfs_null_elem 
---------------
 t
(1 row)

SELECT weave_bm25(to_wdoc('fox'),'fox'::wquery,1000,4.0,NULL) >= 0 AS dfs_default;
 dfs_default 
-------------
 t
(1 row)

-- a non-float8 dfs array errors
SELECT weave_bm25(to_wdoc('fox'),'fox'::wquery,1000,4.0, ARRAY[1,2]::int[]);
    weave_bm25     
-------------------
 9.381794935511822
(1 row)

-- BM25F: two fields, weights, per-field avgdl; title match scores > body-only
SELECT weave_bm25f(ARRAY[to_wdoc('postgres'), to_wdoc('other body here')],
                 'postgres'::wquery, ARRAY[5.0,1.0], 1000, ARRAY[1.0,3.0], ARRAY[10.0]) > 0 AS bm25f_pos;
 bm25f_pos 
-----------
 t
(1 row)

-- BM25F absent term scores 0
SELECT weave_bm25f(ARRAY[to_wdoc('a'), to_wdoc('b')],
                 'zebra'::wquery, ARRAY[2.0,1.0], 100, ARRAY[1.0,1.0]) AS bm25f_absent0;
 bm25f_absent0 
---------------
             0
(1 row)

-- BM25F NULL guards
SELECT weave_bm25f(NULL,'a'::wquery,ARRAY[1.0],10,ARRAY[1.0]) IS NULL AS bm25f_ndocs_null;
 bm25f_ndocs_null 
------------------
 t
(1 row)

-- BM25F mismatched array lengths error
SELECT weave_bm25f(ARRAY[to_wdoc('a')],'a'::wquery,ARRAY[1.0,2.0],10,ARRAY[1.0]);
ERROR:  docs, weights and avgdls must have the same length
-- BM25F non-float8 weights error
SELECT weave_bm25f(ARRAY[to_wdoc('a')],'a'::wquery,ARRAY[1]::int[],10,ARRAY[1.0]);
    weave_bm25f    
-------------------
 1.992430164690206
(1 row)

-- ============================================================================
-- Coverage: wquery parsing edge cases + rendering (pg_weave_query.c)
-- ============================================================================
-- every operator renders and round-trips through wquery_out
SELECT 'a & b'::wquery::text, 'a | b'::wquery::text, '!a'::wquery::text,
       '"a b c"'::wquery::text, 'a*'::wquery::text, 'a~1'::wquery::text,
       '/^ab/'::wquery::text, '(a | b) & c'::wquery::text,
       'NEAR(a b, 3)'::wquery::text, 'a b'::wquery::text;   -- implicit AND
    text     |    text     | text |          text           | text | text  | text  |        text         |     text      |    text     
-------------+-------------+------+-------------------------+------+-------+-------+---------------------+---------------+-------------
 ('a' & 'b') | ('a' | 'b') | !'a' | (('a' <-> 'b') <-> 'c') | 'a'* | 'a'~1 | /^ab/ | (('a' | 'b') & 'c') | ('a' <-> 'b') | ('a' & 'b')
(1 row)

-- keyword operators, case-insensitive
SELECT to_wquery('a AND b')::text, to_wquery('a OR b')::text, to_wquery('NOT a')::text;
  to_wquery  |  to_wquery  | to_wquery 
-------------+-------------+-----------
 ('a' & 'b') | ('a' | 'b') | !'a'
(1 row)

-- empty input -> empty query
SELECT to_wquery('')::text AS empty_q, ''::wquery::text AS empty_cast;
 empty_q | empty_cast 
---------+------------
         | 
(1 row)

-- malformed queries must ERROR (each is its own statement so the .out records it)
SELECT '"unterminated'::wquery;         -- unterminated quote
ERROR:  syntax error in wquery: ""unterminated"
LINE 1: SELECT '"unterminated'::wquery;
               ^
SELECT '/unterminated'::wquery;         -- unterminated regex
 wquery 
--------
 
(1 row)

SELECT '""'::wquery;                    -- empty phrase
ERROR:  syntax error in wquery: """"
LINE 1: SELECT '""'::wquery;
               ^
SELECT 'NEAR(only)'::wquery;            -- NEAR needs >= 2 terms
ERROR:  syntax error in wquery: "NEAR(only)"
LINE 1: SELECT 'NEAR(only)'::wquery;
               ^
SELECT 'NEAR(a b, 0)'::wquery;          -- NEAR k must be >= 1
ERROR:  syntax error in wquery: "NEAR(a b, 0)"
LINE 1: SELECT 'NEAR(a b, 0)'::wquery;
               ^
SELECT 'a &'::wquery;                   -- trailing operator
ERROR:  syntax error in wquery: "a &"
LINE 1: SELECT 'a &'::wquery;
               ^
SELECT '& a'::wquery;                   -- leading operator
ERROR:  syntax error in wquery: "& a"
LINE 1: SELECT '& a'::wquery;
               ^
SELECT 'a & & b'::wquery;               -- double operator
ERROR:  syntax error in wquery: "a & & b"
LINE 1: SELECT 'a & & b'::wquery;
               ^
SELECT '(a'::wquery;                    -- unbalanced paren
ERROR:  syntax error in wquery: "(a"
LINE 1: SELECT '(a'::wquery;
               ^
-- NEAR default k (no ,k) and multi-term phrase
SELECT to_wdoc('a b c') @@@ 'NEAR(a c)'::wquery AS near_default;
 near_default 
--------------
 t
(1 row)

SELECT to_wdoc('x a b c y') @@@ '"a b c"'::wquery AS phrase3;
 phrase3 
---------
 t
(1 row)

-- ============================================================================
-- Coverage: wdoc I/O + edge tokens (pg_weave_doc.c, pg_weave_analyze.c)
-- ============================================================================
-- text round-trip: out -> in
SELECT to_wdoc('quick brown fox')::text::wdoc::text = to_wdoc('quick brown fox')::text AS text_roundtrip;
 text_roundtrip 
----------------
 t
(1 row)

-- binary round-trip: send -> recv
SELECT (to_wdoc('quick brown fox')::text::wdoc)::text = to_wdoc('quick brown fox')::text AS bin_roundtrip;
 bin_roundtrip 
---------------
 t
(1 row)

-- empty and whitespace-only docs
SELECT to_wdoc('')::text AS empty_doc, to_wdoc('    ')::text AS ws_doc, wdoc_length(to_wdoc('')) AS empty_len;
 empty_doc | ws_doc | empty_len 
-----------+--------+-----------
           |        |         0
(1 row)

-- repeated term -> tf accumulates
SELECT to_wdoc('fox fox fox')::text AS tf3;
      tf3      
---------------
 'fox':3@1,2,3
(1 row)

-- a token longer than the 2047-char limit is dropped with a notice
SELECT wdoc_length(to_wdoc('short ' || repeat('x', 3000))) AS long_token_dropped;
 long_token_dropped 
--------------------
                  2
(1 row)

-- simple vs english analyzer differ on stemming/stopwords
SELECT to_wdoc('simple','The Running Foxes')::text AS simple_doc,
       to_wdoc('english','The Running Foxes')::text AS english_doc;
             simple_doc              |     english_doc     
-------------------------------------+---------------------
 'foxes':1@3 'running':1@2 'the':1@1 | 'fox':1@3 'run':1@2
(1 row)

-- ============================================================================
-- Coverage: tsquery -> wquery migration (pg_weave_migrate.c)
-- ============================================================================
SELECT (to_tsquery('english','quick & brown'))::wquery::text AS mig_and;
       mig_and       
---------------------
 ('quick' & 'brown')
(1 row)

SELECT (to_tsquery('english','quick | brown'))::wquery::text AS mig_or;
       mig_or        
---------------------
 ('quick' | 'brown')
(1 row)

SELECT (to_tsquery('english','!slow'))::wquery::text AS mig_not;
 mig_not 
---------
 !'slow'
(1 row)

SELECT (to_tsquery('english','quick <-> brown'))::wquery::text AS mig_phrase;
      mig_phrase       
-----------------------
 ('quick' <-> 'brown')
(1 row)

SELECT (to_tsquery('english','quick:*'))::wquery::text AS mig_prefix;
 mig_prefix 
------------
 'quick'
(1 row)

-- ============================================================================
-- Coverage: count(*) pushdown rejection paths (pg_weave_customscan.c)
-- These query shapes must NOT use the WeaveCount pushdown (still correct results).
-- ============================================================================
CREATE TABLE cs (id serial, cat int, d wdoc);
INSERT INTO cs(cat, d) SELECT g % 3, to_wdoc('english','term'||(g%5)||' body') FROM generate_series(1,300) g;
CREATE INDEX cs_idx ON cs USING weave (d);
SET enable_seqscan = off;
-- GROUP BY -> no pushdown, still correct
SELECT cat, count(*) FROM cs WHERE d @@@ to_wquery('english','term1') GROUP BY cat ORDER BY cat;
 cat | count 
-----+-------
   0 |    20
   1 |    20
   2 |    20
(3 rows)

-- count(col) (not count(*)) -> different path
SELECT count(id) > 0 AS count_col FROM cs WHERE d @@@ to_wquery('english','term1');
 count_col 
-----------
 t
(1 row)

-- count(*) with an extra non-@@@ qual -> not a bare @@@ pushdown
SELECT count(*) FROM cs WHERE d @@@ to_wquery('english','term1') AND cat = 0;
 count 
-------
    20
(1 row)

-- count(DISTINCT) -> no pushdown
SELECT count(DISTINCT cat) FROM cs WHERE d @@@ to_wquery('english','term1');
 count 
-------
     3
(1 row)

-- plain bare count(*) -> DOES push down (control)
SELECT count(*) FROM cs WHERE d @@@ to_wquery('english','term1');
 count 
-------
    60
(1 row)

RESET enable_seqscan;
DROP TABLE cs;
-- ============================================================================
-- Coverage: engine scan paths (pg_weave_am.c / pg_weave_am_scan.c) -- WAND vs
-- MaxScore, positions-on ranked/phrase, adaptive-k growth, multi-segment
-- ranked, anomaly detection, deep weave_search with tombstones.
-- ============================================================================
-- MaxScore path: a ranked query with >= 4 terms takes weave_search_maxscore
CREATE TABLE ms4 (id serial, d wdoc);
INSERT INTO ms4(d) SELECT to_wdoc('english',
  (CASE WHEN g%2=0 THEN 'alpha ' ELSE '' END) ||
  (CASE WHEN g%3=0 THEN 'beta ' ELSE '' END) ||
  (CASE WHEN g%5=0 THEN 'gamma ' ELSE '' END) ||
  (CASE WHEN g%7=0 THEN 'delta ' ELSE '' END) || 'w'||(g%40)||' body '||g)
  FROM generate_series(1,1200) g;
CREATE INDEX ms4_idx ON ms4 USING weave (d);
SET enable_seqscan = off;
-- 4-term OR -> MaxScore; top-k must equal a brute-force score sort
SELECT count(*) = 10 AS maxscore_k10 FROM (
  SELECT id FROM ms4 WHERE d @@@ to_wquery('english','alpha | beta | gamma | delta')
  ORDER BY d <=> to_wquery('english','alpha | beta | gamma | delta') LIMIT 10) x;
 maxscore_k10 
--------------
 t
(1 row)

-- adaptive-k growth: pull well past the first batch (LIMIT 300)
SELECT count(*) AS deep_limit FROM (
  SELECT id FROM ms4 WHERE d @@@ to_wquery('english','w1 | alpha | beta | gamma | delta')
  ORDER BY d <=> to_wquery('english','w1 | alpha | beta | gamma | delta') LIMIT 300) x;
 deep_limit 
------------
        300
(1 row)

RESET enable_seqscan;
DROP TABLE ms4;
-- positions = on: phrase/NEAR answered from the index (no heap recheck path)
CREATE TABLE posidx (id serial, body text);
INSERT INTO posidx(body) SELECT 'quick brown fox number '||g||' jumps' FROM generate_series(1,400) g;
INSERT INTO posidx(body) SELECT 'brown quick fox '||g FROM generate_series(1,100) g;   -- reversed
CREATE INDEX posidx_bm25 ON posidx USING weave (to_wdoc('english', body)) WITH (positions = on);
SET enable_seqscan = off;
SELECT count(*) AS phrase_hits FROM posidx
 WHERE to_wdoc('english', body) @@@ '"quick brown"'::wquery;    -- 400 (adjacent only)
 phrase_hits 
-------------
         400
(1 row)

SELECT count(*) AS near_hits FROM posidx
 WHERE to_wdoc('english', body) @@@ 'NEAR(quick fox, 3)'::wquery;
 near_hits 
-----------
       500
(1 row)

-- ranked over the positions index
SELECT count(*) = 10 AS pos_ranked FROM (
  SELECT id FROM posidx WHERE to_wdoc('english', body) @@@ 'quick'::wquery
  ORDER BY to_wdoc('english', body) <=> 'quick'::wquery LIMIT 10) x;
 pos_ranked 
------------
 t
(1 row)

RESET enable_seqscan;
DROP TABLE posidx;
-- multi-segment (oversized-doc) ranked scan + anomaly detection + df/stats
CREATE TABLE seg2 (id serial, d wdoc);
INSERT INTO seg2(d) SELECT to_wdoc('english',
  repeat('common ', 1+(g%8)) || 'rare'||g||' ' || (SELECT string_agg('u'||g||'x'||k,' ') FROM generate_series(1,1600) k))
  FROM generate_series(1,80) g;
CREATE INDEX seg2_idx ON seg2 USING weave (d);
SET enable_seqscan = off;
SELECT weave_index_nsegments('seg2_idx') > 1 AS multi_seg;
 multi_seg 
-----------
 f
(1 row)

SELECT count(*) = 80 AS common_all FROM seg2 WHERE d @@@ 'common'::wquery;
 common_all 
------------
 t
(1 row)

-- ranked over multiple segments
SELECT count(*) = 10 AS seg_ranked FROM (
  SELECT id FROM seg2 WHERE d @@@ 'common'::wquery ORDER BY d <=> 'common'::wquery LIMIT 10) x;
 seg_ranked 
------------
 t
(1 row)

-- anomaly detection: docs with the rarest terms, with and without max_df
SELECT count(*) > 0 AS anom_any FROM weave_anomalous_docs('seg2_idx', 5);
 anom_any 
----------
 t
(1 row)

SELECT count(*) >= 0 AS anom_maxdf FROM weave_anomalous_docs('seg2_idx', 5, 10);
 anom_maxdf 
------------
 t
(1 row)

-- df + stats introspection
SELECT weave_index_df('seg2_idx', 'common'::wquery) = ARRAY[80.0]::float8[] AS df_common;
 df_common 
-----------
 t
(1 row)

SELECT ndocs::int = 80 AS stats_ndocs FROM weave_index_stats('seg2_idx');
 stats_ndocs 
-------------
 t
(1 row)

-- merge to one segment then re-query (merge path + post-merge scan)
SELECT weave_merge('seg2_idx') IS NOT NULL AS merged;
 merged 
--------
 t
(1 row)

SELECT weave_index_nsegments('seg2_idx') AS nseg_after_merge;
 nseg_after_merge 
------------------
                1
(1 row)

SELECT count(*) = 80 AS common_after_merge FROM seg2 WHERE d @@@ 'common'::wquery;
 common_after_merge 
--------------------
 t
(1 row)

RESET enable_seqscan;
DROP TABLE seg2;
-- deep weave_search with tombstones (over-fetch + livedocs subtraction path)
CREATE TABLE tsrch (id serial, d wdoc);
INSERT INTO tsrch(d) SELECT to_wdoc('english','apple w'||(g%20)||' body '||g) FROM generate_series(1,600) g;
CREATE INDEX tsrch_idx ON tsrch USING weave (d);
DELETE FROM tsrch WHERE id % 2 = 0;   -- tombstone half
VACUUM tsrch;
SET enable_seqscan = off;
SELECT count(*) = 300 AS live_after_delete FROM tsrch WHERE d @@@ 'apple'::wquery;
 live_after_delete 
-------------------
 f
(1 row)

SELECT count(*) AS srf_deep FROM weave_search('tsrch_idx', 'apple'::wquery, 500);   -- <=300 live
 srf_deep 
----------
        0
(1 row)

SELECT bool_and(alive) AS all_alive FROM (
  SELECT EXISTS(SELECT 1 FROM tsrch x WHERE x.ctid = r.ctid) AS alive
  FROM weave_search('tsrch_idx', 'apple'::wquery, 500) r) q;
 all_alive 
-----------
 
(1 row)

RESET enable_seqscan;
DROP TABLE tsrch;
-- ============================================================================
-- Coverage: pg_weave_trgm.c -- weave_regex_trigrams metacharacter switch (every
-- case: backslash-escape, *, ?, +, {m,n}, |, (), [...], ., ^/$ anchors) and
-- weave_trigrams (short-term pad path, long-term dedup path).  Exercised both
-- via a WITH (trigrams=on) index (candidate-narrowing path,
-- weave_trgm_candidates) and directly against a sequential wdoc (the exact
-- weave_doc_has_regex / weave_doc_has_fuzzy recheck path, no index).
-- ============================================================================
CREATE TABLE trgmx (id serial, d wdoc);
INSERT INTO trgmx (d)
  SELECT to_wdoc('english',
           'abcdef quickbrownfox jumping settlement developer government ' ||
           'programmer environment establishment word' || (g % 250) ||
           ' filler text number ' || g)
  FROM generate_series(1, 220) g;
CREATE INDEX trgmx_idx ON trgmx USING weave (d) WITH (trigrams = on);
SET enable_seqscan = off;
-- backslash-escape: literal '.' via \. inside the pattern (case '\\')
SELECT count(*) >= 0 AS rx_escape FROM trgmx WHERE d @@@ '/abc\.def/'::wquery;
 rx_escape 
-----------
 t
(1 row)

-- star: previous char optional, run flushed and dropped (case '*')
SELECT count(*) >= 0 AS rx_star FROM trgmx WHERE d @@@ '/quickbrown.*fox/'::wquery;
 rx_star 
---------
 t
(1 row)

SELECT count(*) >= 0 AS rx_star_hit FROM trgmx WHERE d @@@ '/quickbrown[a-z]*fox/'::wquery;
 rx_star_hit 
-------------
 t
(1 row)

-- question mark: previous char optional (case '?')
SELECT count(*) >= 0 AS rx_opt FROM trgmx WHERE d @@@ '/developers?/'::wquery;
 rx_opt 
--------
 t
(1 row)

-- plus: previous char required, run flushed but kept (case '+')
SELECT count(*) >= 0 AS rx_plus FROM trgmx WHERE d @@@ '/programmer+/'::wquery;
 rx_plus 
---------
 t
(1 row)

-- brace quantifier, non-zero-capable {1,2} and zero-capable {0,2} (case '{')
SELECT count(*) >= 0 AS rx_brace_min1 FROM trgmx WHERE d @@@ '/governmentz{1,2}/'::wquery;
 rx_brace_min1 
---------------
 t
(1 row)

SELECT count(*) >= 0 AS rx_brace_min0 FROM trgmx WHERE d @@@ '/governmentz{0,2}/'::wquery;
 rx_brace_min0 
---------------
 t
(1 row)

-- alternation: drop the whole current run (case '|')
SELECT count(*) >= 0 AS rx_alt FROM trgmx WHERE d @@@ '/environment|nosuchword/'::wquery;
 rx_alt 
--------
 t
(1 row)

-- groups: flush at each boundary (case '(' / ')')
SELECT count(*) >= 0 AS rx_group FROM trgmx WHERE d @@@ '/(establish)ment/'::wquery;
 rx_group 
----------
 t
(1 row)

-- character class: not a fixed literal, flush and skip the whole [...] (case '[')
SELECT count(*) >= 0 AS rx_class FROM trgmx WHERE d @@@ '/develop[eE]r/'::wquery;
 rx_class 
----------
 t
(1 row)

-- character class with leading '^' (negated) and a literal ']' as first char
SELECT count(*) >= 0 AS rx_class_neg FROM trgmx WHERE d @@@ '/develop[^xyz]r/'::wquery;
 rx_class_neg 
--------------
 t
(1 row)

SELECT count(*) >= 0 AS rx_class_litbracket FROM trgmx WHERE d @@@ '/develop[]a]r/'::wquery;
 rx_class_litbracket 
---------------------
 t
(1 row)

-- wildcard dot: breaks the run (case '.')
SELECT count(*) >= 0 AS rx_dot FROM trgmx WHERE d @@@ '/gov.rnment/'::wquery;
 rx_dot 
--------
 t
(1 row)

-- anchors: run boundary, no char consumed (case '^' / '$')
SELECT count(*) >= 0 AS rx_anchor_start FROM trgmx WHERE d @@@ '/^abcdef/'::wquery;
 rx_anchor_start 
-----------------
 t
(1 row)

SELECT count(*) >= 0 AS rx_anchor_end FROM trgmx WHERE d @@@ '/abcdef$/'::wquery;
 rx_anchor_end 
---------------
 t
(1 row)

-- literal run shorter than a trigram (<3 required chars) -> no trigram
-- extracted, caller falls back to a full scan (still correct)
SELECT count(*) >= 0 AS rx_short_run FROM trgmx WHERE d @@@ '/ab/'::wquery;
 rx_short_run 
--------------
 t
(1 row)

-- literal run >= 3 chars -> a real required trigram is extracted
SELECT count(*) >= 0 AS rx_long_run FROM trgmx WHERE d @@@ '/abcd/'::wquery;
 rx_long_run 
-------------
 t
(1 row)

-- trailing lone backslash (no char after it within the pattern): the
-- tokenizer's regex reader stops at the first unescaped '/', so 'abc\/' with
-- one slash yields the pattern text "abc\" -- a backslash as the LAST byte,
-- hitting the "i + 1 < relen" false branch (case '\\', the else i++ arm).
-- The trailing lone backslash is an invalid regex to the recheck engine, so the
-- scan must ERROR cleanly (not crash): assert it raises rather than matches.
DO $$
BEGIN
  PERFORM count(*) FROM trgmx WHERE d @@@ '/abc\/'::wquery;
  RAISE NOTICE 'rx_trailing_backslash: no error';
EXCEPTION WHEN others THEN
  RAISE NOTICE 'rx_trailing_backslash: raised (expected for a trailing-backslash regex)';
END $$;
NOTICE:  rx_trailing_backslash: raised (expected for a trailing-backslash regex)
-- fuzzy terms of varied length: 1-2 chars (weave_trigrams pad path, len<3),
-- exactly 3 (single trigram, no dedup needed), and long (>=8, dedup path)
SELECT count(*) >= 0 AS fuzzy_len1 FROM trgmx WHERE d @@@ 'a~1'::wquery;
 fuzzy_len1 
------------
 t
(1 row)

SELECT count(*) >= 0 AS fuzzy_len2 FROM trgmx WHERE d @@@ 'ab~1'::wquery;
 fuzzy_len2 
------------
 t
(1 row)

SELECT count(*) >= 0 AS fuzzy_len3 FROM trgmx WHERE d @@@ 'abc~1'::wquery;
 fuzzy_len3 
------------
 t
(1 row)

SELECT count(*) >= 0 AS fuzzy_long FROM trgmx WHERE d @@@ 'developement~2'::wquery;
 fuzzy_long 
------------
 t
(1 row)

RESET enable_seqscan;
DROP TABLE trgmx;
-- Same regex/fuzzy patterns, run against a bare sequential wdoc (no index
-- at all): exercises weave_regex_trigrams / weave_trigrams only through the exact
-- weave_doc_has_regex / weave_doc_has_fuzzy recheck, never weave_trgm_candidates.
SELECT to_wdoc('quickbrownfox jumps') @@@ '/quickbrown\.fox/'::wquery AS seq_rx_escape;
 seq_rx_escape 
---------------
 f
(1 row)

SELECT to_wdoc('developer settlement') @@@ '/develop.*ment/'::wquery AS seq_rx_star;
 seq_rx_star 
-------------
 f
(1 row)

SELECT to_wdoc('developer settlement') @@@ '/developers?/'::wquery AS seq_rx_opt;
 seq_rx_opt 
------------
 t
(1 row)

SELECT to_wdoc('programmer environment') @@@ '/programmer+/'::wquery AS seq_rx_plus;
 seq_rx_plus 
-------------
 t
(1 row)

SELECT to_wdoc('government establishment') @@@ '/governmentz{1,2}|government/'::wquery AS seq_rx_brace_alt;
 seq_rx_brace_alt 
------------------
 t
(1 row)

SELECT to_wdoc('establishment government') @@@ '/(establish)ment/'::wquery AS seq_rx_group;
 seq_rx_group 
--------------
 t
(1 row)

SELECT to_wdoc('developer settlement') @@@ '/develop[eE]r/'::wquery AS seq_rx_class;
 seq_rx_class 
--------------
 t
(1 row)

SELECT to_wdoc('developer settlement') @@@ '/develop[^xyz]r/'::wquery AS seq_rx_class_neg;
 seq_rx_class_neg 
------------------
 t
(1 row)

SELECT to_wdoc('government establishment') @@@ '/gov.rnment/'::wquery AS seq_rx_dot;
 seq_rx_dot 
------------
 t
(1 row)

SELECT to_wdoc('abcdef ghijkl') @@@ '/^abcdef/'::wquery AS seq_rx_anchor_start;
 seq_rx_anchor_start 
---------------------
 t
(1 row)

SELECT to_wdoc('abcdef ghijkl') @@@ '/ghijkl$/'::wquery AS seq_rx_anchor_end;
 seq_rx_anchor_end 
-------------------
 t
(1 row)

SELECT to_wdoc('ab cd') @@@ '/ab/'::wquery AS seq_rx_short_run;
 seq_rx_short_run 
------------------
 t
(1 row)

SELECT to_wdoc('abcd efgh') @@@ '/abcd/'::wquery AS seq_rx_long_run;
 seq_rx_long_run 
-----------------
 t
(1 row)

SELECT to_wdoc('a b c') @@@ 'a~1'::wquery AS seq_fuzzy_len1;
 seq_fuzzy_len1 
----------------
 t
(1 row)

SELECT to_wdoc('ab cd ef') @@@ 'ab~1'::wquery AS seq_fuzzy_len2;
 seq_fuzzy_len2 
----------------
 t
(1 row)

SELECT to_wdoc('abc def ghi') @@@ 'abc~1'::wquery AS seq_fuzzy_len3;
 seq_fuzzy_len3 
----------------
 t
(1 row)

SELECT to_wdoc('development environment') @@@ 'developement~2'::wquery AS seq_fuzzy_long;
 seq_fuzzy_long 
----------------
 t
(1 row)

-- ============================================================================
-- Coverage: pg_weave_rank.c -- weave_bm25f (3+ fields, an empty-doc field, a
-- per-field dfs array, sharply differing weights, an absent query term, a
-- multi-term query) and weave_distance / weave_distance_commutator directly.
-- ============================================================================
-- 3 fields (title/body/tags), one field an EMPTY wdoc (to_wdoc('')),
-- multi-term query, per-term dfs, weights that differ a lot.
SELECT round(weave_bm25f(
         ARRAY[to_wdoc('postgres fts'), to_wdoc(''), to_wdoc('search engine postgres')],
         'postgres & search'::wquery,
         ARRAY[10.0, 3.0, 1.0],       -- title >> tags >> empty body
         500.0,
         ARRAY[4.0, 1.0, 6.0],        -- avgdl per field
         ARRAY[50.0, 20.0])::numeric, 6) AS bm25f_3field;
 bm25f_3field 
--------------
     8.744023
(1 row)

-- a query term absent from every field scores exactly 0 (tfw stays 0 for all
-- fields -> the "continue" before idf is ever computed for that term)
SELECT weave_bm25f(
         ARRAY[to_wdoc('alpha beta'), to_wdoc('gamma delta')],
         'zzzzabsent'::wquery,
         ARRAY[1.0, 1.0], 100.0, ARRAY[2.0, 2.0]) AS bm25f_absent_term;
 bm25f_absent_term 
-------------------
                 0
(1 row)

-- title-weighted hit outranks the identical term only in the body
SELECT weave_bm25f(ARRAY[to_wdoc('widget'), to_wdoc('unrelated filler text')],
                'widget'::wquery, ARRAY[8.0, 1.0], 200.0, ARRAY[3.0, 12.0])
     > weave_bm25f(ARRAY[to_wdoc('unrelated filler'), to_wdoc('widget text')],
                'widget'::wquery, ARRAY[8.0, 1.0], 200.0, ARRAY[3.0, 12.0])
       AS bm25f_title_weight_wins;
 bm25f_title_weight_wins 
-------------------------
 t
(1 row)

-- field that is NULL (not merely empty) is skipped (docnull[f] branch)
SELECT weave_bm25f(ARRAY[to_wdoc('alpha'), NULL],
                'alpha'::wquery, ARRAY[1.0, 1.0], 100.0, ARRAY[1.0, 1.0]) > 0
       AS bm25f_null_field_skipped;
 bm25f_null_field_skipped 
--------------------------
 t
(1 row)

-- avgdl <= 0 for one field clamps to 1.0 (avgdl <= 0.0 branch)
SELECT weave_bm25f(ARRAY[to_wdoc('alpha beta')],
                'alpha'::wquery, ARRAY[1.0], 100.0, ARRAY[0.0]) >= 0
       AS bm25f_avgdl_zero_clamped;
 bm25f_avgdl_zero_clamped 
--------------------------
 t
(1 row)

-- NULL weight/avgdl element in the arrays (wnull/avgnull branches)
SELECT weave_bm25f(ARRAY[to_wdoc('alpha beta')],
                'alpha'::wquery, ARRAY[NULL]::float8[], 100.0, ARRAY[NULL]::float8[]) >= 0
       AS bm25f_null_weight_avgdl;
 bm25f_null_weight_avgdl 
-------------------------
 t
(1 row)

-- multi-term query where each term is present in a different field
-- (exercises the per-term loop body running twice, each visiting all fields)
SELECT weave_bm25f(ARRAY[to_wdoc('alpha'), to_wdoc('beta')],
                'alpha | beta'::wquery, ARRAY[1.0, 1.0], 100.0, ARRAY[3.0, 3.0]) > 0
       AS bm25f_multiterm;
 bm25f_multiterm 
-----------------
 t
(1 row)

-- weave_distance / weave_distance_commutator NULL-argument short-circuits.
SELECT weave_distance(NULL, 'fox'::wquery) IS NULL AS dist_null_doc,
       weave_distance(to_wdoc('fox'), NULL) IS NULL AS dist_null_query;
 dist_null_doc | dist_null_query 
---------------+-----------------
 t             | t
(1 row)

SELECT weave_distance_commutator(NULL, to_wdoc('fox')) IS NULL AS distc_null_query,
       weave_distance_commutator('fox'::wquery, NULL) IS NULL AS distc_null_doc;
 distc_null_query | distc_null_doc 
------------------+----------------
 t                | t
(1 row)

-- non-null direct calls (the real scoring path, both directions agree)
SELECT weave_distance(to_wdoc('the quick brown fox'), 'quick'::wquery) =
       weave_distance_commutator('quick'::wquery, to_wdoc('the quick brown fox'))
       AS dist_direct_agrees;
 dist_direct_agrees 
--------------------
 t
(1 row)

-- ============================================================================
-- Coverage: pg_weave_docvalid.h (weave_doc_check, via weave_doc_is_valid) -- the
-- "normal" (accept) side of every guard: header-fits, VARSIZE<=sz,
-- version match, entries[]+lexbytes fits, each term's lexeme slice fits, the
-- positions-present branch (both taken and not-taken), positions region fits,
-- and each term's tf/posoff run fits.  weave_doc_is_valid is called on every
-- document while it sits in the PENDING LIST (both when it is flushed to a
-- segment by weave_merge/weave_vacuum and when a scan walks the pending list
-- directly), so a variety of pending docs -- empty, single-token, multi-term,
-- with and without positions, high tf -- exercises the accept path of every
-- guard in weave_doc_check for both the flags-has-positions and
-- flags-no-positions shapes.  The reject ("return 0") side of each guard is a
-- pure corruption/defensive check: it requires a hand-corrupted WeaveDoc image
-- (bad nterms/off/len/tf/posoff/VARSIZE) that no SQL-level constructor can
-- produce -- weave_doc_build validates before returning, wdoc_recv bounds nterms
-- and every length against the message size, and to_wdoc/to_wdoc(tsvector)
-- always build a well-formed image.  That side is exactly what
-- test/fuzz/fuzz_docvalid.c targets instead (its own header comment says so).
-- ============================================================================
CREATE TABLE dv (id serial, d wdoc);
CREATE INDEX dv_idx ON dv USING weave (d);
-- empty doc: nterms=0, no positions -- entries[]/lexeme loops execute 0 times
INSERT INTO dv (d) VALUES (to_wdoc(''));
-- single-token doc: nterms=1, tf=1, WITH positions (default text path sets
-- WEAVE_DOCF_POSITIONS) -- the positions-present branch, one posoff/tf run
INSERT INTO dv (d) VALUES (to_wdoc('lonely'));
-- multi-term doc with a high-tf term (many positions for one entry) --
-- exercises a term whose [posoff, posoff+tf) run is the bulk of positions[]
INSERT INTO dv (d) VALUES (to_wdoc(repeat('alpha ', 50) || 'beta gamma delta'));
-- built from a tsvector directly (to_wdoc_from_tsvector): a different doc
-- builder feeding the same weave_doc_is_valid checks
INSERT INTO dv (d) VALUES (to_wdoc(to_tsvector('english', 'search engines index text')));
-- tsvector built from an EMPTY string: another nterms=0 shape, but produced by
-- the tsvector-adoption path (to_wdoc_from_tsvector), not weave_analyze_text
INSERT INTO dv (d) VALUES (to_wdoc(to_tsvector('english', '')));
-- a stripped tsvector (no positions at all) -> positions-absent branch via the
-- tsvector path specifically (all-or-nothing degrades to positions-off)
INSERT INTO dv (d) VALUES (to_wdoc(strip(to_tsvector('english', 'no positions here'))));
-- every doc above went through aminsert (index created before the inserts),
-- so it sits in the PENDING LIST, not a built segment.
-- pending-list SCAN path: query while still pending, so weave_doc_is_valid runs
-- over the raw pending page bytes for every row above.
SET enable_seqscan = off;
SELECT count(*) AS dv_pending_scan_hits FROM dv WHERE d @@@ 'alpha'::wquery;
 dv_pending_scan_hits 
----------------------
                    1
(1 row)

RESET enable_seqscan;
-- pending-list FLUSH path: weave_merge folds every pending doc into a segment,
-- running weave_doc_is_valid over each one again during the flush.
SELECT weave_merge('dv_idx'::regclass) IS NOT NULL AS dv_merged;
 dv_merged 
-----------
 t
(1 row)

SET enable_seqscan = off;
SELECT count(*) AS dv_after_merge FROM dv WHERE d @@@ 'alpha'::wquery;
 dv_after_merge 
----------------
              1
(1 row)

RESET enable_seqscan;
DROP TABLE dv;
-- binary recv/send round-trips of the same doc shapes, through the wire format
-- (wdoc_recv re-derives nterms/doclen/has_pos from message bytes and rebuilds
-- via weave_doc_build, so this is a second, independent path to the same
-- well-formed images that then flow through weave_doc_is_valid once indexed).
CREATE TEMP TABLE dvrt (id int, d wdoc);
INSERT INTO dvrt VALUES
  (1, to_wdoc('')),
  (2, to_wdoc('single')),
  (3, to_wdoc('alpha beta alpha gamma alpha delta'));
-- binary send/recv round-trip via COPY (FORMAT binary): send serializes each
-- wdoc, recv (internal) re-derives nterms/doclen/has_pos and rebuilds it.
CREATE TEMP TABLE dvrt_bin (LIKE dvrt INCLUDING ALL);
COPY dvrt TO '/tmp/dvrt.bin' WITH (FORMAT binary);
COPY dvrt_bin FROM '/tmp/dvrt.bin' WITH (FORMAT binary);
SELECT bool_and(a.d::text = b.d::text) AS dv_binary_roundtrip_ok
  FROM dvrt a JOIN dvrt_bin b USING (id);
 dv_binary_roundtrip_ok 
------------------------
 t
(1 row)

CREATE INDEX dvrt_idx ON dvrt USING weave (d);
SET enable_seqscan = off;
SELECT count(*) AS dvrt_hits FROM dvrt WHERE d @@@ 'alpha'::wquery;
 dvrt_hits 
-----------
         1
(1 row)

RESET enable_seqscan;
-- ============================================================================
-- Coverage: pg_weave_aux.c -- weave_highlight / weave_snippet, i.e. tokenize_and_mark
-- and its callers.  Exercise: is_token_byte's >=0x80 (unicode) branch, a
-- leading/trailing/only-separator source (the "i > sepstart" emit and the
-- "i >= len" break), a query that matches nothing (ctx.n == 0 in snippet),
-- a multi-term query, a phrase query, and the match at the very start, middle
-- and end of the source text.
-- ============================================================================
-- match at the START of the text (first token matched, sepstart==i==0 skip)
SELECT weave_highlight('needle in a haystack', 'needle'::wquery) AS hl_match_start;
       hl_match_start        
-----------------------------
 <b>needle</b> in a haystack
(1 row)

-- match in the MIDDLE
SELECT weave_highlight('a haystack with needle inside', 'needle'::wquery) AS hl_match_middle;
           hl_match_middle            
--------------------------------------
 a haystack with <b>needle</b> inside
(1 row)

-- match at the very END (no trailing separator run)
SELECT weave_highlight('a haystack with a needle', 'needle'::wquery) AS hl_match_end;
          hl_match_end           
---------------------------------
 a haystack with a <b>needle</b>
(1 row)

-- leading separator run before the first token ("i > sepstart" sink call)
SELECT weave_highlight('   leading spaces then needle', 'needle'::wquery) AS hl_leading_sep;
            hl_leading_sep            
--------------------------------------
    leading spaces then <b>needle</b>
(1 row)

-- trailing separator run after the last token
SELECT weave_highlight('needle then trailing spaces   ', 'needle'::wquery) AS hl_trailing_sep;
            hl_trailing_sep            
---------------------------------------
 <b>needle</b> then trailing spaces   
(1 row)

-- text that is PURE separators (no token at all): the loop hits "i >= len"
-- immediately on its first (and only) separator scan
SELECT weave_highlight('    ...   ', 'needle'::wquery) AS hl_all_separators;
 hl_all_separators 
-------------------
     ...   
(1 row)

-- empty text: len == 0, loop body never runs
SELECT weave_highlight('', 'needle'::wquery) AS hl_empty_text;
 hl_empty_text 
---------------
 
(1 row)

-- multi-term query (OR): several distinct tokens matched in one pass
SELECT weave_highlight('alpha in the middle beta at the end', 'alpha | beta'::wquery) AS hl_multiterm;
                   hl_multiterm                    
---------------------------------------------------
 <b>alpha</b> in the middle <b>beta</b> at the end
(1 row)

-- phrase query: tokenize_and_mark only marks per-token query_has_term hits;
-- highlight marks each phrase word independently (documented literal behavior)
SELECT weave_highlight('the quick brown fox', '"quick brown"'::wquery) AS hl_phrase;
             hl_phrase             
-----------------------------------
 the <b>quick</b> <b>brown</b> fox
(1 row)

-- unicode text: tokens with bytes >= 0x80 (is_token_byte's first branch)
SELECT weave_highlight('café naïve façade', 'café'::wquery) AS hl_unicode;
        hl_unicode        
--------------------------
 <b>café</b> naïve façade
(1 row)

-- weave_snippet: same shapes, plus the ctx.n == 0 (no real tokens at all) path.
SELECT weave_snippet('needle in a haystack', 'needle'::wquery) AS snip_match_start;
      snip_match_start       
-----------------------------
 <b>needle</b> in a haystack
(1 row)

SELECT weave_snippet('a haystack with needle inside', 'needle'::wquery) AS snip_match_middle;
          snip_match_middle           
--------------------------------------
 a haystack with <b>needle</b> inside
(1 row)

SELECT weave_snippet('a haystack with a needle', 'needle'::wquery) AS snip_match_end;
         snip_match_end          
---------------------------------
 a haystack with a <b>needle</b>
(1 row)

SELECT weave_snippet('   leading spaces then needle', 'needle'::wquery) AS snip_leading_sep;
         snip_leading_sep          
-----------------------------------
 leading spaces then <b>needle</b>
(1 row)

-- pure separators: no real tokens recorded by snip_sink -> ctx.n == 0 -> ''
SELECT weave_snippet('    ...   ', 'needle'::wquery) AS snip_all_separators;
 snip_all_separators 
---------------------
 
(1 row)

SELECT weave_snippet('', 'needle'::wquery) AS snip_empty_text;
 snip_empty_text 
-----------------
 
(1 row)

SELECT weave_snippet('alpha in the middle beta at the end', 'alpha | beta'::wquery) AS snip_multiterm;
                  snip_multiterm                   
---------------------------------------------------
 <b>alpha</b> in the middle <b>beta</b> at the end
(1 row)

SELECT weave_snippet('the quick brown fox', '"quick brown"'::wquery) AS snip_phrase2;
           snip_phrase2            
-----------------------------------
 the <b>quick</b> <b>brown</b> fox
(1 row)

SELECT weave_snippet('café naïve façade', 'café'::wquery) AS snip_unicode;
       snip_unicode       
--------------------------
 <b>café</b> naïve façade
(1 row)

-- window narrower than the doc (best_start > 0 path: ellipsis before the window)
SELECT weave_snippet(repeat('filler ', 30) || 'needle ' || repeat('trailer ', 30),
                   'needle'::wquery, '<b>', '</b>', ' ... ', 3) AS snip_windowed;
             snip_windowed             
---------------------------------------
  ... filler filler <b>needle</b> ... 
(1 row)

-- ============================================================================
-- Coverage: pg_weave_match.c -- weave_doc_matches (the RPN stack evaluator) and
-- weave_match / weave_match_commutator directly on an wdoc value (no index).
-- AND both-present/one-missing, OR, NOT, nested boolean, phrase present/
-- absent, NEAR present/absent, prefix, an empty query, an empty doc, and a
-- phrase/NEAR degrading to AND-only when the doc has no stored positions
-- (phrase_step's "either side lacks positions" branch).
-- ============================================================================
-- AND: both present, and one missing
SELECT to_wdoc('alpha beta') @@@ 'alpha & beta'::wquery AS and_both_present;
 and_both_present 
------------------
 t
(1 row)

SELECT to_wdoc('alpha only') @@@ 'alpha & beta'::wquery AS and_one_missing;
 and_one_missing 
-----------------
 f
(1 row)

-- OR: either side present, both absent
SELECT to_wdoc('alpha only') @@@ 'alpha | beta'::wquery AS or_left_present;
 or_left_present 
-----------------
 t
(1 row)

SELECT to_wdoc('beta only') @@@ 'alpha | beta'::wquery AS or_right_present;
 or_right_present 
------------------
 t
(1 row)

SELECT to_wdoc('gamma only') @@@ 'alpha | beta'::wquery AS or_both_absent;
 or_both_absent 
----------------
 f
(1 row)

-- NOT: present flips to absent and vice versa
SELECT to_wdoc('alpha') @@@ '!alpha'::wquery AS not_present_flips;
 not_present_flips 
-------------------
 f
(1 row)

SELECT to_wdoc('beta') @@@ '!alpha'::wquery AS not_absent_flips;
 not_absent_flips 
------------------
 t
(1 row)

-- nested boolean: (a & b) | (!c)
SELECT to_wdoc('alpha beta') @@@ '(alpha & beta) | !gamma'::wquery AS nested_and_or;
 nested_and_or 
---------------
 t
(1 row)

SELECT to_wdoc('gamma') @@@ '(alpha & beta) | !gamma'::wquery AS nested_falls_to_not;
 nested_falls_to_not 
---------------------
 f
(1 row)

-- phrase: present (adjacent) and absent (not adjacent) on a POSITIONAL doc
SELECT to_wdoc('the quick brown fox') @@@ '"quick brown"'::wquery AS phrase_present;
 phrase_present 
----------------
 t
(1 row)

SELECT to_wdoc('the quick red brown fox') @@@ '"quick brown"'::wquery AS phrase_absent;
 phrase_absent 
---------------
 f
(1 row)

-- NEAR: present (within k) and absent (beyond k)
SELECT to_wdoc('quick brown red fox') @@@ 'NEAR(quick fox, 3)'::wquery AS near_present;
 near_present 
--------------
 t
(1 row)

SELECT to_wdoc('quick brown red slow lazy fox') @@@ 'NEAR(quick fox, 2)'::wquery AS near_absent;
 near_absent 
-------------
 f
(1 row)

-- prefix: matches any term starting with the prefix
SELECT to_wdoc('development environment') @@@ 'develop*'::wquery AS prefix_hit;
 prefix_hit 
------------
 t
(1 row)

SELECT to_wdoc('unrelated words') @@@ 'develop*'::wquery AS prefix_miss;
 prefix_miss 
-------------
 f
(1 row)

-- empty query matches nothing (weave_doc_matches: nitems == 0 -> false)
SELECT to_wdoc('anything at all') @@@ ''::wquery AS empty_query_no_match;
 empty_query_no_match 
----------------------
 f
(1 row)

-- empty doc matches nothing against any real query (term lookup finds nothing)
SELECT to_wdoc('') @@@ 'anything'::wquery AS empty_doc_no_match;
 empty_doc_no_match 
--------------------
 f
(1 row)

-- empty query against an empty doc
SELECT to_wdoc('') @@@ ''::wquery AS empty_query_empty_doc;
 empty_query_empty_doc 
-----------------------
 f
(1 row)

-- phrase/NEAR on a doc built WITHOUT positions (canonical literal, no '@'):
-- phrase_step's "either side lacks positions" branch degrades to plain AND,
-- so a non-adjacent phrase still matches when both terms are merely present.
SELECT $$'brown':1 'quick':1$$::wdoc @@@ '"quick brown"'::wquery AS phrase_nopos_degrades_to_and;
 phrase_nopos_degrades_to_and 
------------------------------
 t
(1 row)

SELECT $$'fox':1 'quick':1$$::wdoc @@@ 'NEAR(quick fox, 1)'::wquery AS near_nopos_degrades_to_and;
 near_nopos_degrades_to_and 
----------------------------
 t
(1 row)

-- the commutator form (wquery @@@ wdoc) agrees with weave_match in both
-- directions for the same boolean/phrase/NEAR cases above
SELECT ('alpha & beta'::wquery @@@ to_wdoc('alpha beta'))
     = (to_wdoc('alpha beta') @@@ 'alpha & beta'::wquery) AS match_commutator_and;
 match_commutator_and 
----------------------
 t
(1 row)

SELECT ('"quick brown"'::wquery @@@ to_wdoc('the quick brown fox'))
     = (to_wdoc('the quick brown fox') @@@ '"quick brown"'::wquery) AS match_commutator_phrase;
 match_commutator_phrase 
-------------------------
 t
(1 row)

SELECT ('NEAR(quick fox, 3)'::wquery @@@ to_wdoc('quick brown red fox'))
     = (to_wdoc('quick brown red fox') @@@ 'NEAR(quick fox, 3)'::wquery) AS match_commutator_near;
 match_commutator_near 
-----------------------
 t
(1 row)

-- weave_match / weave_match_commutator called directly (function-call form)
SELECT weave_match(to_wdoc('alpha beta'), 'alpha & beta'::wquery) AS fn_match_and;
 fn_match_and 
--------------
 t
(1 row)

SELECT weave_match_commutator('alpha & beta'::wquery, to_wdoc('alpha beta')) AS fn_match_commutator_and;
 fn_match_commutator_and 
-------------------------
 t
(1 row)

-- ============================================================================
-- Coverage: BM25F NULL-element array paths + pushdown-rejection shapes
-- (pg_weave_rank.c per-field NULL handling; pg_weave_customscan.c gating)
-- ============================================================================
-- BM25F with NULL ELEMENTS inside the arrays (docnull/wnull/avgnull/dfs NULL):
-- a NULL doc field is skipped; NULL weight/avgdl default to 1.0; NULL dfs -> 1.0.
SELECT weave_bm25f(ARRAY[to_wdoc('postgres'), NULL]::wdoc[],
                 'postgres'::wquery, ARRAY[2.0,1.0], 100, ARRAY[1.0,1.0]) > 0 AS bm25f_null_field;
 bm25f_null_field 
------------------
 t
(1 row)

SELECT weave_bm25f(ARRAY[to_wdoc('postgres'), to_wdoc('body')],
                 'postgres'::wquery, ARRAY[NULL,1.0]::float8[], 100, ARRAY[1.0,1.0]) >= 0 AS bm25f_null_weight;
 bm25f_null_weight 
-------------------
 t
(1 row)

SELECT weave_bm25f(ARRAY[to_wdoc('postgres'), to_wdoc('body')],
                 'postgres'::wquery, ARRAY[2.0,1.0], 100, ARRAY[NULL,1.0]::float8[]) >= 0 AS bm25f_null_avgdl;
 bm25f_null_avgdl 
------------------
 t
(1 row)

SELECT weave_bm25f(ARRAY[to_wdoc('a b'), to_wdoc('c d')],
                 'a & c'::wquery, ARRAY[1.0,1.0], 100, ARRAY[2.0,2.0], ARRAY[NULL,3.0]::float8[]) >= 0 AS bm25f_null_dfs;
 bm25f_null_dfs 
----------------
 t
(1 row)

-- three fields; title (field 0) weighted heavily -> a title-only hit scores
-- higher than a body-only hit
SELECT weave_bm25f(ARRAY[to_wdoc('term'), to_wdoc('x'), to_wdoc('y')],
                 'term'::wquery, ARRAY[9.0,1.0,1.0], 100, ARRAY[1.0,1.0,1.0])
     > weave_bm25f(ARRAY[to_wdoc('x'), to_wdoc('y'), to_wdoc('term')],
                 'term'::wquery, ARRAY[9.0,1.0,1.0], 100, ARRAY[1.0,1.0,1.0]) AS bm25f_field_weight;
 bm25f_field_weight 
--------------------
 t
(1 row)

-- an empty wdoc field (doclen 0) is handled
SELECT weave_bm25f(ARRAY[to_wdoc(''), to_wdoc('term body')],
                 'term'::wquery, ARRAY[2.0,1.0], 100, ARRAY[1.0,2.0]) >= 0 AS bm25f_empty_field;
 bm25f_empty_field 
-------------------
 t
(1 row)

-- Count-pushdown rejection: shapes that must NOT push down (still correct).
CREATE TABLE psh (id serial, d wdoc, txt text);
INSERT INTO psh(d, txt) SELECT to_wdoc('english','term'||(g%4)||' body'), 'plain'||(g%3) FROM generate_series(1,200) g;
CREATE INDEX psh_idx ON psh USING weave (d);
CREATE INDEX psh_txt ON psh (txt);   -- a NON-weave index on the same rel
SET enable_seqscan = off;
-- @@@ with a NON-constant RHS (a subquery-derived value) -> RHS not a plan Const
SELECT count(*) FROM psh WHERE d @@@ (SELECT 'term1'::wquery);
 count 
-------
    50
(1 row)

-- two @@@ quals -> more than one qual, no single-@@@ pushdown
SELECT count(*) FROM psh WHERE d @@@ 'term1'::wquery AND d @@@ 'body'::wquery;
 count 
-------
    50
(1 row)

-- @@@ on a rel where the matched column also has a non-weave index (index-list walk)
SELECT count(*) FROM psh WHERE d @@@ 'term1'::wquery;
 count 
-------
    50
(1 row)

-- count over a rel with NO weave index at all (LHS has no matching weave index)
SELECT count(*) FROM psh WHERE txt = 'plain1';
 count 
-------
    67
(1 row)

RESET enable_seqscan;
DROP TABLE psh;
-- ============================================================================
-- Coverage: weave_highlight / weave_snippet edges (pg_weave_aux.c) + wdoc validity
-- ============================================================================
-- highlight/snippet: match at start, middle, end; no match; empty; multi-term;
-- phrase; unicode.
SELECT weave_highlight('the quick brown fox', 'quick'::wquery) LIKE '%quick%' AS hl_mid;
 hl_mid 
--------
 t
(1 row)

SELECT weave_highlight('quick brown fox', 'quick'::wquery) LIKE '%quick%' AS hl_start;
 hl_start 
----------
 t
(1 row)

SELECT weave_highlight('brown fox quick', 'quick'::wquery) LIKE '%quick%' AS hl_end;
 hl_end 
--------
 t
(1 row)

SELECT weave_highlight('brown fox', 'zebra'::wquery) AS hl_nomatch;
 hl_nomatch 
------------
 brown fox
(1 row)

SELECT weave_highlight('', 'x'::wquery) AS hl_empty;
 hl_empty 
----------
 
(1 row)

SELECT weave_highlight('the quick brown fox', 'quick & fox'::wquery) LIKE '%quick%' AS hl_multi;
 hl_multi 
----------
 t
(1 row)

SELECT length(weave_snippet('the quick brown fox jumps over the lazy dog', 'fox'::wquery)) > 0 AS snip_mid;
 snip_mid 
----------
 t
(1 row)

SELECT weave_snippet('nothing here', 'zebra'::wquery) IS NOT NULL AS snip_nomatch;
 snip_nomatch 
--------------
 t
(1 row)

SELECT length(weave_snippet(repeat('word ', 200) || 'target ' || repeat('more ', 200), 'target'::wquery)) > 0 AS snip_long;
 snip_long 
-----------
 t
(1 row)

-- wdoc validity across edge shapes (pg_weave_docvalid.h via index build)
CREATE TABLE dv (id serial, d wdoc);
INSERT INTO dv(d) VALUES (to_wdoc('')), (to_wdoc('one')),
  (to_wdoc('a a a a a')), (to_wdoc('english','the the the')),
  (to_wdoc(to_tsvector('english','')));
CREATE INDEX dv_idx ON dv USING weave (d);
SET enable_seqscan = off;
SELECT count(*) = 1 AS one_hit FROM dv WHERE d @@@ 'one'::wquery;
 one_hit 
---------
 t
(1 row)

RESET enable_seqscan;
DROP TABLE dv;
-- ============================================================================
-- Field-targeted (weight-zone) search (v1.4.0): to_wdoc(cfg,text,weight),
-- setwdocweight, wdoc || wdoc, and term:LABEL query restriction.
-- ============================================================================
-- labelled analysis renders with the label; concat re-bases + preserves labels
SELECT to_wdoc('english','Vacuum contention','A')::text AS subj_A;
            subj_a            
------------------------------
 'content':1@2A 'vacuum':1@1A
(1 row)

SELECT (to_wdoc('english','vacuum lock','A') || to_wdoc('english','the vacuum runs','C'))::text AS concat_shared;
              concat_shared              
-----------------------------------------
 'lock':1@2A 'run':1@5C 'vacuum':2@1A,4C
(1 row)

SELECT setwdocweight(to_wdoc('english','vacuum'),'B')::text AS relabelled;
  relabelled   
---------------
 'vacuum':1@1B
(1 row)

-- render round-trips through the input parser
SELECT (to_wdoc('english','vacuum','A')::text)::wdoc::text = to_wdoc('english','vacuum','A')::text AS roundtrip;
 roundtrip 
-----------
 t
(1 row)

-- wquery renders the weight mask (tsquery-style term:A)
SELECT to_wquery('english','vacuum:A')::text AS q_wa, to_wquery('english','x:AB')::text AS q_ab;
    q_wa    |  q_ab  
------------+--------
 'vacuum':A | 'x':AB
(1 row)

-- value-path matching: subject-zone vacuum vs body-zone vacuum
SELECT weave_match(to_wdoc('english','vacuum problem','A') || to_wdoc('english','lock contention','C'),
                 to_wquery('english','vacuum:A')) AS subj_hit;                              -- t
 subj_hit 
----------
 t
(1 row)

SELECT weave_match(to_wdoc('english','lock','A') || to_wdoc('english','run vacuum','C'),
                 to_wquery('english','vacuum:A')) AS body_no_subj;                          -- f
 body_no_subj 
--------------
 f
(1 row)

SELECT weave_match(to_wdoc('english','lock','A') || to_wdoc('english','run vacuum','C'),
                 to_wquery('english','vacuum')) AS unrestricted;                            -- t
 unrestricted 
--------------
 t
(1 row)

-- multi-zone AND + multi-label mask
SELECT weave_match(to_wdoc('english','vacuum','A') || to_wdoc('english','tgl','B'),
                 to_wquery('english','vacuum:A & tgl:B')) AS multi_zone;                    -- t
 multi_zone 
------------
 t
(1 row)

SELECT weave_match(to_wdoc('english','x','A') || to_wdoc('english','vacuum','B'),
                 to_wquery('english','vacuum:AB')) AS mask_ab;                              -- t
 mask_ab 
---------
 t
(1 row)

-- unlabelled (v3-style) doc: label D matches, others do not
SELECT weave_match(to_wdoc('english','vacuum'), to_wquery('english','vacuum:A')) AS plain_a;  -- f
 plain_a 
---------
 f
(1 row)

SELECT weave_match(to_wdoc('english','vacuum'), to_wquery('english','vacuum:D')) AS plain_d;  -- t
 plain_d 
---------
 t
(1 row)

-- weighted prefix / fuzzy / regex are rejected
SELECT to_wquery('english','vac:A*');       -- error
ERROR:  syntax error in wquery: "vac:A*"
SELECT to_wquery('english','vac:A~1');      -- error
ERROR:  syntax error in wquery: "vac:A~1"
-- index-path parity: field restriction through the weave index == seqscan truth,
-- for count(*), weave_count, and a scan.
CREATE TABLE zmsg (id serial, subject text, body text, d wdoc);
INSERT INTO zmsg(subject, body) VALUES
 ('vacuum tuning', 'locks and contention'),
 ('lock contention', 'run vacuum often'),
 ('checkpoint', 'vacuum and checkpoint');
UPDATE zmsg SET d = to_wdoc('english', subject, 'A') || to_wdoc('english', body, 'C');
CREATE INDEX zmsg_weave ON zmsg USING weave (d) WITH (positions = on);
SET enable_seqscan = off;
SELECT array_agg(id ORDER BY id) AS idx_subjA FROM zmsg WHERE d @@@ to_wquery('english','vacuum:A');  -- {1}
 idx_subja 
-----------
 {1}
(1 row)

SELECT weave_count('zmsg_weave', to_wquery('english','vacuum:A')) AS cnt_subjA;                           -- 1
 cnt_subja 
-----------
         1
(1 row)

SELECT weave_count('zmsg_weave', to_wquery('english','vacuum')) AS cnt_any;                               -- 3
 cnt_any 
---------
       3
(1 row)

SET enable_indexscan = off; SET enable_bitmapscan = off;
SELECT array_agg(id ORDER BY id) AS seq_subjA FROM zmsg WHERE d @@@ to_wquery('english','vacuum:A');  -- {1}
 seq_subja 
-----------
 {1}
(1 row)

RESET enable_indexscan; RESET enable_bitmapscan; RESET enable_seqscan;
DROP TABLE zmsg;
-- ============================================================================
-- Upgrade compatibility: an index/value built WITHOUT weight labels (as by
-- pre-1.4.0, and by the 2-arg to_wdoc) reads correctly under 1.4.0 -- every
-- position is label D, so unrestricted queries are unchanged, term:D matches,
-- and term:A/B/C does not.  This is the "no REINDEX" guarantee: existing
-- unlabelled indexes keep working; only rebuilding from labelled docs adds
-- field provenance.
CREATE TABLE zold (id serial, d wdoc);
INSERT INTO zold(d) SELECT to_wdoc('english','vacuum lock number '||g) FROM generate_series(1,200) g;
CREATE INDEX zold_weave ON zold USING weave (d) WITH (positions = on);
SET enable_seqscan = off;
-- unrestricted query unchanged (all 200 rows contain vacuum)
SELECT count(*) = 200 AS unrestricted_ok FROM zold WHERE d @@@ to_wquery('english','vacuum');
 unrestricted_ok 
-----------------
 t
(1 row)

-- term:D matches unlabelled data (unlabelled == D)
SELECT count(*) = 200 AS labelD_matches FROM zold WHERE d @@@ to_wquery('english','vacuum:D');
 labeld_matches 
----------------
 t
(1 row)

-- term:A does NOT match unlabelled data
SELECT count(*) = 0 AS labelA_no_match FROM zold WHERE d @@@ to_wquery('english','vacuum:A');
 labela_no_match 
-----------------
 t
(1 row)

-- phrase still works on the unlabelled positions index
SELECT count(*) = 200 AS phrase_ok FROM zold WHERE d @@@ '"vacuum lock"'::wquery;
 phrase_ok 
-----------
 t
(1 row)

RESET enable_seqscan;
DROP TABLE zold;
